,Author,Judul Berita,Date,Link,Content
52,Maria Flora,"Ganjil Genap Jakarta Selasa 29 Maret 2022, Mobil Bernomor Ganjil Bisa Lewati 13 Titik Ini",29 Maret 2022 09:04 WIB,https://www.liputan6.com/news/read/4923796/ganjil-genap-jakarta-selasa-29-maret-2022-mobil-bernomor-ganjil-bisa-lewati-13-titik-ini,"Liputan6.com, Jakarta Sistem ganjil genap hari ini, Selasa (29/3/2022) berlaku untuk kendaraan roda empat bernomor ganjil. Ada pun 13 ruas jalan di Ibu Kota yang hari ini dapat dilintasi mobil berpelat ganjil adalah Jalan MH Thamrin, Jalan HR Rasuna Said, Jalan Jendral Sudirman, Jalan MT Haryono, Jalan Panglima Polim, dan Jalan Sisingamangaraja. Kemudian Jalan Gunung Sahari, Jalan Gatot Subroto, Jalan Fatmawati, Jalan Tomang Raya, Jalan Ahmad Yani, Jalan DI Panjaitan, dan Jalan S Parman.Jadwal pemberlakuan sistem ganjil genap Jakarta masih tetap sama. Senin hingga Jumat dimulai pada pukul 06.00 - 10.00 WIB, sedangkan sore hari dimulai 16.00 - 21.00 WIB.""Ganjil genap masih tetap di 13 kawasan, karena kami melihat, mencermati, apakah terjadi shifting atau perpindahan dari transportasi pribadi ke umum,"" jelas Dirlantas Polda Metro Jaya Kombes Sambodo Purnomo Yugo dikutip Antara, Rabu, 9 Februari 2022.Skema ganjil genap tetap berlaku meski Pemberlakuan Pembatasan Kegiatan Masyarakat (PPKM) Jawa-Bali, khususnya Ibu Kota turun ke Level 2.Lantas, bagaimana dengan lokasi wisata? Sebelumnya, sistem ganjil genap juga diterapkan untuk sejumlah lokasi wisata di Ibu Kota. Namun, terhitung Jumat, 18 Februari 2022, ganjil genap tak lagi diberlakukan. Hal ini tertuang lewat SK Kadishub DKI Jakarta Nomor 80 tahun 2022.""Mulai besok ganjil genap di lokasi wisata itu ditiadakan,"" kata Kepala Dinas Perhubungan DKI Jakarta Syafrin Liputo saat dikonfirmasi pada Kamis malam, 17 Februari 2022.Ada pun yang menjadi pertimbangan melihat rendahnya intensitas kendaraan yang melaju di sekitar ruas jalan tempat wisata dan adanya pembatasan bagi pengunjung."
53,Fahmi Rizki,Modifikasi Lamborghini Urus Hadirkan Nuansa Misterius untuk SUV Premium,29 Maret 2022 09:03 WIB,https://www.liputan6.com/otomotif/read/4923096/modifikasi-lamborghini-urus-hadirkan-nuansa-misterius-untuk-suv-premium,"Liputan6.com, Jakarta - Meski secara tampilan SUV premium Lamborghini Urus sudah hadir dengan tampilan yang menggoda, namun tidak menyurutkan niat Platinum Group, salah satu tuner untuk berkreasi dengan model tersebut.Melihat hasil yang dipamerkan, Lamborghini Urus ini menjadi lebih sedap dipandang meskipun modifikasi yang dilakukan terbilang minor. Dari eksteriornya, tuner ini cukup bermain dengan penggunaan warna grey matte yang memberikan kesan agresif dan misterius.Seluruh bagian luarnya, dilapisi dengan warna tersebut dengan harapan memberikan sesuatu yang baru dan tampil lebih maskulin. Selain itu, SUV Lamborghini ini juga turut menghadirkan pengaplikasian bodykit dari 1016 Industries yang membuat mobil ini lebih terlihat lebih jantan.Bodykit tersebut meliputi wajah depan direvisi lewat splitter yang lebih mencolok, wheel arch depan belakang yang lebih lebar, side skirt yang unik, spoiler yang dipasang di bagian atas, bumper belakang yang unik serta ditambah dengan diffuser serat karbon. Dengan modifikasi yang disematkan ini, tentunya akan membuat mobil lansiran Italia ini menjadi lebih memesona.Selain itu, untuk melengkapi tampilan yang lebih menggoda, SUV Lamborghini Urus, juga hadir dengan kaki-kaki yang begitu mumpuni. Tidak tanggung-tanggung, Platinum Group, telah memilih velg berukuran 24 inci besutan Forgiato berkelir hitam. Untuk sektor pembuangannya, Lamborghini Urus, dibekali dengan komponen besutan Capristo yang di ujungnya terbuat dari bahan serat karbon.  Bicara mengenai performa jantung pacunya, tuner ini tidak melakukan ubahan pada sisi jantung pacu. Berdasarkan spesifikasi resminya, Lamborghini Urus ini dibekali dengan mesin V8 berkubikasi 4.0 liter dengan dukungan twin-turbocharged yang mampu memproduksi tenaga hingga 642 tk dan torsi puncak 850 Nm.Dengan tenaga tersebut, mobil ini diklaim dapat melesat dari posisi diam hingga 100 koj hanya dengan waktu 3,6 detik dan mampu menembus kecepatan maksimum 306 kpj."
54,Anri Syaiful,Infografis Anggaran Fantastis Pergantian Gorden dan Pengaspalan di DPR,29 Maret 2022 09:03 WIB,https://www.liputan6.com/news/read/4923510/infografis-anggaran-fantastis-pergantian-gorden-dan-pengaspalan-di-dpr,"Liputan6.com, Jakarta - Anggaran DPR yang dianggap fantastis kembali menjadi perbincangan hangat publik dalam beberapa hari terakhir. Anggaran DPR yang menjadi sorotan mengenai pergantian gorden dan pengaspalan jalan di Kompleks Gedung Parlemen, Senayan, Jakarta.Merujuk situs lpse.dpr.go.id, anggaran Rp 48,7 miliar akan digunakan untuk mengganti gorden dan blind di rumah dinas anggota DPR di Kalibata, Jakarta Selatan. Biaya itu nantinya akan diambil dari Anggaran Pendapatan dan Belanja Negara atau APBN 2022.Mengutip situs sirup.lkpp.go.id, DPR juga menganggarkan Rp 11 miliar untuk pelapisan aspal. Sumber anggaran juga berasal dari APBN 2022.Bukan kali ini saja ada anggaran maupun usulan anggaran DPR yang dianggap fantastis. Paling tidak dalam rentang 11 tahun, ada sejumlah anggaran fantastis DPR yang menjadi sorotan.Apa saja anggaran DPR yang menjadi perhatian tersebut? Bagaimana pula tanggapan DPR terkait sorotan anggaran fantastis pergantian gorden dan pengaspalan? Simak selengkapnya dalam rangkaian Infografis berikut ini:"
55,Delvira Hutabarat,AHY Temui Surya Paloh di Kantor Nasdem Hari Ini,29 Maret 2022 09:01 WIB,https://www.liputan6.com/news/read/4923835/ahy-temui-surya-paloh-di-kantor-nasdem-hari-ini,"Liputan6.com, Jakarta Ketua Umum Partai Demokrat, Agus Harimurti Yudhoyono (AHY) akan menemui Ketua Umum Partai NasDem Surya Paloh di Kantor DPP NasDem, hari ini, Selasa (29/3/2022).“Ketum AHY Akan silhaturhami kebangsaan dengan Ketum NasDem,” kata Jubir DPP Demokrat, Harzaky Mahendra Putra saat dikonfirmasi.Herzaky menyebut agenda pertemuan tersebut tidak hanya membahas Pilpres 2024 melainkan persoalan kebangsaan lainnya.“Membahas situasi terkini, isu-isu kebangsaan dan kerakyatan,” kata Harzaky.Sebelum AHY, Ketua Umum Golkar Airlangga Hartarto sudah lebih dulu mendatangi kantor NasDem untuk menemui Surya Paloh.Paloh menyatakan pertemuannya dengan Airlangga membahas soal usulan penundaan Pemilu 2024.""Terus terang saja kami mendiskusikan hal itu,"" kata Surya Paloh kepada wartawan, Kamis (10/3/2022).Paloh menyebut, meski ada perbedaan perspektif diantara kedua parpol, namun mereka Sepakat untuk tidak mempermasalahkan perbedaan itu.""Tidak perlu ada satu dikursus yang berkepanjangan. Silakan kalau memang para pihak bisa meyakini bahwasanya konsepsi gagasan tawaran pikiran itu bisa berjalan dan diteruskan. NasDem tetap menghargai, tapi NasDem tentunya sama saudara saya dari keluarga besar DPP Golkar, tidak ada perbedaan di antara kita,"" ujar Paloh.Sementara itu, Airlangga mengklaim bahwa sikap Golkar terhadap wacana penundaan pemilu berasal dari aspirasi masyarakat.""Dari Partai Golkar kami sudah sampaikan bahwa pertama tentu di masyarakat ada suara-suara yang harus kami serap. Kemudian, kedua, sudah bahas bahwa politik itu adalah kesepakatan dengan para ketua umum partai dan banyak hal yang harus dibahas, terutama ketua-ketua umum partai yang mendukung Bapak Presiden,"" ujar Airlangga."
56,Liputan6.com,"Harga Emas Pegadaian Kompak Turun 29 Maret 2022, Simak Daftarnya",29 Maret 2022 09:00 WIB,https://www.liputan6.com/bisnis/read/4923820/harga-emas-pegadaian-kompak-turun-29-maret-2022-simak-daftarnya,"Liputan6.com, Jakarta - Harga emas yang dijual oleh PT Pegadaian (persero) kompak turun pada perdagangan Selasa (29/3/2022). Seluruh harga emas untuk berbagai jenis dan ukuran yang dijual Pegadaian kompak turun pada perdagangan Selasa ini jika dibanding Senin kemarin.Untuk diketahui, Pegadaian menjual berbagai macam emas yaitu Emas Antam, Emas Batik, Emas UBS dan Retro. Sedangkan ukuran yang dijual mulai dari 0,5 gram hingga 1.000 gram atau 1 kilogram.Berdasarkan data informasi yang diperoleh dari halaman web resmi Pegadaian, harga emas 24 karat Emas Antam ukuran kecil yaitu 1 gram di jual seharga Rp 1.040.000. Sedangkan harga Emas UBS ukuran 1 gram dijual Rp 997.000Produk emas antam dan UBS selain ada di Pegadaian, juga tersedia di toko emas, butik masing-masing perusahaan. Dijual secara online maupun offline.Berikut rangkuman harga emas Pegadaian pada Selasa 29 Maret 2022:Harga Emas Antam- 0,5 gram = Rp 572.000- 1 gram = Rp 1.040.000- 2 gram = Rp 2.016.000- 3 gram = Rp 2.997.000- 5 gram = Rp 4.959.000- 10 gram = Rp 9.861.000- 25 gram = Rp 24.521.000- 50 gram = Rp 48.959.000- 100 gram = Rp 97.835.000- 250 gram = Rp 244.309.000- 500 gram = Rp 488.399.000- 1000 gram = Rp 976.132.000.  * Untuk mengetahui kebenaran informasi yang beredar, silakan WhatsApp ke nomor 0811 9787 670 hanya dengan ketik kata kunci yang diinginkan.- 0,5 gram = Rp 530.000- 1 gram = Rp 993.000- 2 gram = Rp 1.964.000- 3 gram = Rp 2.918.000- 5 gram = Rp 4.849.000- 10 gram = Rp 9.637.000- 25 gram = Rp 23.955.000- 50 gram = Rp 47.822.000- 100 gram = Rp 95.558.000.- 250 gram = Rp. 238.606.000- 500 gram = Rp. 476.983.000- 1000 gram =Rp. 953.922.000. - 0,5 gram = Rp 644.000- 1 gram = Rp 1.195.000- 8 gram = Rp 9.051.000. - 0,5 gram = Rp 532.000- 1 gram = Rp 997.000- 2 gram = Rp 1.978.000- 5 gram = Rp 4.887.000- 10 gram = Rp 9.721.000- 25 gram = Rp 24.254.000- 50 gram = Rp 48.406.000- 100 gram = Rp 96.774.000- 250 gram = Rp 241.863.000- 500 gram = Rp 483.156.000- 1000 gram = Rp 965.267.000.  Reporter: Stevanus Wisnu Murti"
57,Agustin Setyo Wardani,"Tak Bisa Pakai Android, Pembesut Smartphone Rusia Beralih ke HarmonyOS Milik Huawei?",29 Maret 2022 09:00 WIB,https://www.liputan6.com/tekno/read/4923189/tak-bisa-pakai-android-pembesut-smartphone-rusia-beralih-ke-harmonyos-milik-huawei,"Liputan6.com, Jakarta - Laporan media Rusia mengungkap, pemberlakuan sanksi AS membuat Google menghentikan sertifikasi smartphone Android untuk perusahaan ponsel Rusia, BQ.Laporan yang sama juga menyebut, sanksi itu membuat perusahaan Rusia itu kini menguji coba penggunaan HarmonyOS milik Huawei untuk perangkat besutan mereka.Mengutip Gizchina, Selasa (29/3/2022), ada klaim bahwa BQ Rusia akan merilis smartphone dengan dukungan HarmonyOS pada paruh kedua 2022.Namun, dalam laporan baru-baru ini, Huawei menjawab, mereka tak berencana untuk meluncurkan HarmonyOS di pasar luar negeri.""Sejak perilisannya, HarmonyOS disukai banyak konsumen. Hingga akhir 2021, 220 juta perangkat Huawei telah dilengkapi HarmonyOS. Kami sangat bersyukur banyak orang tertarik dengan HarmonyOS, namun belum ada rencana meluncurkan smartphone dengan HarmonyOS di luar negeri,"" kata Huawei.Banyak orang memakai pernyataan ini untuk mengklaim bahwa BQ Rusia tak akan memakai HarmonyOS untuk smartphone besutannya.Namun, bukan itu yang terjadi. Pernyataan Huawei di atas mengacu pada smartphone besutannya sendiri. Jika ditelaah, Huawei memang tidak berencana meluncurkan smartphone Huawei dengan HarmonyOS ke pasar luar negeri untuk saat ini.Hal itu tidak sama dengan merek asing tak bisa menggunakan HarmonyOS di luar Tiongkok.Sebelumnya, Manajer Umum BQ Rusia Vladimir Buzanov mengatakan, mereka menerima pemberitahuan dari Google, bahwa undang-undang AS melarang penyediaan layanan ke Rusia, termasuk ekspor, re-ekspor, dan penyediaan software dan teknologi asal AS ke Rusia.Meski begitu, perangkat yang sudah tersertifikasi Android dari Google akan terus berfungsi secara normal. Sementara, perangkat atau smartphone baru dari pabrikan Rusia ini mungkin akan memiliki masalah dengan Android.""Semua perangkat bersertifikasi akan terus berfungsi dan perangkat baru mungkin memiliki masalah dengan Android,"" kata Buzanov.Sistem operasi Huawei, HarmonyOS pertama kali dirilis pada Agustus 2019. Sistem operasi ini diluncurkan untuk berbagai perangkat Huawei.Setahun kemudian, Huawei meluncurkan versi baru HarmonyOS 2.0. Sistem operasi baru dari Huawei ini merupakan sebuah sistem yang mampu mendukung multiperangkat. Baik itu smartphone, tablet, jam tangan pintar, mobil, IoT, dan perangkat lainnya.Dengan hanya satu sistem, HarmonyOS memungkinkan koneksi ke banyak sistem lainnya.HarmonyOS bisa mencakup memori sekecil 128K dan sebesar 4FB atau lebih, baik untuk perangkat terminal besar atau pun kecil.Sistem operasi ini memiliki fitur utama, yakni memanfaatkan sepenuhnya teknologi terdistribusi, memungkinkan pengguna untuk secara bebas menghubungkan hardware dan mengintegrasikan beberapa terminal.Untuk koneksi multiperangkat, HarmonyOS menghadirkan pusat kendali terpadu yang mengadopsi desain tipe kartu, dengan antarmuka yang sederhana dan mudah digunakan.(Tin/Isk)"
58,Thomas,"Setelah Dybala, Juventus Lepas Satu Pemain Lagi Gratis",29 Maret 2022 09:00 WIB,https://www.liputan6.com/bola/read/4923752/setelah-dybala-juventus-lepas-satu-pemain-lagi-gratis,"Liputan6.com, Jakarta- Juventus benar-benar sedang mengencangkan keuangan klub. Mereka tak mau memberikan gaji besar kepada pemainnya. I Bianconeri pun rela melepas pemain dengan gratis agar berhemat.Pada pertengahan Maret 2022, Juventus memutuskan tak memperpanjang kontrak penyerang Paulo Dybala yang habis akhir musim nanti. Juve tak keberatan Dybala pergi dengan gratis di musim panas 2022.Dybala tak diperpanjang kontraknya karena persoalan permintaan gaji yang dianggap terlalu besar. Pasalnya Dybala dalam beberapa musim terakhir minim kontribusi akibat sering cedera.Tak cuma Dybala yang bakal pergi dengan gratis di musim panas 2022. Gelandang serang Federico Bernardeschi juga akan mengikutinya.Juventus pada Senin (28/3/2022) dilaporkan La Repubblica takkan memberikan kontrak baru untuk eks pemain Fiorentina itu. Bernardeschi juga akan habis kontrak pada Juni 2022. Sama seperti Dybala, Juventus tak mencapai kesepakatan dengan Bernardeschi soal besaran gaji di kontrak baru. Juve konon hanya mau menawarkan kontrak baru dengan gaji dua juta euro per musim.Bernardeschi keberatan dengan tawaran Juventus itu. Dia memilih akan cabut dari Turin di musim panas 2022 nanti.Sejak direkrut dari Fiorentina, Bernardeschi memang gagal menunjukkan permainan terbaiknya. Bernardeschi lebih banyak jadi pemain pelapis di Juventus.Situasi inilah yang membuat Juventus keberatan memberikan gaji lebih dari dua juta euro per musim kepada pemain nasional Italia tersebut."
59,Liputan6.com,"Gus Baha Bantah Teori Bumi Datar Berdasar Dalil Al-Qur'an, Ini Penjelasannya",29 Maret 2022 09:00 WIB,https://www.liputan6.com/regional/read/4923704/gus-baha-bantah-teori-bumi-datar-berdasar-dalil-al-quran-ini-penjelasannya,"Liputan6.com, Cilacap - Sebuah survei nasional tentang bumi bulat atau bumi datar yang dilakukan pemerintah Amerika Serikat pada tahun 2018 mengungkap hal yang mengejutkan, khususnya bagi para ilmuwan.Berdasarkan survei tersebut, hanya 66 persen warga berusia 18 hingga 24 tahun yang yakin bahwa bumi bulat. Dengan kata lain sepertiga milenial mempertimbangkan soal bumi datar.Namun, penemuan tersebut tak semata-mata menunjukkan ""epidemi"" bumi datar atau flat earth. Pasalnya, hanya 4 persen dari keseluruhan yang percaya bahwa bumi itu datar. Selain itu, survei menguak sembilan persen dari mereka yang ragu-ragu harus memilih antara bumi bulat atau bumi datar.Sementara itu, lima persen lainnya menegaskan mereka selalu percaya bahwa bumi bulat, dan 16 persen sisanya mutlak tak yakin. Teori bumi datar tercetus sekitar Abad ke-19. Akan tetapi, akhir-akhir ini masih terus mendapat sorotan, terutama karena pengaruh media sosial.Ulama kharismatik KH Ahmad Bahauddin Nursalim atau Gus Baha sebagaimana dikutip dari kanal YouTube Santri Gayeng, Senin (28/03/22) mengemukakan pandangannya tentang bentuk bumi.  Gus Baha mengawali pembahasannya dengan mengutip pernyataan Syeikh Ibnu Hajar Al-Asqalani dan Syeikh Abu Bakar Al-Baqilani bahwa semua lafadz itu tidak bermakna.Yang memaknai itu hati masing-masing. Bahasa hanyalah media komunikasi. Sebab, lafal menurutnya, jika dianalisis sulit dan rumit.Meskipun rumit, menurut Gus baha, hal ini harus dipelajari. Sebab bagaimanapun juga hal tersebut merupakan ilmu, terlepas dari setuju atau tidak.Lantas Gus Baha menjelaskan bahwa ketika ada ilmu Falaq yang menganggap bentuk bumi itu bulat. Lalu ada kiai yang tidak pernah ngaji lughat, maka menganggap hal tersebut sebagai suatu kebohongan.Bumi itu datar (flat) bersandar pada dalil Al-Qur’an. Salah satunya Surat Al Ghasyiyah ayat 30:Artinya: Dan bumi bagaimana dihamparkan?Namun, Gus Baha menegaskan bahwa kesimpulan tersebut keliru. Menurutnya, dipastikan yang bersangkutan tidak mendalami ilmu lughat (bahasa).Memang dalam konteks fi nadharil ‘aini (dalam pandangan mata) bumi itu seperti datar (flat), seperti karpet. Akan tetapi, itu bukanlah arti sebenarnya.Gus Baha kembali menanyakan, apakah sebab dalam pandangan mata tersebut datar, lalu hakekatnya bentuknya juga datar?Lantas beliau menganalogikan bahwa dalam pandangan mata matahari terbenam di bumi. Apakah hakikatnya matahari terbenam di bumi?Lantas Gus Baha kembali membuat perumpamaan yang lebih sederhana. Yakni kutu rambut yang ada di kepala akan menganggap bahwa kepala tersebut bentuknya itu datar seperti karpet, sebab saat si kutu berjalan kesana dan kemari tetap datar.""Persis ketika kita jalan atau lari kesana-kemari di atas bumi. Di manapun dan kemanapun kita pergi akan terasa datar (flat),"" ujar dia.Menurut Gus Baha, dalam konteks ini, apa yang kita lihat tidak menunjukkan hakikat atau bentuk yang semestinya sebuah benda.Sebab hal tersebut hanya masuk ranah ilmu nadhor yang didasarkan pada penglihatan, maka hukumnya dilekatkan pada penglihatan, bukan pada hakekat bentuk suatu benda.Penulis: Khazim Mahrur"
60,Arai Mahaka,Kapolres Pati Dapat Penghargaan dari Koran TV10,29 Maret 2022 09:00 WIB,https://jateng.liputan6.com/read/4923583/kapolres-pati-dapat-penghargaan-dari-koran-tv10,"Liputan6.com, Pati - Launching Koran TV10 dari PT MNS Grub Pers, di ruang Penjawi Setda Kabupaten Pati, Jumat (25/03/2022) diikuti acara pemberian penghargaan pada 65 tokoh yang dianggap berpengaruh dan berjasa. Di antaranya termasuk Bupati Pati, Wakil Bupati Pati, Kapolres Pati.Dikutip dari tribratanews.jateng.polri.go.id, Plt. Kepala Diskominfo, Sutikno Edi yang mewakili bupati, dalam sambutannya mengapresiasi hadirnya Koran TV10. Menurutnya, Koran TV10 akan memperkaya khazanah media di Kabupaten Pati dan diharapkan mampu berkontribusi aktif dalam mengawal penyampaian informasi kepada masyarakat. Termasuk terkait kebijakan pemerintah dan kemajuan pembangunan daerah.Ia menuturkan, kebijakan pemerintah yang dikeluarkan akan berdampak signifikan apabila diimbangi dengan pemberitaan dan informasi yang benar kepada masyarakat.""Diseminasi dan penyebarluasan informasi ini menjadi hal yang sangat krusial karena setiap kebijakan yang dikeluarkan oleh pemerintah tidak akan berhasil dan berdampak secara signifikan jika informasi tersebut tidak tersampaikan dengan baik kepada masyarakat.” imbuh Sutikno Edi. Beberapa pejabat turut menghadiri acara tersebut. Antara lain, Kadiskominfo Jepara, Arif Darmawan; Dosen Universitas Wahid Hasyim, Suparmin; Ketua Umum Rumah Perlindungan Perempuan dan Anak Indonesia (RPPAI), Fuad Dwiyono; Kepala Dinas Penanaman Modal dan Pelayanan Terpadu Satu Pintu (DPMPTSP) Pati, Riyoso; Kepala Satpol PP Pati, Sugiyono; Kepala Dinas Pendidikan dan Kebudayaan Pati, Winarto; Kapolres Pati, Christian Tobing.Di acara itu, selain pemberian penghargaan secara simbolis, juga dilaksanakan pemberian santunan kepada anak yatim piatu."
61,Liputan6.com,"Tim Robotik Unair Raih Prestasi Nasional, Bersaing dengan Berbagai Negara",29 Maret 2022 09:00 WIB,https://jatim.liputan6.com/read/4923837/tim-robotik-unair-raih-prestasi-nasional-bersaing-dengan-berbagai-negara,"Liputan6.com, Surabaya - Dua orang mahasiswa Universitas Airlangga (Unair) Muhammad Syahnabil Hammam Sungkar dan Zhafran Hilmi Wijaya berhasil meraih poisisi pketoga dalam ajang RCAP Influencer Award – People’s Choice dan posisi ketiga most Popular video dalam ajang RoboCup.Hilmi yang merupakan mahasiswa Fakultas Teknologi Maju dan Multidisiplin (FTMM) Unair itu bercerita bahwa Robocup Asia Pacific merupakan salah satu kompetisi robot tingkat internasional, yang sangat bergengsi karena pesertanya datang dari berbagai negara.Strategi yang diterapkan keduanya pada ajang ini adalah Dead Reckoning. Dead Reckoning merupakan salah satu algoritma yang banyak menerapkan konsep kalkulus yang biasa digunakan pada sistem navigasi robot untuk menghitung dan mengetahui posisi target yang telah ditentukan pada sumbu-x dan sumbu-y.""Kemudian menggerakkan ke arah target menggunakan motor yang terdapat pada robot simulatornya ke arah target yang telah ditentukan,” jelas Hilmi, Senin(28/3/2022).Algoritma Dead Reckoning, lanjutnya, merupakan algoritma yang mudah untuk dipelajari. Karena sebagai mahasiswa teknik sudah terbiasa dengan soal kalkulus.""Sehingga ketika menjawab tantangan yang diberi oleh juri ketika lomba, kami dapat memperhitungkan dan menyelesaikannya dengan mudah dan robot dapat melaju ke target dengan baik dan mendapat poin banyak,"" ungkapanya. Hilmi melanjutkan bahwa ketika mengikuti lomba itu, terdapat banyak proses yang harus dilalui agar dapat menjadi juara. Pertama yaitu membuat Team Description Paper (TDP).Pada tahap ini, sambungnya, setiap tim wajib membuat makalah yang berisi tentang identitas anggota tim, latar belakang tim, pengalaman yang pernah diikuti, strategi yang akan digunakan, dan algoritma yang ingin dikembangkan lagi.""Tim yang memiliki TDP paling menarik di mata juri dapat melanjutkan ke tahap selanjutnya,"" ujarnya.Menurutnya tahapan kedua adalah preliminary games, semua tim memprogram robot simulatornya dengan algoritma yang sudah dipersiapkan sebelumnya. Waktu pengerjaan untuk tahap preliminary games yaitu 24 jam.""Pada final games, tim yang berhasil lolos hanya 16,"" jelasnya.Ketika final games, tantangan yang diberikan oleh juri jauh lebih susah, karena jarak antar target lebih jauh dari sebelumnya dan waktu pemrograman lebih singkat yaitu hanya 4 jam dan diawasi oleh juri."
62,Ratnaning Asih,"Will Smith Akui Emosi Saat Menampar Chris Rock, Tak Tahan Lihat Kondisi Kesehatan Istri Jadi Bahan Lawakan",29 Maret 2022 09:00 WIB,https://www.liputan6.com/showbiz/read/4923787/will-smith-akui-emosi-saat-menampar-chris-rock-tak-tahan-lihat-kondisi-kesehatan-istri-jadi-bahan-lawakan,"Liputan6.com, Los Angeles - Will Smith akhirnya buka suara soal aksinya menampar Chris Rock di panggung Piala Oscar 2022. Ia mengakui, perilaku yang ia tampilkan adalah salah.""Kekerasan dalam berbagai bentuk adalah hal beracun dan destruktif. Perilakuku dalam Academy Awards malam kemarin tak bisa diterima dan tak bisa dibenarkan,"" tulis suami Jada Pinkett Smith tersebut, dalam unggahan yang ia bagikan Selasa (29/3/2022).Namun ia memberikan perspektif dari dirinya, apa yang sebenarnya terjadi dalam malam puncak Piala Oscar, yang menyebabkan ia kehabisan kesabaran. Rupanya ia tak tahan melihat kondisi kesehatan sang istri jadi bahan lelucon. Untuk mengetahui kebenaran informasi yang beredar, silakan WhatsApp ke nomor 0811 9787 670 hanya dengan ketik kata kunci yang diinginkan.""Guyonan yang dialamatkan kepadaku adalah bagian dari pekerjaan, sementara lawakan soal kondisi medis Jada sangat sulit kutahan, dan aku bereaksi secara emosional,"" kata aktor King Richard tersebut.Awal dari insiden ini adalah lawakan Chris Rock mengenai rambut Jada Pinkett Smith. Chris Rock berkata ia tak sabar menantikan penampilan wanita tersebut dalam film G.I Jane karena rambutnya tersebut. Dalam film G.I Jane tahun 1997, Demi Moore sebagai pemeran utama tampil tanpa rambut. Jada Pinkett Smith sendiri memangkas rambutnya karena ia mengalami kondisi alopecia atau kebotakan, yang terjadi karena masalah autoimun.Kini, Will Smith mengakui bahwa tindakannya ini kelewat batas. Ia minta maaf kepada Chris Rock. ""Aku ingin meminta maaf di depan publik kepadamu, Chris. Aku kelewat batas, dan aku salah. Aku malu dan tindakanku bukanlah cerminan dari sosok pria yang kuinginkan. Tak ada tempat untuk kekerasan di dunia yang penuh cinta dan kebaikan,"" tulis ayah Jaden Smith.  Chris Rock sendiri terungkap tak ingin melaporkan insiden ini ke kepolisian.""Individu yang terlibat telah menolak untuk memasukkan laporan ke polisi. Bila pihak yang terlihat ingin membuat laporan polisi pada kemudian hari, LAPD bersedia untuk merampungkan laporan investigasi,"" kata perwakilan Kepolisian Los Angeles."
