,Author,Judul Berita,Date,Link,Content
0,Liputan6.com,Menkes: Indonesia Akan Mulai Transisi dari Pandemi Covid-19 ke Endemi,29 Maret 2022 09:56 WIB,https://www.liputan6.com/news/read/4923888/menkes-indonesia-akan-mulai-transisi-dari-pandemi-covid-19-ke-endemi?medium=Headline&campaign=Headline_click_1,"Liputan6.com, Jakarta - Menteri Kesehatan Budi Gunadi Sadikin menyebut jika Indonesia saat ini sedang memulai tahapan transisi pandemi ke endemi Covid-19. Hal itu menyusul penanganan pandemi covid-19 yang kian membaik, salah satunya berkat kerja para tenaga kesehatan.""Kami yakin kontribusi nakes dari berbagai profesi sangat signifikan mengendalikan pandemi dan Insya Allah kita akan mulai transisi dari pandemi ke endemi,"" kata Menkes dalam konferensi pers di youtube Kemenkes, dikutip Selasa (29/3/2022).Keyakinan itu semakin diperkuat dengan data angka konfirmasi positif maupun juga kematian harian terus menurun. Termasuk Keterisian tempat tidur (BOR) di rumah sakit juga sudah bawah 10 persen dan positivity rate di angka 5 persen.""Situasi penanganan pandemi kita terus membaik. Angka konfirmasi positif maupun kematian harian terus menurun,"" katanya.Oleh sebab itu, Budi meminta semua sektor fokus mengendalikan pandemi agar menjadi endemi dengan mengerahkan seluruh tenaga secara bersama-sama.""Maka sangat perlu waktu dan tenaga kita itu diarahkan ke tindakan-tindakan kita yang bersama-sama mengendalikan pandemi,"" katanya. Sebelumnya, Menkes Budi mengatakan Presiden Joko Widodo telah meminta mempersiapkan skenario untuk mengubah pandemi COVID-19 menjadi endemi. Seluruh fase pandemi di dunia, kata dia, pada akhirnya selalu menjadi endemi hanya saja membutuhkan persiapan.Merujuk sejarah pandemi di dunia, menurut dia, selalu membutuhkan banyak faktor pertimbangan untuk mengubah menjadi endemi.""Enggak pernah faktor kesehatan saja. Ada faktor sosial, politik, ekonomi, budaya yang menjadi pertimbangan baik seorang pimpinan negara maupun dunia mengubah itu menjadi pandemi sebagai endemi,"" kata dia seusai seminar ""Recover Together, Recover Stronger: G20 dan Agenda Strategis Indonesia"" di Balai Senat Universitas Gadjah Mada (UGM), Yogyakarta, Kamis (17/3).Sesuai masukan para epidemiolog, laju penularan atau reproduction rate (Rt) harus ditekan di bawah 1 dalam rentang tiga hingga enam bulan, serta cakupan vaksinasi dua dosis minimal mencapai 70 persen dari populasi.Reporter: Bachtiarudin Alam/Merdeka.com"
1,Liputan6.com,Wagub Riza: Pemprov DKI Jakarta Segera Gelar PTM 100 Persen,29 Maret 2022 09:43 WIB,https://www.liputan6.com/news/read/4923879/wagub-riza-pemprov-dki-jakarta-segera-gelar-ptm-100-persen,"Liputan6.com, Jakarta - Pemprov DKI Jakarta tengah bersiap melaksanakan pembelajaran tatap muka (PTM) dengan kapasitas 100 persen. Implementasi dari rencana ini masih dibahas oleh Dinas Pendidikan DKI Jakarta.""Ini kan nanti akan kembali melaksanakan 100 persen di (status PPKM) Level 1 dan 2,"" kata Riza di Balai Kota Jakarta, Senin malam, 28 Maret 2022.Pemerintah telah kembali memperpanjang status PPKM untuk wilayah Jawa-Bali. Sama dengan pekan lalu, wilayah aglomerasi Jakarta, Bogor, Depok, Tangerang, Bekasi (Jabodetabek) tetap berada dalam status PPKM level 2. Perpanjangan status PPKM ini berlaku mulai 22 Maret hingga 4 April mendatang.""Ya segera, (PPKM Level 2 Jakarta) ini berlaku mulai 22 Maret - 4 April,"" kata dia.Riza sebelumnya sempat menyampaikan harapan agar PTM di sekolah-sekolah Jakarta dapat 100 persen kapasitas. Saat ini, PTM di Jakarta masih menerapkan 50 persen kapasitas sekolah.""Ini masih digodok terus PTM 100 persen. Memang ada juga keinginan sekarang terkait PTM 100 persen,"" kata Riza di Bala Kota Jakarta, Selasa (22/3).Dia menuturkan, untuk meningkatkan kapasitas PTM dari 50 persen ke 100 persen, Pemprov DKI juga masih berkoordinasi dengan pemerintah pusat melalui Kementerian Pendidikan Kebudayaan Riset dan Teknologi (Kemendikbudristek).""Nanti akan segera kita umumkan kapan waktu yang tepat, yang baik bagi kepentingan semua agar kita sudah bisa melaksanakan PTM 100 persen,"" ujarnya. Berdasarkan Instruksi Menteri Dalam Negeri (Inmendagri) Nomor 18 Tahun 2022, PPKM di DKI Jakarta masih pada level dua.Sesuai Inmendagri itu, pembelajaran dapat diadakan PTM terbatas atau jarak jauh sesuai Surat Keputusan Bersama (SKB) empat menteri.SKB empat menteri itu yakni Menteri Pendidikan, Kebudayaan, Riset dan Teknologi, Menteri Agama, Menteri Kesehatan dan Menteri Dalam Negeri.Dalam SKB itu disebutkan satuan pendidikan di daerah dengan PPKM level dua, dilaksanakan PTM terbatas dengan kapasitas 100 persen dari kapasitas ruang kelas.PTM diadakan setiap hari dengan lama belajar maksimal enam jam pelajaran per hari."
2,Teddy Tri Setio Berty,Pejabat Ukraina Khawatir Kebakaran Hutan di Chernobyl Picu Penyebaran Radiasi,29 Maret 2022 09:03 WIB,https://www.liputan6.com/global/read/4923383/pejabat-ukraina-khawatir-kebakaran-hutan-di-chernobyl-picu-penyebaran-radiasi,"Liputan6.com, Chernobyl - Sekitar 25 hektar hutan terbakar di sekitar pembangkit listrik tenaga nuklir Chernobyl pada Minggu (27/3).Menurut pejabat Ukraina, hal ini bisa berbahaya dan memicu lonjakan polusi udara radioaktif yang dapat mengancam bagian lain Eropa.Dikutip dari laman thedailybeast, Senin (28/3/2022) politisi Inna Sovsun menulis dalam sebuah tweet bahwa tidak mungkin bagi petugas pemadam kebakaran Ukraina untuk menjangkau sebagian besar kobaran api.Pasalnya, wilayah itu tetap berada di bawah kendali Rusia.“Kami takut api akan mencapai pembangkit listrik tenaga nuklir,” kata Sovsun.""Tingkat radiasi sudah meningkat.""Komisaris parlemen untuk hak asasi manusia, Lyudmila Denisova, sebelumnya mengklaim bahwa sebanyak 31 kebakaran telah dicatat di zona eksklusi pabrik.Ia juga menyerukan Badan Energi Atom Internasional dalam sebuah posting Facebook untuk membantu ""mencegah konsekuensi yang tidak dapat diperbaiki"" untuk Ukraina dan Dunia. Dalam pembaruan informasi, IAEA tidak menyebutkan kebakaran di sekitar Chernobyl tetapi mengatakan akan ""terus memantau situasi.""Ia mengungkapkan keprihatinan bagi karyawan yang saat ini bekerja di pabrik, yang belum dievakuasi sejak bergilir minggu lalu."
3,Gilar Ramdhani,Daikin Ceiling Mounted Cassette Round Flow: AC Hemat dan Minimalis untuk Ruang Usaha Kekinian,25 Maret 2022 13:16 WIB,https://www.liputan6.com/lifestyle/read/4918488/daikin-ceiling-mounted-cassette-round-flow-ac-hemat-dan-minimalis-untuk-ruang-usaha-kekinian,"Liputan6.com, Jakarta Beriring dengan perkembangan desain interior bagi hunian, ruang usaha pun mengikut pada penataan yang lebih minimalis di tengah upayanya untuk tetap menjadikan ruangan nyaman dan menarik bagi orang yang beraktivitas di dalamnya. Bila cukup waktu luang sedikit saja untuk diperhatikan, cafe, restoran hingga perkantoran pun semakin bergerak pada nuansa yang lebih minimalis.  Terlebih di tengah semakin maraknya ruang kerja bersama (co-working space). Tak hanya kelengkapan fasilitas, seperti halnya café atau tempat hang out lainnya, kenyamanan desain interior keseluruhan co working space semakin menjadi pertimbangan bagi calon pengguna untuk memanfaatkan jasa ini.  Bila penataan ruang dan segala kelengkapan ruang usaha sudah mendapatkan sentuhan, satu hal yang tak boleh luput dari perhatian adalah perangkat penyejuk ruangan (air conditioner). Di tengah tren minimalis ini, para pelaku usaha tak dapat lagi memaknai keberadaannya hanya dari fungsi utamanya sebagai penyejuk ruangan. Lebih dari itu, kehadirannya pun harus diperhitungkan sebagai elemen penting yang dapat menyatu dengan keseluruhan tata ruang dalam.  Untuk kebutuhan ini, DAIKIN sebagai pemimpin pasar perangkat penyejuk ruangan di Indonesia memiliki solusinya. Hal ini dilakukan melalui kehadiran AC DAIKIN Sky Air Ceiling Mounted Cassette Round Flow. Tak hanya desain dan performa penyejukan yang hemat, kemudahan perawatan pun menjadi fokus DAIKIN dalam pengembangan produk ini.  Dari sisi estetika, penempatannya yang menempel pada langit-langit (ceiling mounted cassette), memungkinkan pemiliknya memiliki fleksibilitas lebih dalam penataan dekorasi dinding yang biasanya harus terganggu dengan penempatan unit indoor AC single split. Apalagi dengan penampang depannya yang tampak simpel, mencuatkan kesan canggih sekaligus elegan bagi keseluruhan desain ruang.  Di balik kesan simpelnya ini, AC DAIKIN Sky Air Ceiling Mounted Cassette Round Flow menyimpan kemampuan performa penyejukan yang optimal. Pasalnya, bentuk membundar penampang depannya ini didesain mampu mengalirkan hembusan udara sejuk ke delapan penjuru. Tak hanya membuatnya dapat mencakup seluruh bagian ruangan tempatnya dipasang, namun pula didukung dengan kuat pendinginan yang merata di setiap sudutnya. Hal yang memberi keuntungan bagi pemilik usaha yang memperhitungkan keseluruhan biaya operasional dalam unit usahanya.Meski hadir dengan performa penyejukan mumpuni, pengguna tak perlu risau dengan besarnya konsumsi listrik. Hal ini karena seri AC DAIKIN Sky Air ini telah mengadopsi teknologi inverter pada kompresornya. Sebagai teknologi yang diakui dari berbagai pengujian lebih hemat listrik dibanding teknologi kompresor standar, membuat beban tagihan listrik penggunaan AC DAIKIN ini terhitung lebih rendah dalam pemakaian durasi panjang.  Peletakannya di langit-langit, tak lantas membuatnya kehilangan daya saat memberi kesejukan bagi aktivitas orang di dalam ruang mengingat ketinggiannya. Hal ini karena seri DAIKIN Sky Air Ceiling Mounted Cassette Round Flow ini telah dilengkapi pengaturan khusus yang membuatnya dapat menyesuaikan ketinggian dalam pemasangan. Hingga ketinggian 4.2 meter, AC DAIKIN Sky Air ini dapat mengalirkan kesejukan hingga menyentuh lantai.  Apalagi, melengkapi kemampuannya untuk mengalirkan kesejukan ke berbagai arah, AC Daikin berjenis cassette ini memiliki lima tingkatan laju kipas dalam mengalirkan udara sejuk. Bila pun tak ingin kerepotan berulang kali menyesuaikan laju kipas karena dinamika jumlah orang yang beraktivitas didalam ruang, seperti halnya café atau restoran, pengguna pun dapat memanfaatkan pengaturan Auto. Tersirat dari namanya, pengaturan ini akan membuat laju aliran udara secara otomatis menyesuaikan dengan tingkat beban. Nyaman dalam memberi kesejukan serta terhitung lebih hemat dari beban tagihan, tak lantas membuat DAIKIN alpa pada bagian penjagaan kesehatan pengguna dari berbagai partikel berbahaya bagi kesehatan. Salah satunya dari penggunaan silver ion anti-bacterial drain pan.Terletak pada tempat pengumpulan air dari hasil pengembunan evaporator, penggunaan silver ion yang ditaruh dalam wadah khusus ini berguna untuk mencegah tumbuhnya bakteri dan jamur yang mungkin menimbulkan bau tak sedap ataupun sumbatan. Di samping itu, AC DAIKIN Sky Air inverter ini juga dilengkapi filter anti bakteri dan jamur untuk mengeliminasi pertumbuhan jamur dan bakteri yang hadir bersama debu maupun kelembaban ruang.  Pemilik ruang usaha pun tak perlu ragu terkait dengan pemeliharaan. Berbeda dengan AC single split karena letaknya yang di langit-langit, tak membuat perawatan AC DAIKIN ini sulit dilakukan. Desain khusus unit indoor AC cassette ini membuat pemiliknya dapat melakukan perawatan dari penampang mukanya tanpa harus melepaskan banyak bagian dari unit. Penempatan outlet drain yang digunakan untuk memeriksa drain pan dan pengeringan air misalnya, diletakkan pada salah satu sudut penampang depan yang dapat dilihat setelah membuka grill AC.  Di sisi lain, teknologi microchannel heat exchanger diterapkan pada bagian penukar panas yang terbuat dari campuran alumunium. Selain lebih efisien dalam memindahkan panas, penggunaan campuran alumunium ini memberikan perlindungan lebih baik dari kemungkinan terjadinya karat. Hal yang memberikan keuntungan pada faktor ketahanan perangkat secara keseluruhan.  Dengan keseluruhan keunggulan yang ditawarkannya ini, tak heran bila kemudian AC DAIKIN Sky Air Ceiling Mounted Cassette Round Flow mudah meraih popularitasnya di kalangan pelaku usaha. Apalagi, AC DAIKIN ini tersedia dalam pilihan kapasitas pendinginan yang luas. Mulai dari 1.5 PK, 2 PK, 2.5 PK, 3 PK, 4 PK, 5 PK hingga 6 PK. Bagi peminat AC DAIKIN Sky Air ini, dapat mengunjungi jaringan dealer resmi DAIKIN yang tersebar di berbagai kota di Indonesia untuk meminang ataupun berkonsultasi langsung dengan tenaga ahli DAIKIN di sana.  (*)"
4,Tanti Yulianingsih,Wawancara Dubes Vasyl Hamianin: Jalan Panjang Harapan Ukraina Akhiri Perang dengan Rusia,25 Maret 2022 20:40 WIB,https://www.liputan6.com/global/read/4921414/wawancara-dubes-vasyl-hamianin-jalan-panjang-harapan-ukraina-akhiri-perang-dengan-rusia,"Liputan6.com, Jakarta - Tak ada yang menduga bahwa serangan militer Rusia ke Ukraina akan berlangsung sampai satu bulan lebih. Dan negeri yang dipimpin Presiden Volodymyr Zelensky masih bertahan sekuat tenaga mempertahankan tanah airnya.""Militer terkuat nomor dua di dunia menyerang sebuah negara kecil yang lemah dan tidak memiliki peralatan memadai,"" kata Duta Besar Ukraina untuk Indonesia, Vasyl Hamianin dalam wawancara khusus program Liputan6.com The Ambassador.Dubes Ukraina untuk Indonesia itu pun berharap bahwa eskalasi antara Rusia Ukraina akan mereda, seiring berakhirnya konflik. ""Jadi, harapan saya hanya satu. Yakni untuk mengakhiri perang ini secepatnya,"" tegas Dubes Vasyl Hamianin.Berikut ini bincang-bincang Liputan6.com selengkapnya dengan Duta Besar Ukraina untuk Indonesia, Vasyl Hamianin dalam program The Ambassador: Liputan6.com:Pryvit, Dobroho dnyya, Halo, selamat siang, betul begitu?H.E Vasyl Hamianin:Ya, betul. Tepat sekaliLiputan6.com:Apa Kabar (Bahasa Ukraina)H.E Vasyl Hamianin:Ya, betul. Apa kabar? Baik.Liputan6.com:Sebuah kehormatan bagi saya bisa mewawancarai Anda.  Terima kasih atas kesempatan yang diberikan untuk mewawancarai Anda, selamat datang di program The AmbassadorH.E Vasyl Hamianin:  Assalamualaikum Wr.Wb. Sebuah kehormatan bagi saya diundang dan bisa berkesempatan berbicara dengan audiens Liputan6.comLiputan6.com: Hari ini atau lebih tepatnya 24 Maret 20 22 merupakan satu bulan invasi Rusia di Ukraina. Bagaimana respons dan harapan Anda?H.E Vasyl Hamianin:Terima kasih lagi. Ini benar-benar sebuah tragedi bagi Ukraina.  Masih teringat betul dalam kenangan masa perang dunia kedua. Mungkin ini merupakan hal yang tak terduga bagi banyak orang di dunia, khususnya tak diduga oleh Rusia yang terus bertahan untuk menggempur lebih dari tiga hari seperti yang mereka perkirakan.Itu menjadi sebuah kejutan bagi Rusia dan saya pikir juga membuat banyak negara di dunia terkejut.Karena militer terkuat nomor dua di dunia menyerang sebuah negara kecil yang lemah dan tidak memiliki peralatan memadai.Apa yang kita lihat sekarang adalah tidak hanya Ukraina bertahan, tapi membuktikan dengan efisien dan penuh motivasi.Karena penjajahan neo-kolonialiseme Rusia telah menyerang demokrasi dan gagal.Kita melihat bahwa demokrasi di dunia bersatu. Setidaknya banyak negara Bersatu mendukungMereka mengecam aggressor, Rusia. Dan terus memberikan dukungan dan bantuan ke UkrainaMenyampaikan dukungan ke area yang memungkinkanJadi sebulan perang Rusia vs Ukraina, bukan sekadar invasi Rusia di Ukraina, melainkan tantangan neo kolonialisme bagi demokrasi, kedamaian dan kestabilan dunia.Jadi, harapan saya hanya satu. Yakni untuk mengakhiri perang ini secepatnya.   * Untuk mengetahui kebenaran informasi yang beredar, silakan WhatsApp ke nomor 0811 9787 670 hanya dengan ketik kata kunci yang diinginkan.Liputan6.com: Ya, Anda benar soal itu. Saya dengar pasukan Ukraina mulai menyerang balik tentara Rusia dan merebut kembali sejumlah wilayah yang sempat diduduki Rusia di hari ke-27 invasi. Sejumlah wilayah yang menjadi incaran tentara Ukraina itu di antaranya beberapa titik di sekeliling Ibu Kota Kiev yang selama ini dikepung Rusia, Kota Makariv, Borodyanka, Mykolaiv, dan Kherson.Bagaimana sebenarnya situasi perang sesungguhnya antara Rusia dan Ukraina? H.E Vasyl Hamianin: Ini pertanyaan sensitif. Saya tidak memiliki hak untuk mengungkap situasi sesungguhnya di beberapa wilayah Ukraina.Karena itu informasi khusus, dan penting untuk tak mengungkap rencana atau tantara atau capaian karena bisa digunakan oleh musuhDan akan berdampak buruk pada situasi terkiniYang bisa saya beritahukan kepada Anda berasal dari sumber terbukaBenar di beberapa wilayah tantara Ukraina berhasil menyerang balik pasukan Rusia, tak hanya bertahan dan menyerang penyerang,Yang perlu digarisbawahi di sini adalah pada momen sebulan invasi Rusia ini, sepekan pertama terasa berat sekali bagi UkrainaTerutama bagi warga sipilApa yang tantara Rusia lakukan adalah mengebom warga sipil, membunuh warga sipilWanita dan anak-anak dan orang-orang lanjut usia. Bangunan perumahan, sekolah, rumah sakitPekan pertama perang kami menghadapi masalah dari langit, dengan misil, dengan pesawat menjatuhkan bom di kotaJadi timbul masalah karena kami tidak memiliki peralatan atau persenjataan mumpuni untuk membalas serangan dari langitNamun tentara kami mendapatkan bantuan beberapa sistem pertahanan udara anti-pesawatDan Rusia juga kehabisan misilUntungnya, Rusia dengan cepat kehabisan bom dan misil sehingga langit Ukraina kembali amanSaya rasa serangan balik tantara Ukraina di kota utama Ukraina seperti Mariuopl dan Kharkiv, mereka juga pasti mendapat serangan balik lagi dari RusiaDalam hal situasi militer, saya lebih optimistis. Karena tantara Ukraina begitu mempertahankan Tanah Airnya.Kami sangat termotivasi berjuang, dan medapatkan dukungan dari warga sipil di manapun. Di desa, di kota dan didukung penuh oleh populasi UkrainaTentara Rusia itu diatur dan mereka tak punya motivasi untuk bertempur. Mereka hanya menerima perintah dan seringkali salah pahamSebab propaganda Rusia mengatakan agresi militer Rusia menyerang fasis. Dan orang-orang malah menyambut mereka dengan bunga di kotaDan apa yang terjadi saat ini berbeda, berkebalikannya.Pada hal ini saya optimistis bahwa situasi di sekitar kota-kota yang hancur merupakan tempat berbahaya bagi kemanusiaanKarena warga sipil menderita. Mariupol dikelilingi oleh bom 18 hari lalu, hampir 3 minggu laluPengeboman pertama menargetkan penyedia listrik, air dan infrastruktur penting.Jadi sekitar tiga minggu lalu Kota Mariupol telah terputus dari listrik, air, makanan, obat-obatan. Ini sebuah tragediKota-kota di Ukraina menghadapi bencana kemanusiaan terutama melihat fakta bahwa bahkan konvoi kemanusiaan : obat, dokter dan konvoi dengan obat dan makanan tak diizinkan masuk ke Mariupol dan Kharkiv untuk memberikan bantuan ke warga sipilMereka tak diizinkan oleh pasukan yang menduduki, pasukan RusiaSaya berduka dengan hal ini, semua orang Ukraina berduka karena hal iniKami bahkan tak tahu jumlah warga sipil yang tewas. Karena tim penyelamat tak diizinkan masuk. Seperti pemadam kebakaran, dokter.Jadi kami tidak tahu pasti berapa orang yang telah meninggal oleh bom dan misil Rusia di kota-kota Ukraina   Liputan6.com: Apakah ada data resmi  korban tewas di sisi Ukraina? dari warga sipil secara total maupun tentara?H.E Vasyl Hamianin: Sejujurnya informasi memiliki dua bagian: yang resmi yang ditayangkan di situs PBB. Jadi orang bisa mengeceknya.Tentang konfirmasi korban tewas. Saya baru membuka dokumen tentang itu,Tapi itu tidak sepenuhnya akurat, karena korban tewas setiap harinya.Seperti di kota besar seperti Mariupol yang memiliki populasi 500 ribu orang, Kharkiv 1,2-1,5 juta orangJadi setelah pengeboman dan blockade kota-kota itu tak diketahui berapa banyak warga sipil tewas.Kita hanya bisa tahu dari data statistikc resmi PBB. Data itu ratusan bukan ribuanJumlah sebenarnya pasti lebih besar dari ituDan untuk korban tewas militer. Saya rasa penting itu informasi khusus.Tapi yang saya bisa beritahu adalah tantara Ukraina itu bekerja efisien dan penuh motivasi untuk negaranya.Warga ukraina juga tentara sejatiDan untuk tentara Ukraina yang meninggal disebutkan tidak begitu besar, tapi penting untuk diberitahu bagi saya warga Ukraina, atau warga Ukraina di dunia, setiap tetes darah tantara atau anak adalah berharga.Setiap tentara terbunuh dalam invasi ini untuk mempertahankan negara adalah tragedy. Bencana pribadi warga Ukraina  Liputan6.com:H.E Vasyl Hamianin: Ya betul, saya bisa mengirimkan datanya pada Anda sekarang. Saya kirim datanya karena besar nanti yaSaya ulang, sulit untuk menghitungnya. Setiap hari pasti berubah datanya jadi akan ada updateAnda tahu seperti Mariupol warga tak bisa menyalakan ponsel, jadi kami tidak tahu apa yang terjadi di sanaRusia telah memutus aliran listrik di sana dan jaringan ponsel juga. Itu sebuah bencana. Liputan6.com:  Pertanyaan selanjutnya, kita semua ingin perang antara Rusia dan Ukraina segera berakhir. Serangkaian pertemuan juga telah dilakukan untuk mendukung proses damai. Sudah sejauh mana proses negosiasi damai tersebut?  H.E Vasyl Hamianin: Baik, saya memiliki dua jawaban untuk ini.Yang pertama tentang negosiasi Rusia dan Ukraina, tak ada hasil apapun.  Karena jika ada negosiasi, Anda tak membunuh warga sipil, tak mengebom mereka sambal berbicara damaiJika Anda berbicara soal damai, Anda harus berhenti mengebom orang di seluruh penjuru Ukraina. Betul kan?Jadi, ketika negosiator Rusia bertemu dengan piahk Ukraina, mereka menawarkan sesuatu yang kami tak bisa terimaSeperti menyerah, memberikan negara kami, mengubah pemerintahan, seperti didukung  oleh warga ukrainaJadi permintaan ini adalah hal bodoh dan menjengkelkanJika Anda sungguh memiliki keinginan, seperti dalam sisi politik dalam proses negosiasi damai.Seharusnya Anda harus menekan dan memikirkan keinginan Anda dan berhati-hati dengan permintaan yang tak menjengkelkanYang kedua dengan berhenti membunuh warga sipilSeperti yang dideklarasikan Presiden Ukraina kepada media bahwa Ukraina siap bertemu Presiden Rusia untuk bernegosiasiKita tak bisa hanya duduk dan membahas poin-poin dan pertanyaan dan semuanya. Tapi tetap ada seranganAnda tak bisa bernegosiasi dan membunuh dalam waktu yang samaDalam prospek jangka panjang, jika proses negosiasi memungkinkan. Jawaban saya ya.  Karena setiap perang berakhir dengan negosiasi damai dan perjanjianIni tak bisa dihindari . Ini akan terjadi cepat atau lambatUntuk Ukraina, kami menghitung hari, menit. Karena setiap menit berarti kehilangan nyawa, anak sekarat karena dehidrasi, penyakit atau taka da perawatanJadi setiap menit sangat berharga bagi Ukraina. Kami siap bernegosiasi kapanpun Liputan6.com: Jadi itu artinya tak ada hasil dari kesepakatan damai dengan Rusia, meski Ukraina telah melakukan proses tersebut begitu.H.E Vasyl Hamianin: Saya ingin menjelaskan lagi tentang hal ini, untuk mengerti posisi Rusia.Kami Ukraina selalu mengajukan hal yang dapat diterima bagi semua orangApa yang bisa diterima orang. Pikirkan tentang hal itu yang dapat diterima semua manusiaKondisi kami adalah untuk menghentikan membunuh orang dan duduk bericaraApakah hal ini bisa diterima? TidakTapi apa yang terjadi pada Rusia, dari sejarah terdekat tentang aneksasi Luhansk dan Donetsk selama 8 tahunJadi Ukraina melakukan pendekatan kepada DK PBB 11 kali. 11 kali bertanya soal pendudukan tersebut di Donbass, Timur UkrainaAnda tahu, pengamat , penjaga perdamaian, 11 kali ditolak oleh Rusia.Itu adalah contoh bagaimana Rusia mempersiapkan negosiasi.  Bagaimana sesungguhnya wajah Rusia, neo-kolonialisme Rusia. Maaf Liputan6.com: Pertanyaan terakhir saya soal Indonesia ikut memberikan kecaman kepada agresi Rusia kepada Ukraina melalui Resolusi PBB. Ada 141 negara yang mendukung resolusi tersebut.Bagaimana respons Anda terkait dukungan Indonesia kepada Ukraina itu? H.E Vasyl Hamianin: Respons saya sederhana, saya berterimakasih atas dukungan Pemerintah Indonesia, Menlu dan Presiden RI maupun Ketua Parlemen yang mendukung dalam mengakhiri perang ini juga salah satunya di pembukaan IPU ke-144 di Bali belum lama iniSaya bersyukur atas semua hal yang dilakukan oleh IndonesiaKepada media atau rakyat Indonesia. Saya merasakan doa AndaSecara spesifik tentang deklarsi PBB ini, saya rasa usaha yang dilakukan setiap negara, menyatakan kecaman atas Rusia adalah hal pentingNamun platfor PBB ini saya rasa sangat lemah atau cacat, saya tak tahu kenapa?Karena agrasornya adalah anggota tetap DK PBB dan memiliki hak agar resolusi itu tak bergerak tak memiliki hasil konkretIni adalah jalan buntu untuk proses perdamaian melalui DK PBBHarapan saya adalah ada multilatereal platform yang didirikanAtau menggunakan multilateral platform yang sudah ada sebagai wadah untuk memulai proses negosiasi damai secepatnyaIni adalah kesempatan bagi setiap negara di dunia khususnya peluang bagi pemimpin regionalDan untuk kekuatan global di mana Indonesia juga tengah memimpin yakni dalam presidensi G20 contohnya,Saya melihat dan mengoservasi, dan sangat mengapresiasi dan mengagumi usaha Indonesia contohnya dalam G20 sebagai pemimpin dunia yang menurut saya ke arah yang  baikItu adalah masalah yang kritis. Dan saya rasa jika tidak ada platform baru didirikan untuk memulai proses damai di ukraina, mungkin G20 adalah platform yang bagusIni bukan saya yang harus memutuskan, dan saya tak ingin menggurui atau mendesak siapa pun atas keinginan sayaTapi ini adalah impian saya dan warga Ukraina untuk memulai proses damai segera dan efisien. Karena kami tak bisa menunggu dalam minggu atau bulan. Setiap menit berharga. Secepat mungkin lebih baik.Ini harapan saya dan impian saya Liputan6.com: Kita harap proses damai berjalan lancar dan membuahkan hasil. Karena tak ingin eskalasi ini terus berlanjut dan menelan banyak korban jiwaH.E Vasyl Hamianin: Dari detik perang itu terjadi, kami sejatinya tak ingin perang. Bahkan sebelum itu terjadi kami tak mengingkannya. Kami bukan ancaman untuk siapaun terutama RusiaLiputan6.com:"
