,Author,Judul Berita,Date,Link,Content
16,Dicky Agung Prihanto,"Antisipasi Pengemis Musiman saat Ramadan, Satpol PP Depok Lakukan Patroli",29 Maret 2022 10:16 WIB,https://www.liputan6.com/news/read/4923895/antisipasi-pengemis-musiman-saat-ramadan-satpol-pp-depok-lakukan-patroli,"Liputan6.com, Jakarta Satuan Polisi Pamong Praja (Satpol PP) Kota Depok mengantisipasi pengemis musiman atau Pemerlu Pelayanan Kesejahteraan Sosial (PPKS). Sebab biasanya mendekati bulan ramadan hingga Idul Fitri para pengemis musiman ini datang ke kota-kota besar.Kasatpol PP Kota Depok, Lienda Ratnanurdianny mengatakan, selama dua tahun kebelakang, sejumlah jalan protokol di Kota Depok banyak ditemui pengemis atau PPKS. Umumnya para pengemis akan terlihat di jalan protokol pada sore hingga malam.“Ini sudah kami antisipasi juga, menjelang bulan suci ramadan Insya Allah ada patroli untuk melakukan penertiban, karena memang mereka itu bisa dikatakan musiman,” ujar Lienda di Depok, Selasa (29/3/2022).Lienda menjelaskan, pada hari biasa atau sebelum ramadan para PPKS tidak akan terlihat di jalan protokol. Namun selama puasa dapat dipastikan akan terlihat terutama menjelang buka puasa.“Ini akibat apa, karena banyak warga masyarakat yang mau memberikan sedekahnya,” jelas Lienda.Satpol PP Kota Depok tidak melarang masyarakat memberikan sedekah pada bulan puasa, namun lebih bijak memberikan sedekah tidak mengganggu ketentraman dan ketertiban. “Harus dipikirkan ada spot tertentu, seperti di masjid nanti orang yang membutuhkan bisa datangnya ke masjid,” ungkap Lienda.Keberadaan PPKS, kata dia, akan mengganggu ketentraman dan kelancaran berlalu lintas, sehingga pengguna jalan atau pengendara baik roda dua atau roda empat cukup terganggu. Salah satu contohnya adanya pembagian sedekah di Jalan Raya Margonda, tentunya terjadi kepadatan lalu lintas, kecepatan pengendara lumayan cukup padat.“Sehingga jangan sampai mengganggu aktivitas lalu lintas para pengendara lainnya,” ucap Lienda.Lienda menuturkan, Satpol PP Kota Depok akan mengantisipasi dengan melakukan patroli untuk menjaga ketertiban, dan kemungkinan para PPKS akan diarahkan kesuatu titik. Selain itu Satpol PP Kota Depok meminta masyarakat lebih bijak dalam bersedekah. Pada pemetaan Satpol PP Kota Depok, para PPKS berasal dari luar Depok dan tinggal di Kota Depok dalam kurun waktu beberapa bulan.“Ada yang tinggal di Depok hanya untuk beberapa bulan, kemudian mereka kembali ketempat asal setelah lebaran,” tutur Lienda.Lienda menjelaskan, para PPKS akan menyewa suatu kontrakan untuk dijadikan tempat tinggal.“Dari PPKS yang terjaring mengaku mendapatkan penghasilan mencapai Rp300 ribu sampai Rp500 ribu sehari, mereka berasal dari daerah Jawa Tengah dan Jawa Timur,” pungkas Lienda."
17,Maulandy Rizky Bayu Kencana,"Konstruksi Rampung 2022, Bendungan Ciawi Siap Hadang Banjir Jakarta",29 Maret 2022 10:15 WIB,https://www.liputan6.com/bisnis/read/4923849/konstruksi-rampung-2022-bendungan-ciawi-siap-hadang-banjir-jakarta,"Liputan6.com, Jakarta - Kementerian Pekerjaan Umum dan Perumahan Rakyat (PUPR) telah merampungkan konstruksi Bendungan Ciawi di Kabupaten Bogor, Jawa Barat. Bendungan kering (dry dam) ini jadi bagian dari rencana induk sistem pengendalian banjir (flood control) untuk mengurangi kerentanan bencana banjir di kawasan Jakarta.Menteri PUPR Basuki Hadimuljono mengatakan, sebagai bendungan kering, maka pengoperasian Bendungan Ciawi akan berbeda dengan bendungan lain. Waduk ini baru akan digenangi air pada musim hujan, setipe dengan Bendungan Sukamahi di Gadog, Kabupaten Bogor yang terlebih dulu selesai konstruksi.""Sementara pada musim kemarau bendungan ini kering. Baik Bendungan Ciawi dan Sukamahi merupakan yang pertama kalinya dibangun di Indonesia. Kedua bendungan ini bukan untuk keperluan irigasi atau air baku, namun untuk meningkatkan kapasitas pengendalian banjir,"" jelasnya dalam keterangan tertulis, Selasa (29/3/2022).Konstruksi Bendungan Ciawi mulai dilaksanakan secara bertahap atau multi years contracy (MYC) sejak Desember 2016 dengan progres fisik selesai 100 persen pada 2021. Bendungan Ciawi memiliki volume tampung 6.05 juta m3 dan luas genangan 39.40 ha dengan biaya pembangunan sebesar Rp 798,7 miliar.Pada Tahun Anggaran 2021 atau single years contracy (SYC), dilakukan pekerjaan lanjutan dengan nilai kontrak Rp 239,8 miliar untuk menyelesaikan pekerjaan akhir pada bangunan bendungan dan fasilitas umum, dengan progres fisik dan keuangan selesai 100 persen. Saat ini tengah dilakukan pekerjaan lanjutan II berupa timbunan dengan progres hingga 16 Februari 2022 mencapai 80,2 persen. Ditargetkan seluruh pekerjaan konstruksi selesai pada 2022.Selain itu, Kementerian PUPR juga terus berkoordinasi dengan seluruh pihak terkait dan dan berupaya keras untuk mempercepat pembebasan lahan. Sehingga penyelesaian Bendungan Ciawi selesai sesuai target.Berdasarkan data, progres pengadaan lahan sudah mencapai 98,83 persen dengan target penyelesaian Uang Ganti Rugi (UGR) pada April 2022.Pengadaan lahan bendungan dilakukan dengan skema dana talangan, di mana kontraktor membiayai terlebih dahulu dan nantinya akan dibayarkan melalui Lembaga Manajemen Aset Negara (LMAN). Kontrak pekerjaan Bendungan Ciawi ditandatangani pada 23 November 2016 dengan kontraktor pelaksana PT Brantas Abipraya dan PT Sacna.Bendungan ini didesain untuk mengurangi debit banjir yang masuk ke Jakarta dengan menahan aliran air dari Gunung Gede dan Gunung Pangrango sebelum sampai ke Bendung Katulampa yang kemudian mengalir ke Sungai Ciliwung. Rampungnya pembangunan Bendungan Ciawi akan mereduksi banjir sebesar 111,75 m3 per detik."
18,Putu Elmira,Pernikahan Hyun Bin dan Son Ye Jin Ditaksir Telan Biaya Rp2 Miliar,29 Maret 2022 10:10 WIB,https://www.liputan6.com/lifestyle/read/4923892/pernikahan-hyun-bin-dan-son-ye-jin-ditaksir-telan-biaya-rp2-miliar,"Liputan6.com, Jakarta - Momen pernikahan Hyun Bin dan Son Ye Jin sudah di depan mata. Beberapa rincian acara di hari bahagia aktor dan aktris ternama Korea Selatan ini telah terungkap, termasuk biaya yang fantastis.Dilansir dari The Straits Times, Selasa (29/3/2022), Hyun Bin dan Son Ye Jin jatuh cinta di lokasi syuting Crash Landing On You pada 2019 lalu. Awalnya, mereka bungkam soal pernikahan, namun undangan pernikahan telah bocor terlebih dahulu.Sebenarnya, 200 undangan diminta merahasiakan detail pernikahan Hyun Bin dan Son Ye Jin. Namun, istri mantan pesepakbola Lee Dong-gook, Lee Soo-jin, mengunggah potret undangan pada akhir pekan lalu.Keduanya mengonfirmasi akan melangsungkan pernikahan pada 31 Maret 2022 mendatang di Aston House Grand Walkerhill Seoul. Menurut Taiwan's Apple Daily, biaya tempat eksklusif dan terpencil mulai dari 680--810 dolar Singapura (Rp7,1 juta--Rp8,5 juta) per tamu.Sedangkan, seluruh acara pernikahan itu diperkirakan menelan biaya 190 ribu dolar Singapura atau setara Rp2 miliar. Keamanan diperkirakan akan sangat ketat pada garden wedding yang akan menampilkan pemandangan Sungai Han dan Gunung Acha.Aston House adalah tempat untuk sejumlah pernikahan selebritas Korea Selatan, termasuk Bae Yong-joon dan Park Soo-jin, serta Ji Sung dan Lee Bo-young. Daftar tamu dikatakan termasuk penulis naskah Crash Landing On You, Park Ji-eun, serta teman dekat Hyun Bin, aktor Jang Dong-gun, yang dikabarkan menjadi orang yang bersulang untuk pasangan bahagia itu. Sebelumnya, pasangan ini membuat heboh setelah mengumumkan akan segera menikah. Kabar bahagia itu dibagikan Son Ye Jin melalui sebuah unggahan di akun Instagram pribadi.Ia membagikan potret gaun pengantin mungil dengan kata-kata manis. ""Saya berpikir panjang dan berpikir keras soal bagaimana membagikan cerita ini karena ini penting. Saya menemukan seseorang untuk menghabiskan sisa hidup. Ya… itulah dia.☺,"" tulisnya pada Kamis, 10 Februari 2022.Ye Jin menambahkan bahwa laki-laki bertemu perempuan, saling mengenal di tengah keramaian, berjanji untuk membangun masa depan bersama. ""Saya tidak bisa membayangkan! Itu terjadi secara alami… Tapi, bukankah itu takdir?"" jelasnya.Ia menyebut hanya bersama Hyun Bin, dirinya merasa hangat dan terlindungi. ""Tolong bantu kami merayakan awal masa depan kami,"" terangnya.""Saya pikir, tidak ada cara untuk membalasnya. Ketahuilah saya sangat berterima kasih dan Saya juga berharap Anda semua bahagia!"" tutupnya.Hyun Bin juga mengungkapkan kabar gembira rencana pernikahannya dengan Son Ye Jin lewat agensinya, Vast Entertainment. Agensi mengunggah surat pernyataan dari aktor berusia 39 tahun itu.""Halo, ini Hyun Bin. Apakah semua orang baik-baik saja? Saya menulis ini karena saya ingin membuat penggemar saya, yang telah menunjukkan kepada saya dukungan dan cinta yang sangat besar dan menghargai saya terlepas dari kekurangan saya, tahu terlebih dahulu tentang keputusan terpenting dalam hidup saya ini,"" tulis Hyun Bin, seperti dilansir Soompi, Kamis, 10 Februari 2022.""Pasti banyak dari kalian yang sudah menebak kan? Itu benar. Saya telah membuat keputusan penting soal pernikahan dan dengan hati-hati mengambil langkah menuju tahap kedua dalam hidup saya,"" lanjutnya.Hyun Bin melanjutkan bahwa ia dan Son Ye Ji untuk selalu berjalan bersama di hari-hari ke depannya. ""'Jung Hyuk dan Se Ri' yang bersama dalam drama akan mengambil langkah pertama bersama di masa depan itu,"" tambahnya.Ia juga percaya orang-orang akan bersukacita dan merayakan langkah pertama mereka dengan kasih sayang dan kehangatan yang sama seperti yang telah penggemar tunjukkan kepada mereka sejauh ini. ""Sampai kita berjumpa lagi, semoga tetap bahagia dan sehat,"" tutupnya.Hyun Bin dan Son Ye Jin telah berteman bertahun-tahun sebelum membintangi drama populer ""Crash Landing on You"". Ketika drama berakhir, mereka mulai berkencan dan mengumumkan hubungan mereka pada Januari 2020."
19,Thomas,"Ingin Rusia dan Ukraina Damai, Bos Chelsea Roman Abramovich Malah Diracun",29 Maret 2022 10:09 WIB,https://www.liputan6.com/bola/read/4923910/ingin-rusia-dan-ukraina-damai-bos-chelsea-roman-abramovich-malah-diracun,"Liputan6.com, Jakarta- Kabar mengejutkan datang dari konglomerat Rusia yang juga pemilik klub Liga Inggris Chelsea, Roman Abramovich. Diduga Abramovich diracun akibat mencoba mendamaikan Rusia dengan Ukraina.Seperti diketahui Rusia melakukan inovasi militer ke Ukraina sejak akhir Februari lalu. Sudah sebulan berlangsung, perang belum juga berkesudahan. Ratusan nyawa melayang.Abramovich selama ini dikenal dekat dengan presiden Rusia Vladimir Putin. Namun Abramovich tak menyetujui perang. Dia berusaha mendamaikan kedua negara.Demi mendamaikan kedua belah pihak, Abramovich menjadi negosiator perdamaian Rusia-Ukraina. Sayangnya langkah mulia Abramovich ini tak diterima semua pihak. Mirror melaporkan sang pemilik Chelsea diracun saat jadinya negosiator perdamaian Rusia-Ukraina di Kiev. Kelompok garis keras Pro Putin yang dituding sebagai penyebab keracunan Abramovich. Kelompok Pro Putin ini tak ingin perang berakhir. Selain Putin, dua negosiator dari Ukraina juga diracun. Kasus ini kabarnya terjadi awal Maret lalu, tapi baru terungkap pada akhir bulan. Kondisi Abramovich tak terlalu parah. Dia dirawat di Turki. Pria berusia 55 tahun itu kabarnya mengalami pengelupasan kulit terus menerus serta mata yang memerah.  Perang Rusia dengan Ukraina telah memberikan kerugian besar kepada Abramovich. Pemerintah Inggris menjatuhkan sanksi kepada Abramovich untuk menekan Putin. Pasalnya Abramovich dikenal dekat dengan Putin. Sanksi pemerintah Inggris berupa pembekuan aset Abramovich di negeri Ratu Elizabeth itu. Abramovich pun terpaksa harus menjual Chelsea. Proses penjualan sedang berlangsung hingga saat ini."
20,Dian Kurniawan,"Satu Napiter Lapas Perempuan Malang Bebas, Tolak Ikrar Setia NKRI",29 Maret 2022 10:05 WIB,https://surabaya.liputan6.com/read/4923811/satu-napiter-lapas-perempuan-malang-bebas-tolak-ikrar-setia-nkri,"Liputan6.com, Jakarta Seorang narapidana terorisme (napiter) berinisial A resmi bebas dari Lembaga Pemasyarakatan (Lapas) perempuan di Malang.""Yang bersangkutan bebas setelah menjalani hukuman badan selama 5,5 tahun. Sesuai dengan vonis majelis hakim,"" ujar Plt Kepala Kanwil Kemenkumham Jatim Wisnu Nugroho Dewanto, ditulis Selasa (29/3/2022).Selama menjalani hukuman Lapas Perempuan Malang, lanjut Wisnu, WBP A tidak pernah menimbulkan keributan. Selain itu, A juga sangat kooperatif saat dimintai informasi baik oleh internal lapas.""Begitu juga saat pendampingan dengan Badan Nasional Penanggulangan Terorisme (BNPT) selalu kooperatif,"" ujar Wisnu.Kalapas Perempuan Malang Tri Anna Aryati menyatakan, selama menjalani hukumannya, A tidak pernah mendapatkan hak remisi, asimilasi maupun integrasi.Pasalnya, A tidak pernah mengikuti pembinaan kepribadian maupun kemandirian karena alasan tertentu. Selain itu, A juga tidak menghendaki menyatakan ikrar setia kepada Negara Kesatuan Republik Indonesia (NKRI).“Sejak awal di sini kami telah memberikan hak untuk mengikuti pembinaan kemandirian seperti merajut, membatik, memasak maupun kepribadian di pondok pesantren lapas, namun karena alasan kesehatan, A tidak bisa mengikuti semua pembinaan tersebut,” ucap Tri Anna.Tri Anna berharap A dapat menjadi pribadi yang lebih baik lagi. Dan dapat diterima oleh masyarakat.“Di dalam blok hunian, dia merupakan pribadi yang ramah dan tidak memiliki keluhan apapun saat berkomunikasi dengan rekannya,” imbuh Dian Ekawaty selaku Pamong/ Wali WBP kasus teroris.Dalam pembebasannya kali ini A dijemput langsung oleh suaminya. Lapas Perempuan Malang telah berkoordinasi dengan aparat penegak hukum yakni Densus 88 Polresta Malang Kota dan Kodim 0833 Sukun.Sebelumnya majelis hakim dari PN Jakarta Timur memvonis A dengan hukuman lima tahun penjara. Selain itu, A juga dijatuhi denda sebesar Rp 50 juta rupiah subsider enam bulan kurungan. Sesuai dengan Pasal 15 UU Nomor 15 Tahun 2003 tentang Terorisme."
21,Liputan6.com,"Suzuki Pamer Siluet Mobil Baru, XL7 Versi FF?",29 Maret 2022 10:04 WIB,https://www.liputan6.com/otomotif/read/4923773/suzuki-pamer-siluet-mobil-baru-xl7-versi-ff,"Liputan6.com, Jakarta - Akun Instagram resmi @suzuki_id memberikan sinyal akan meluncurkan mobil baru dalam waktu dekat ini. Suzuki tidak menyebutkan secara langsung mobil yang diluncurkan.Akun itu hanya menampilkan sebuah teaser berupa siluet gambar mobil yang diduga kuat sebagai Suzuki XL7, lantaran tarikan garis gril dan bentuk lampu depan mirip.Kemungkinan besar mobil ini adalah versi Finest Form (FF) dari XL7, sama seperti Ertiga FF yang diluncurkan pada Gaikindo Indonesia International Auto Show (GIIAS) 2021 silam.LMPV itu mendapatkan beberapa upgrade ringan di bagian ekstrior dan interior. Bodi Ertiga FF mengusung tampilan dari Ertiga Sport dengan atap dibuat warna hitam dan beberapa aksen merah.Sementara kabin Ertiga FF diberi jok kulit dan spion tengah E-Mirror, sebuah fitur yang pertama kali dipasangkan pada Suzuki XL7 Alpha.Lantaran transformasi dari Ertiga Sport biasa menjadi Ertiga FF cukup minim, besar kemungkinan XL7 akan disematkan improvement yang sama.Dengan kata lain, XL7 terbaru kelak mempunyai warna khusus, di mana bagian atap berwarna hitam, bodi bawahnya berwarna putih, ditambah aksen-aksen merah di sekujur tubuhnya.Lalu untuk interior, LSUV ini juga mendapatkan jok kulit dengan jahitan berwarna merah dan Smart E mirror dari XL7 tipe Alpha juga hadir dalam varian ini.Selebihnya New XL7 ini besar jadi menggunakan spesifikasi yang sama dengan XL7 biasa. Lantas lampu depan dan belakang sudah LED, pelek berwarna two tone model jari-jari, dan tersedia armrest untuk kursi depan.Di luar tambahan tersebut, belum diketahui apakah Suzuki Indonesia akan memberikan fitur-fitur lainnya. Bahkan atap berwarna hitam dan Smart E Mirror sendiri sudah digunakan pada XL7 termahal varian Alpha.Waktu peluncuran mobil ini juga belum disebutkan. Namun, mengingat Suzuki Ertiga FF diluncurkan pada ajang otomotif GIIAS 2021, boleh jadi New XL7 bakal debut pada Indonesia International Motor Show (IIMS) yang dihelat pada tanggal 31 Maret 2022 kelak.Sumber: Otosia.com"
22,Syifa Aulia,"Tanggapan Promotor Soal Konser Justin Bieber 2 Hari, Vaksin Booster, hingga Venue",29 Maret 2022 10:03 WIB,https://www.liputan6.com/citizen6/read/4923267/tanggapan-promotor-soal-konser-justin-bieber-2-hari-vaksin-booster-hingga-venue,"Liputan6.com, Jakarta - Indonesia resmi masuk ke dalam daftar negara yang akan dikunjungi Justin Bieber dalam konser bertajuk Justice World Tour 2022. Konser itu akan berlangsung di Jakarta pada 3 November 2022 mendatang.Stadion Madya Gelora Bung Karno (GBK) dipilih menjadi tempat konser tersebut. Selanjutnya, pembelian tiket konser tersebut akan dibuka pada 29 Maret 2022.Berita ini membuat penggemar Justin Bieber yang dijuluki Beliebers sangat antusias. Beberapa Beliebers bahkan menanyakan kepada pihak promotor lokal terkait tambahan hari untuk konser tersebut. 0811 9787 670 hanya dengan ketik kata kunci yang diinginkan.Menanggapi hal itu, Harry Sudarma selaku CEO dan co-founder PK Entertainment mengatakan bahwa tanggal tambahan untuk Justice World Tour di Jakarta kemungkinan dapat diwujudkan. Mengingat antusiasme Beliebers Indonesia yang luar biasa.""Kalau support dari fans-nya luar biasa pastinya itu bukan sesuatu yang tidak mungkin. Kita pasti akan bantu untuk berdiskusi dengan manajemen artisnya terkait tanggal tambahan,"" kata Harry Sudarma dalam siaran langsung di Instagram @justinbieberids, Minggu (27/3/2022).Jika itu dapat diwujudkan, Harry menambahkan bahwa tanggal tambahan tersebut tentunya harus menyesuaikan dengan jadwal agenda Justin Bieber.Harry juga menanggapi terkait kekecewaan Beliebers terhadap pemilihan tempat konser. Menurut Harry, pemilihan Stadion Madya GBK sudah berdasarkan diskusi serta persetujuan dari pihak Justin Bieber dan manajemennya.""Sampai saat ini, venue yang sudah valid adalah Stadion Madya GBK. Jadi pemilihan venue itu kan bukan hal yang sederhana ya, prosesnya juga panjang, dan variabelnya juga banyak banget,"" ungkapnya.Dia juga mengatakan akan memberikan informasi lanjutan jika ada perubahan lokasi stadion.Sementara, terkait beredarnya informasi vaksin ketiga atau booster sebagai syarat mengikuti konser, Harry menjelaskan bahwa konser ini akan mengikuti aturan yang berlaku dari pemerintah.""Jadi saat ini betul harus dua kali vaksin. Tapi, kalau melihat dukungan dari pihak terkait tentang syarat pemberlakuan vaksin booster, nanti kita akan lihat lagi,"" jelas Harry.Dia mengatakan peraturan saat ini dan menjelang November kemungkinan bisa berbeda. Jika pemerintah memberlakukan syarat vaksin booster, maka akan diterapkan sebagai syarat mengikuti konser.Mengingat bulan November mulai memasuki musim hujan, Harry menegaskan bahwa konser akan tetap berlanjut meski stadionnya tidak memiliki atap. Hal yang dapat dilakukan jika diguyur hujan saat konser adalah penonton harus membawa perlengkapan tambahan seperti jas hujan, topi, jaket, maupun payung.Lebih lanjut, Harry juga mengatakan tidak ada larangan bagi ibu hamil untuk mengikuti konser. Namun, tetap mempertimbangkan kondisi janin sesuai dengan anjuran dari dokter kandungan. Sedangkan bagi kelompok disabilitas dapat menghubungi tim PK Entertainment untuk mendapatkan bantuan ketika di lokasi."
23,Tanti Yulianingsih,"Tabrakan Beruntun 50 Kendaraan Lebih di Pennsylvania AS, 3 Orang Dilaporkan Tewas",29 Maret 2022 10:00 WIB,https://www.liputan6.com/global/read/4923894/tabrakan-beruntun-50-kendaraan-lebih-di-pennsylvania-as-3-orang-dilaporkan-tewas,"Liputan6.com, Pennsylvania - Sedikitnya tiga orang tewas di jalan raya Pennsylvania, AS pada Senin 28 Maret 2022 akibat tabrakan beruntun yang melibatkan lebih dari 50 kendaraan selama badai salju, kata pihak berwenang.Petugas koroner Schuylkill County Dr. David J. Moylan memperingatkan Senin sore bahwa jumlah korban tewas ""bisa lebih tinggi"", karena pencarian di tempat kejadian belum selesai dan ada kendaraan yang terbakar.Tabrakan berapi-api terjadi di Interstate 81 sekitar pukul 10.30 pagi waktu setempat. dekat Minersville, sekitar 100 mil barat laut Philadelphia, John Blickley dari kantor manajemen darurat daerah itu, mengatakan kepada USA Today yang dikutip Selaa (29/3/2022).""Setidaknya 20 orang dikirim ke rumah sakit karena cedera,"" kata John Blickley.Rekaman yang diunggah ke media sosial menunjukkan traktor-trailer yang tidak terkendali menabrak truk sampah besar, memutarnya hampir 180 derajat. Truk besar lainnya memuntahkan asap hitam dan api oranye ke udara dan sebuah SUV menabrak mobil penumpang yang membuat sedan itu berputar, nyaris kehilangan pengemudinya yang berdiri di bahu jalan raya yang diselimuti salju dan kabut.""Tabrakan itu menutup semua jalur I-81 utara di Schuylkill County dan papan pesan jalan raya mengalihkan lalu lintas,"" kata Ronald Young, juru bicara Departemen Transportasi Pennsylvania.Polisi Negara Bagian Pennsylvania sedang menyelidiki kecelakaan itu dan banyak badan EMS, pemadam kebakaran, dan polisi setempat merespons di tempat kejadian, kata Letnan Polisi Adam Reed.Sejumlah tanker berada di lokasi untuk mengisi air karena tidak ada sumber air dari hidran. Kondisi bersalju menyulitkan layanan darurat untuk mencapai tempat kejadian, kata Blickley.""Beberapa orang terjebak di mobil mereka, kata Blickley. Tiga trailer-traktor terbakar dan setidaknya dua kebakaran kecil lainnya dilaporkan,"" paparnya.Video yang dibagikan di media sosial menunjukkan beberapa traktor-trailer dan kendaraan lain menabrak kendaraan lain yang berhenti dan penonton menyaksikan asap hitam dan api membubung dari apa yang tampak seperti truk tangki.Dalam satu video, orang-orang di luar kamera terdengar berteriak saat beberapa kendaraan terlihat bertabrakan dalam waktu kurang dari satu menit.Blickley mengatakan dia memperkirakan bagian dari interstate akan ditutup ""sampai Selasa pagi hari"", hingga polisi dapat menyelesaikan penyelidikan mereka dan mulai memindahkan kendaraan. Dia mengatakan lebih banyak badai salju diperkirakan Senin sore waktu setempat.Kantor Layanan Cuaca Nasional di State College memperingatkan badai salju di Pennsylvania tengah dan menyarankan pengemudi untuk tetap waspada.""Hujan badai akan dengan cepat mengurangi jarak pandang hingga di bawah setengah mil dan melapisi jalan dengan salju,"" kata peramal cuaca, mendesak pengemudi untuk turun dari jalan jika memungkinkan atau menyalakan lampu hazard ""dan secara bertahap melambat untuk menghindari rantai reaksi kecelakaan kendaraan.”"
24,Tira Santia,Tak Ada Kabupaten dan Kota di Luar Jawa dan Bali yang Masuk PPKM Level 4,29 Maret 2022 10:00 WIB,https://www.liputan6.com/bisnis/read/4923769/tak-ada-kabupaten-dan-kota-di-luar-jawa-dan-bali-yang-masuk-ppkm-level-4,"Liputan6.com, Jakarta - Menteri Koordinator Bidang Perekonomian Airlangga Hartarto mengatakan, penanganan pandemi Covid-19 terutama untuk varian Omicron semakin baik. Transmisi komunitas kasus konfirmasi terus mengalami penurunan.""Untuk di luar Jawa dan Bali, sudah tidak ada provinsi yang berada di Level 4. Tingkat Kematian juga terus terkendali,"" jelas Airlangga Hartarto seperti dikutip dari keterangan tertulis, Selasa (29/3/2022).Ia menerangkan, untuk di luar Jawa dan Bali, 26 provinsi berada di Level 1 dan hanya Kepulauan Babel yang berada di Level 2.Adapun 19 provinsi masih memiliki kapasitas respon terbatas akibat testing atau tracing yang terbatas, 6 provinsi lain di kategori sedang, dan 2 provinsi memadai.Per 27 Maret 2022, Level Asesmen membaik cukup signifikan, karena tidak ada Kabupaten atau Kota Level 4, kemudian Kabupaten dan Kota Level 3 menurun, dan Kabupaten dan Kota Level 2 dan Level 1 meningkat.Rincian PPKM sebagai berikut:- Level 4: terdapat 0 Kabupaten/Kota (minggu sebelumnya 0 Kabupaten/Kota).- Level 3: 69 Kabupaten/Kota (membaik dari minggu sebelumnya 106 Kabupaten/Kota).- Level 2: 291 Kabupaten/Kota (membaik dari minggu sebelumnya 264 Kabupaten/Kota).- Level 1: 26 Kabupaten/Kota (membaik dari minggu sebelumnya 16 Kabupaten/Kota). Airlangga melanjutkan, pemerintah memutuskan memperpanjang PPKM selama 14 hari ke depan yaitu dari 29 Maret hingga 12 April 2022.""Kriteria Penerapan Level PPKM di luar Jawa-Bali adalah berdasarkan Level Situasi Pandemi Covid-19, yaitu Transmisi Komunitas (Jumlah Kasus, Kematian, dan Rawat Inap) dan Kapasitas Respon (Testing, Tracing, Treatment/BOR),” papar Menko Airlangga.Kemudian, juga menggunakan indikator berupa tingkat Vaksinasi Dosis-2 (minimal 45 persen), dan Vaksinasi Lansia Dosis-1 (minimal 60 persen).Kabupaten/Kota yang tidak memenuhi ambang batas akan dinaikkan satu Level PPKM-nya, dengan pengecualian bagi Kabupaten/Kota dengan jumlah penduduk kurang dari 200 ribu orang dan kasus konfirmasi kurang dari 2 kasus per 100 ribu penduduk.Berdasarkan kriteria tersebut, maka komposisi Level PPKM pada 386 Kabupaten/Kota di luar Jawa-Bali adalah sbb:- PPKM Level 1 meningkat (membaik) dari 18 menjadi 26 Kabupaten/Kota.- PPKM Level 2 meningkat (membaik) dari 168 menjadi 250 Kabupaten/Kota.- PPKM Level 3 menurun (membaik) dari 200 menjadi 109 Kabupaten/Kota."
