,Author,Judul Berita,Date,Link,Content
33,Ibrahim Hasan,"Sepakat Tak Punya Anak, Ini 7 Potret Romantis Maia Estianty dan Irwan Mussry",29 Maret 2022 09:45 WIB,https://hot.liputan6.com/read/4923822/sepakat-tak-punya-anak-ini-7-potret-romantis-maia-estianty-dan-irwan-mussry,"Liputan6.com, Jakarta Pernikahan Maia Estianty dan Irwan Mussry hampir menginjak tahun keempat. Kala itu keduanya melangsungkan pernikahan di di Tokyo, Jepang. Tak seperti pasangan lain yang segera ingin punya momongan usai menikah, Maia Estianty dan Irwan Mussry justru sepakat tak ingin punya anak. Bukan tanpa alasan saat menikah dengan Irwan Mussry, Maia Estianty sendiri sudah punya 3 buah hati atas pernikahannya dengan Ahmad Dhani. Seperti halnya sang istri, Irwan Mussry juga punya alasan sendiri tak ingin punya anak. ""Bukan karena dia enggak mau punya anak. Sekarang sudah tua, mau umur 60. Dia pernah punya traumatic ditinggal bapaknya umur 8 tahun,” ungkap Maia Estianty kepada Kalina Ocktaranny di kanal YouTube Vika Entertainment.Meski sebelumnya pernah menjalin hubungan pernikahan dan belum dikaruniai anak, Pengusaha berdarah Indonesia-Arab ini tetap teguh tak ingin punya anak di pernikahan keduanya. Kini anak sambungnya Al, El, dan Dul sudah dianggapnya sebagai anak kandung. Kesepakatan tak punya momongan ini bukan berarti membuat hubungan Maia Estianty dan Irwan Mussry tak harmonis. Justru keduanya semakin harmonis dari hari ke hari. Berikut Liputan6.com merangkum potret romantis Maia Estianty dan Irwan Mussry melansir dari Instagram @maiaestiantyreal, Selasa (29/3/2022)."
34,Tira Santia,"Sri Mulyani: Covid-19 di Indonesia Sudah Terkendali, Diikuti Peningkatan Mobilitas",29 Maret 2022 09:45 WIB,https://www.liputan6.com/bisnis/read/4923880/sri-mulyani-covid-19-di-indonesia-sudah-terkendali-diikuti-peningkatan-mobilitas,"Liputan6.com, Jakarta - Menteri Keuangan (Menkeu) Sri Mulyani Indrawati menyatakan, kondisi pandemi di Tanah Air menunjukkan kondisi yang relatif terkendali. Indonesia masih termasuk sebagai negara yang mampu mengelola pandemi Covid-19 dengan penurunan kasus baik dari sisi kasus harian maupun kasus kematian.“Kita sudah melihat jumlah yang sudah divaksin untuk yang pertama adalah 72,5 persen atau 195 juta rakyat yang sudah mendapatkan vaksin dosis pertama dan kemudian vaksin dosis kedua 157,8 juta atau 58,4 persen dari populasi kita. Kita juga sudah mulai untuk memberikan vaksin booster sebanyak 19,96 juta,” kata Menkeu dikutip dari Kemenkeu.go.id, Selasa (29/3/2022).Menurutnya, kasus Covid-19 varian Omicron yang semakin terkendali, tren mobilitas masyarakat pun meningkat. Google Mobility Index, sebut Menkeu, menunjukkan adanya kenaikan aktivitas masyarakat.Di sisi lain, konsumsi masyarakat juga meningkat dengan indeks keyakinan yang berada pada level optimistis sebesar 113,1.“Karena memang ini selalu memiliki pengaruh yang sangat besar, yaitu pandemi terhadap kebijakan pemerintah untuk bisa menjaga agar keselamatan masyarakat tetap terjaga,” ujar Sri Mulyani. Kenaikan juga ditunjukkan dari pertumbuhan konsumsi listrik industri dan bisnis yang menunjukkan kuatnya aktivitas dunia usaha, masing-masing mencapai 14,1 dan 9,3. Sementara itu, konsumsi semen, penjualan mobil niaga, dan penjualan alat berat tumbuh positif masing-masing 2,7 persen, 31,5 persen, dan 146,5 persen.Sisi neraca perdagangan juga menunjukkan suatu kenaikan yang meningkat cukup signifikan. Neraca perdagangan konsisten mencatatkan surplus mencapai USD3,83 miliar pada Februari 2022 didukung peningkatan ekspor.Realisasi tersebut ditopang ekspor yang tumbuh 34,14 persen didukung oleh kenaikan ekspor nonmigas unggulan serta sektor manufaktur yang masih kuat. Selanjutnya impor di bulan Februari 2022 tumbuh 25,43 persen didominasi oleh jenis barang input yang mencerminkan berlanjutnya penguatan aktivitas produksi."
35,Agustina Melani,"IHSG Bertahan di Posisi 7.000, Investor Asing Beli Saham BMRI hingga INCO",29 Maret 2022 09:38 WIB,https://www.liputan6.com/saham/read/4923866/ihsg-bertahan-di-posisi-7000-investor-asing-beli-saham-bmri-hingga-inco,"Liputan6.com, Jakarta - Laju Indeks Harga Saham Gabungan (IHSG) menguat pada awal sesi perdagangan Selasa (29/3/2021). Penguatan IHSG ini ikuti bursa saham Asia dan aksi beli investor asing.Pada pembukaan perdagangan, IHSG naik tiga poin ke posisi 7.052,73. Pada pukul 09.20, IHSG naik 0,29 persen ke 7.069. Indeks LQ45 menanjak 0,33 persen ke posisi 1.030. Seluruh indeks acuan kompak menguat.Pada sesi pertama, IHSG berada di level tertinggi 7.071,57 dan terendah 7.048,37. Sebanyak 242 saham menguat dan 150 saham melemah.196 saham diam di tempat. Total frekuensi perdagangan 185.353 kali dengan volume perdagangan 2,7 miliar saham. Nilai transaksi harian Rp 1,8 triliun. Investor asing beli saham Rp 199,97 miliar di seluruh pasar. Posisi dolar Amerika Serikat terhadap rupiah di kisaran Rp 14.327.Sebagian besar sektor saham menghijau. Sementara itu, indeks sektor saham IDXindustry melemah 0,52 persen, indeks sektor saham IDXtransportasi susut 0,47 persen dan indeks sektor saham IDXenergy tergelincir 0,20 persen.Selain itu, indeks sektor saham IDXtechno melonjak 1,16 persen, indeks sektor saham IDXproperty menanjak 0,64 persen dan indeks sektor saham IDXhealth menguat 0,81 persen.  Saham-saham yang masuk top gainers antara lain:-Saham YPAS menguat 24,82 persen-Saham SMDM menguat 16,77 persen-Saham INDX menguat 15,30 persen-Saham ESTA menguat 14,79 persen-Saham KICI menguat 11,4 persenSaham-saham yang masuk top losers antara lain:-Saham RUNS turun 9,91 persen-Saham SBMA turun 6,67 persen-Saham TRJA turun 6,61 persen-Saham INTD turun 6,06 persen-Saham DFAM turun 6,03 persenSaham-saham yang dibeli investor asing antara lain:-Saham BMRI senilai Rp 136,7 miliar-Saham TLKM senilai Rp 40,3 miliar-Saham BBRI senilai Rp 23,4 miliar-Saham BBNI senilai Rp 12,1 miliar-Saham INCO senilai Rp 10,3 miliarSaham-saham yang dijual investor asing antara lain:-Saham BUKA senilai Rp 15,4 miliar-Saham ADRO senilai Rp 13,8 miliar-Saham ITMG senilai Rp 11,7 miliar-Saham PTBA senilai Rp 10,1 miliar-Saham UNTR senilai Rp 6,4 miliarBursa saham Asia kompak menguat. Indeks Hang Seng naik 0,85 persen, indeks Korea Selatan Kospi mendaki 0,35 persen, indeks Jepang Nikkei bertambah 0,68 persen. Selain itu, indeks Shanghai menanjak 0,06 persen, indeks Singapura naik 0,18 persen dan indeks Taiwan menguat 0,33 persen.Mengutip riset PT Ashmore Asset Management Indonesia, IHSG ditutup menguat ke posisi 7.049 pada Senin, 28 Maret 2022 dan investor asing terus mencetak aksi beli USD 60 juta, sedangkan investor lokal kurangi aksi jual.Saham ASII dan bank kapitalisasi besar menahan IHSG di atas 7.000. Saham ASII dan anak usaha UNTR reli setelah UNTR membukukan penjualan Komatsu yang kuat."
36,Putu Elmira,"Irene, Yeri, dan Joy Red Velvet Dituding Bersikap Kasar kepada Pramugari",29 Maret 2022 09:36 WIB,https://www.liputan6.com/lifestyle/read/4923848/irene-yeri-dan-joy-red-velvet-dituding-bersikap-kasar-kepada-pramugari,"Liputan6.com, Jakarta - Kabar tak menyenangkan tengah menimpa tiga idol K-Pop, yakni Irene, Yeri, dan Joy Red Velvet. Mereka dituding bersikap kasar kepada awak kabin dalam sebuah penerbangan.Dikutip dari Allkpop, Selasa (29/3/2022), rumor soal ketiga personel Red Velvet ini mulai beredar luas saat beberapa channel drama di YouTube membagikan tangkapan latar dari komunitas karyawan anonim 'Blind' pada 26 Maret 2022. Untuk menjadi anggota 'Blind', seseorang harus memverifikasi akun dengan email kantor mereka.Salah satu tangkapan layar merujuk kepada Irene, Yeri, dan Joy Red Velvet. Tangkapan layar itu berisi ungkapan seorang karyawan Korean Air yang menyebut ketiganya bertindak kasar.""Red Velvet ikut dalam penerbangan dan Yeri, Joy, dan Irene sangat kasar. Mereka memperlakukan pramugari seolah-olah mereka adalah pelayan mereka,"" jelasnya.Karyawan itu melanjutkan, ""Dua (personel) lainnya baik. Tapi entah mengapa idola, secara umum, berpikir mereka adalah seorang yang penting.""Bukan itu saja, masih ada pula cerita berbeda dari karyawan Jeju Air Service yang membalas kabar di atas. Ia menjelaskan sikap Irene Red Velvet ketika check in di konter maskapai penerbangan. ""Menambah komentar pertama, Irene, jangan lempar identitas Anda atau merebut tiket Anda dari karyawan,"" kata karyawan Jeju Air Service tersebut.Ia menambahkan, ""Dan datang ke konter secara langsung untuk check-in. Saya mendengar Anda melakukan itu di maskapai lain juga.""Ia menjelaskan komentarnya dengan menyebut, ""Dia ingin orang lain check-in untuknya jadi saya hanya mengatakan dia harus secara pribadi datang untuk masalah verifikasi.""Dilansir dari South China Morning Post, Selasa (29/3/2022), pada Oktober 2020, penggemar girl group Red Velvet dihebohkan mendengar tuduhan bahwa Irene yang bernama asli Bae Joo-hyun telah merundung stylist-nya. Berita itu memicu banyak kritik dari penggemar.Bahkan, mereka menuntut Irene untuk mundur dari grup, yang membuatnya mundur dari sorotan dari beberapa waktu. Kala itu, girl grup ini menunda tampil bersama di depan umum.Pada 16 Agustus, Red Velvet merilis EP keenamnya, Queendom, termasuk bersama Irene. Sejak perilisannya, Irene aktif di media sosial, berhubungan kembali dengan para penggemarnya.Pada saat yang sama, warganet telah menunjukkan tanggapan yang beragam terhadap kembalinya dia bernyanyi. Beberapa mengatakan dia masih tidak pantas menjadi bagian dari Red Velvet, sementara yang lain telah menerima permintaan maafnya dan menyambutnya kembali."
37,Muhammad Radityo Priyasmoro,"PPKM di Luar Jawa-Bali Diperpanjang, Kapasitas Tempat Ibadah di Daerah Level 1 Boleh 100 Persen",29 Maret 2022 09:31 WIB,https://www.liputan6.com/news/read/4923854/ppkm-di-luar-jawa-bali-diperpanjang-kapasitas-tempat-ibadah-di-daerah-level-1-boleh-100-persen,"Liputan6.com, Jakarta Pemerintah memperpanjang kebijakan pemberlakuan pembatasan kegiatan masyarakat (PPKM) di luar Jawa-Bali, menjelang bulan suci Ramadan. Perpanjangan dimulai pada 29 Maret sampai dengan 11 April 2022. Hal itu tertuang dalam Instruksi Menteri Dalam Negeri nomor 19 Tahun 2022 yang mengatur PPKM Level 3, Level 2, dan Level 1 di wilayah luar Jawa-Bali.Dalam instruksi tersebut, tertuang aturan tentang penerapan kapasitas beribadah di masjid, musala, gereja, pura dan vihara serta tempat ibadah lainnya yang berbeda-beda sesuai level PPKM di daerahnya masing-masing.Untuk daerah yang termasuk dalam PPKM level 1, pemerintah mengizinkan kapasitas maksimal sebesar 100 persen dengan penerapan protokol kesehatan secara lebih ketat serta memperhatikan pengaturan teknis dari Kementerian Agama.Kemudian, untuk daerah yang termasuk dalam PPKM level 2, pemerintah mengizinkan kapasitas maksimal sebesar 75 persen dengan penerapan protokol kesehatan secara lebih ketat serta memperhatikan pengaturan teknis dari Kementerian Agama.Selanjutnya, untuk daerah yang termasuk dalam PPKM level 3, pemerintah mengizinkan kapasitas maksimal sebesar 50 persen dengan penerapan protokol kesehatan secara lebih ketat serta memperhatikan pengaturan teknis dari Kementerian Agama.Kendati untuk Level 4, dalam aturan yang berlaku mulai dari 29 Maret 2022 hingga 11 April 2022 ini tidak ada wilayah di luar Jawa-Bali yang berstatus level tersebut."
38,Muhammad Fahrur Safi'i,7 Potret Rumah Ibu Tasya Farasya di Sukabumi Ini Megah Bak Istana,29 Maret 2022 09:30 WIB,https://hot.liputan6.com/read/4923813/7-potret-rumah-ibu-tasya-farasya-di-sukabumi-ini-megah-bak-istana,"Liputan6.com, Jakarta Selebgram dan YouTuber Tasya Farasya beberapa waktu belakangan ini baru saja mengunggah hunian megah milik ibundanya yang berada di Sukabumi, Jawa Barat. Ibundanya yang kerap disapa Ibu Ala ini ternyata memiliki rumah megah bernuansa Timur Tengah.Hal ini diketahui dalam unggahan Instagram Tasya Farasya pada Sabtu (26/3/2022) kemarin. Dalam unggahannya itu ia mengunggah berbagai sudut rumah tersebut yang selama ini jarang terekspose.Banyak netizen pun merasa takjub dengan rumah megahnya. Memiliki satu warna dominan seperti warna bata, kesan megah dan mewah pun makin terasa saat melihat ke dalam rumah yang dipenuhi perabotan mewah.Berikut 7 potret rumah ibunda Tasya Farasya yang Liputan6.com kutip dari Instagram @tasyafarasya, Selasa (29/3/2022)"
39,Defri Saefullah,"Ingin Damaikan Rusia-Ukraina,  Roman Abramovich Malah Diracun?",29 Maret 2022 09:30 WIB,https://www.liputan6.com/bola/read/4923814/ingin-damaikan-rusia-ukraina-roman-abramovich-malah-diracun,"Liputan6.com, Jakarta Roman Abramovich rupanya tak mau kehilangan muka sekaligus hartanya di berbagai belahan dunia. Untuk menyelamatkan asetnya, pemilik Chelsea ini berusaha untuk mendamaikan Rusia da Ukraina lewat sebuah pertemuan di Kiev awal bulan ini.Namun, seperti dilansir Marca, Abramovich mengalami serangan yang tak mengenakkan. Dia diduga sudah mengalami gejala sudah diracun lewat makanan.Pebisnis asal Rusia itu dikabarkan sudah menunjukkan gejala diracun. Itu terlihat dari mata merah, mengeluarkan air mata secara konstan dan juga kulit yang mengelupas.Wall Street Journal juga melaporkan ada dua delegasi Ukraina juga yang mengalami gejala sama. Meski begitu, dilaporkan, nyawa ketiga orang yang sedang negoisasi itu termasuk Roman Abramovich tidak terancam.Kondisi mereka dikabarkan sudah membaik dan siap untuk beraktivitas seperti biasa. Siapa racun pemilik Chelsea ini?  Kabarnya upaya negoisasi Abramovich coba disabotase oleh pihak tertentu. Dugaan kini ditujukan kepada sayap radikal di Kremlin yang tak menginginkan adanya negoisasi damai.Selain tiga orang tersebut, pebisnis Rusia dan juga anggota parlemen Ukraina Rustem Umerov ikut dalam negoisasi itu.  Peran Abramovich di negoisasi itu belum jelas. The Times melaporkan Abramovich sudah bergerak sejak SEnin pekan lalu.Dia meninggalkan Istanbul untuk bertemu dengan Vladimir Putin. Saat itu dia membawa surat dengan tulisan tangan dari presiden Zelensky.Isi surat itu tentang keinginan Ukraina yang ingin hentikan perang. ""Bilang kepada dia, saya akan hancurkan mereka,"" jawab Putin seperti dilansir Marca."
40,Tira Santia,"DJP Kumpulkan Penerimaan Rp 4,55 Triliun dari PPS Pajak per 28 Maret 2022",29 Maret 2022 09:30 WIB,https://www.liputan6.com/bisnis/read/4923760/djp-kumpulkan-penerimaan-rp-455-triliun-dari-pps-pajak-per-28-maret-2022,"Liputan6.com, Jakarta - Sebanyak 29.238 wajib pajak telah mengikuti Program Pengungkapan Sukarela (PPS) Pajak, dengan 33.283 surat keterangan hingga 28 Maret 2022.Mengutip laman resmi Direktorat Jenderal Pajak (DJP), Selasa (29/3/2022), Pemerintah berhasil mengumpulkan penerimaan pajak (PPh) sebesar Rp 4,55 triliun.Adapun nilai pengungkapan harta yang sudah terdata mencapai Rp 44,6 triliun. Sementara untuk deklarasi dari dalam negeri diperoleh Rp 38,8 triliun.Sedangkan deklarasi dari luar negeri mencapai Rp 2,95 triliun. Kemudian, jumlah harta yang akan diinvestasikan ke instrumen surat berharga negara (SBN) mencapai Rp 2,81 triliun.Pemerintah tidak menargetkan jumlah pendapatan yang masuk dari pelaksanaan PPS ini, karena tujuan utamanya adalah kepatuhan sukarela dari WP. Program tersebut terbatas, hanya berlangsung 6 bulan di mulai dari 1 Januari hingga 30 Juni 2022. Program ini merupakan program yang diberikan kepada masyarakat wajib pajak, untuk meningkatkan kepatuhan nya dengan cara mendeklarasikan harta.Pelaporan PPS dapat dilakukan secara online melalui akun wajib pajak di situs djponline.pajak.go.id dalam jangka waktu 24 jam sehari dan tujuh hari seminggu dengan standar Waktu Indonesia Barat (WIB).Harta yang diungkap adalah harta dari 21 Desember 2020 dan juga ada yang dimiliki per 31 desember 2015 yang belum diikutkan dalam tax amnesty, ataupun yang belum dilampirkan dalam SPT terakhir tahun 2020.Demikian, PPS diselenggarakan berdasarkan asas kesederhanaan, kepastian hukum, serta kemanfaatan. Program ini diharapkan dapat mendorong aliran modal ke dalam negeri, dan memperkuat investasi di bidang pengolahan sumber daya alam dan sektor energi terbarukan."
41,Tommy Kurnia,Rusia Tidak Kepikiran untuk Pakai Senjata Nuklir,29 Maret 2022 09:30 WIB,https://www.liputan6.com/global/read/4923833/rusia-tidak-kepikiran-untuk-pakai-senjata-nuklir,"Liputan6.com, Moskow - Juru bicara pemerintah Rusia, Dmitry Peskov, berkata tidak ada rakyat di negaranya yang kepikiran untuk memakai senjata nuklir. Namun, Rusia berkata siap menelusuri berbagai kemungkinan jika ada intervensi.Ucapan itu diberikan Peskov ketika ditanya oleh PBS apakah Rusia ingin memakai senjata nuklir. ""Tidak ... Saya tidak berpikir demikian. Tetapi ia (Putin) cukup tegas dalam berkata 'jangan ikut campur,'"" ujar Peskov seperti dikutip media pemerintah Rusia, TASS.Sebelumnya Presiden Vladimir Putin menyiagakan pasukan khusus Rusia yang salah satu kekuatannya bisa adalah senjata nuklir. Ucapan itu dikritik oleh Gedung Putih, namun Peskov menegaskan Rusia tak ingin memakai senjata nuklir.""Tidak ada yang berpikir untuk menggunakan ... bahkan tentang ide menggunakan senjata nuklir,"" ujar jubir Kremlin. Jubir Kremlin juga mengkritik ucapan Presiden Joe Biden yang mengimplikasi agar ada perubahan rezim di Rusia. Ucapan itu disebut menghina.""Ini cukup mengkhawatirkan. Pertama, ini adalah hinaan personal dan seseorang sulit membayangkan pemakaian hinaan personal dalam retorika pemimpin politik, terutama pemimpin politik negara terhebat di dunia, Amerika Serikat,"" ucap Peskov.""Jadi kami sangat menyesali hal itu,"" lanjut Peskov. ""Pernyataannya apakah Putih harus atau tidak harus berkuasa di Rusia tentunya tak bisa diterima.""Gedung Putih sudah memberikan klarifikasi atas ucapan kontroversial Presiden Biden. Dijelaskan bahwa Biden membahas agar Putin tak berkuasa di negara-negara tetangga Rusia, bukan di Rusia itu sendiri."
42,Agustin Setyo Wardani,"Intip iPhone 13 Pro Max Ultra, iPhone Flagship yang Dimodifikasi dengan Port USB Type C",29 Maret 2022 09:30 WIB,https://www.liputan6.com/tekno/read/4923012/intip-iphone-13-pro-max-ultra-iphone-flagship-yang-dimodifikasi-dengan-port-usb-type-c,"Liputan6.com, Jakarta - Pemerhati teknologi dan smartphone mungkin tidak asing dengan iPhone yang dimodifikasi. Kali ini, iPhone paling premium, iPhone 13 Pro Max dimodifikasi dengan port USB Type C.Seperti diketahui, selama ini iPhone selalu menggunakan port Lightning besutan Apple sebagai port untuk mengisi daya.Namun, teknisi perangkat Yang Changsun memodifikasi port Lightning pada unit iPhone 13 Pro Max dan menggantinya dengan port USB Type C. Gara-gara ini, sejumlah pengguna menyebut perangkat hasil modifikasi itu sebagai iPhone 13 Pro Max Ultra.Mengutip Gizchina, Selasa (29/3/2022), Yang mengganti sejumlah komponen di iPhone 13 Pro Max. Hasilnya, sejumlah performa meningkat termasuk masa pemakaian baterai yang lebih lama.Sekadar informasi, model iPhone 13 Pro Max Ultra hasil modifikasi ini terungkap berkat video berdurasi 37 menit yang dibagikan oleh Yang di akun Weibo-nya.Video tersebut memperlihatkan sejumlah modifikasi yang diaplikasikan ke iPhone 13 Pro Max.Dari video diketahui, Yang menambahkan dua kipas pendingin built-in yang disesuaikan kecepatan otomatisnya bersama dengan motherboard lapisan ganda. Ia mengisinya dengan pasta termal. Hasil rekayasa tersebut adalah kinerja perangkat melonjak menjadi 870.244 poin ketika dites menggunakan AnTuTu benchmark.Sebagai perbandingan, hasil benchmark iPhone 13 Pro Max asli menorehkan skor 715.809 poin. Jadi, modifikasi ini menyuguhkan peningkatan kinerja yang signifikan pada iPhone 13 Pro Max Ultra.Tak hanya itu, Yang juga menyematkan baterai baru. Dengan begitu, iPhone 13 Pro Max ini memiliki kapasitas baterai dua kali lipat . Sekadar informasi, iPhone 13 Pro Max menjadi salah satu iPhone terbaik, dalam hal masa pakai baterai.Modifikasi ditambah pula dengan pemasangan USB Type C hingga pemasangan headphone jack 3,5mm ke iPhone 13 Pro Max Ultra.Penambahan ini, disebut-sebut tidak akan memengaruhi fungsi antarmuka Lightning yang ada. Tingkat modifikasi tersebut memperlihatkan bahwa Yang memiliki pengetahuan mendalam tentang perangkat.Tentunya, modifikasi ini tidak bisa dilakukan oleh orang sembarangan, apalagi mereka yang tidak memiliki kemampuan dalam reparasi perangkat.Sekadar informasi, meski saat ini banyak pabrikan smartphone sudah mengadopsi port USB Type C, Apple tetap enggan mengadopsinya ke iPhone. Namun, di masa depan hal ini mungkin saja berubah, pasalnya ada rancangan aturan yang mencoba meyakinkan perusahaan menggunakan standar pengisian universal.Selain itu, belum diketahui bagaimana nasib iPhone 13 Pro Max Ultra yang dimodifikasi oleh Yang. Ada kemungkinan ia akan menjualnya dalam waktu dekat untuk mendapatkan lebih banyak uang.Sebelumnya di tahun 2021, seorang mahasiswa teknik bernama Ken Pillionel mendapatkan USD 86.001 atau setara Rp 12,3 miliar setelah berhasil menjual iPhone X yang menggunakan port USB Type C melalui lelang.Selanjutnya, ada pula unit iPhone 12 yang dimodifikasi menggunakan port USB Type C pada awal tahun ini.(Tin/Isk)"
43,Surya Hadiansyah,Rian D'Masiv Sempat Marah kepada Sopir karena Maksa Nyetir Saat Ngantuk Sebelum Kecelakaan,29 Maret 2022 09:30 WIB,https://www.liputan6.com/showbiz/read/4923792/rian-dmasiv-sempat-marah-kepada-sopir-karena-maksa-nyetir-saat-ngantuk-sebelum-kecelakaan,"Liputan6.com, Jakarta Rombongan D'Masiv menjadi korban kecelakaan pada Minggu (27/3/2022) dini hari. Salah satu mobil yang ditumpangi Rian bersama dengan Wahyu (drummer), Rama (gitaris), dan seorang crew, keluar jalur dan menabrak tiang.Akibat kecelakaan itu, Rian D'Masiv dan teman-temannya mengalami luka-luka. Rian memar di bagian wajah, Wahyu di bagian dada, sementara Rama mengalami luka di bagian dagu.Dilihat dari potret yang beredar di media sosial, kondisi mobil bagian depan sudah cukup hancur. Diduga, kecelakaan tersebut terjadi karena sopir mengantuk. Untuk mengetahui kebenaran informasi yang beredar, silakan WhatsApp ke nomor 0811 9787 670 hanya dengan ketik kata kunci yang diinginkan.Rian D'Masiv sendiri begitu menyayangkan kelalaian dari sopir tersebut. Padahal, seharusnya si sopir tidak memaksakan untuk membawa mobil dalam kondisi mengantuk.""Kondisi mobil udah nggak tertolong juga, aku sempat agak marah sama drivernya karena ternyata dia ngantuk kan. Sebenarnya ini kelalaian manusia juga, karena dia bawa mobil dalam kondisi ngantuk, seharusnya kalau ngantuk dia bisa berhenti dulu kan,"" kata Rian D'Masiv dilansir dari tayangan YouTube Sambel Lalap pada Senin (28/3/2022). Rian D'Masiv sendiri tidak mengetahui secara pasti bagaimana kecelakaan tersebut terjadi. Pasalnya, sepanjang perjalanan itu ia memang banyak tertidur karena kelelahan. Namun, ia menduga bahwa sopir itu membawa mobil dalam kecepatan yang cukup tinggi.,""Berapa kecepatannya waktu itu juga aku nggak terlalu tahu ya, karena tidur pulas kan. Tapi kalau dilihat dari kerusakannya harusnya sih di atas 100 (km/jam),"" duga Rian D'Masiv. Rian D'Masiv juga tidak yakin luka-luka yang ia alami itu berasal dari mana. Ia menduga karena terbentur sebuah benda di depannya dengan keras sehingga membuat wajahnya penuh memar.""Aku pokoknya tiba-tiba udah terbentur, kayaknya kena bangku depanku deh. Ada tempat naro barang gitu, kotak. Pokoknya cepat banget kejadiannya, langsung (terhempas) ke depan gitu,"" kata Rian."
44,Fachrur Rozie,KPK Kejar Aliran Suap Walkot Nonaktif Rahmat Effendi Mengalir ke Golkar,29 Maret 2022 09:21 WIB,https://www.liputan6.com/news/read/4923856/kpk-kejar-aliran-suap-walkot-nonaktif-rahmat-effendi-mengalir-ke-golkar,"Liputan6.com, Jakarta - Komisi Pemberantasan Korupsi (KPK) menyatakan terus mengejar aliran suap Wali Kota nonaktif Bekasi Rahmat Effendi alias Pepen. Termasuk menemukan apakah aliran suap itu mengalir ke partai yang menaungi Pepen, yakni Golkar.""Kami akan telusuri lebih dahulu informasi yang ada termasuk yang disampaikan tadi (dugaan aliran dana ke Golkar),"" ujar Plt Juru Bicara KPK Ali Fikri dalam keterangannya, Selasa (29/3/2022).Ali memastikan tim penyidik akan mencari bukti permulaan yang cukup aliran uang haram Rahmat Effendi mengalir ke Partai Golkar. Tak hanya itu, tim penyidik juga akan menelusuri penggunaan uang-uang tersebut.""Prinsipnya sekali lagi di awal kami sampaikan, ya, kami akan terus telusuri mengenai penggunaan aliran dana penerimaan uang termasuk tadi informasi penggunaan uang-uang yang dimaksud untuk pembelian aset-aset,"" kata Ali.KPK menetapkan Wali Kota nonaktif Bekasi Rahmat Effendi (RE) alias Pepen dalam kasus dugaan suap pengadaan barang dan jasa serta jual beli jabatan di Pemerintahan Kota (Pemkot) Bekasi, Jawa Barat. Selain Pepen, KPK menjerat delapan tersangka lainnya. Delapan tersangka lain yakni Camat Rawa Lumbu Makhfud Saifudin (MA) Direktur PT MAM Energindo Ali Amril (AA), Lai Bui Min alias Anen (LBM), Direktur PT Kota Bintang Rayatri (KBR) Suryadi (SY). Mereka dijerat sebagai pihak pemberi.Kemudian Sekretaris Dinas Penanaman Modal dan PTSP M. Bunyamin (MB), Lurah Kati Sari Mulyadi (MY), Camat Jatisampurna Wahyudin (WY), dan Kepala Dinas Perumahan, Kawasan Permukiman dan Pertahanan Kota Bekasi Jumhana Lutfi (JL). Mereka dijerat sebagai pihak penerima bersama Rahmat Effendi.Penetapan tersangka terhadap mereka berawal dari operasi tangkap tangkap tangan (OTT) yang dilakukan tim penindakan KPK pada Rabu, 5 Januari 2022 hingga Kamis, 6 Januari 2022 di Bekasi dan DKI Jakarta. Tim penindakan KPK mengamnkan 14 orang beserta uang.Uang yang diamankan di antaranya uang tunai sebesar Rp 3 miliar dan Rp 2 miliar dalam bentuk tabungan."
