title,date,author,link,category,website,content
"IHSG Naik 1,09 Persen, Kapitalisasi Pasar Sentuh Rp 8.909 Triliun",02-4-2022,Agustina Melani,https://www.liputan6.com/saham/read/4927816/ihsg-naik-109-persen-kapitalisasi-pasar-sentuh-rp-8909-triliun,biasa,liputan,"Liputan6.com, Jakarta - Laju Indeks Harga Saham Gabungan (IHSG) menguat pada 28 Maret-1 April 2022. Pada pekan ini, IHSG pun bertahan di posisi 7.000.Mengutip data Bursa Efek Indonesia (BEI), IHSG melambung 1,09 persen menjadi 7.078,76 dari posisi 7.002,53.  Demikian juga kapitalisasi pasar bursa menguat 1,1 persen menjadi Rp 8.909,47 triliun pada pekan ini. Kapitalisasi pasar bursa bertambah Rp 97 triliun dari periode pekan lalu Rp 8.812,30 triliun.Sementara itu, rata-rata nilai transaksi harian bursa susut 0,97 persen menjadi Rp 13,83 triliun dari Rp 13,97 triliun pada pekan lalu.Kemudian rata-rata volume transaksi harian bursa melemah 10,35 persen menajdi 22,53 miliar saham dari 25,13 miliar saham pada penutupan pekan sebelumnya.Rata-rata frekuensi harian bursa susut 3,14 persen menjadi 1.242.024 transaksi dari 1.282.303 transaksi pada pekan sebelumnya. Investor asing membukukan aksi beli Rp 1,277 triliun. Sepanjang 2022, investor aisng membukukan aksi beli Rp 33,32 triliun.  Analis PT MNC Sekuritas, Herditya Wicaksana menuturkan, IHSG menguat jelang akhir pekan kemarin ke posisi 7.078 didorong aliran dana asing mencapai Rp 1,2 triliun.Selain itu, sentimen positif lainnya dari PMI Manufaktur Indonesia kembali meningkat 51,3. Namun, tingkat inflasi berada di atas konsensus yang mencapai 0,66 persen. Inflasi ini disumbangkan oleh kenaikan harga minyak goreng yang terjadi.“Untuk dapat dikatakan pemulihan ekonomi nanti dapat dilihat kembali pada daya beli masyarakat,” kata dia saat dihubungi Liputan6.com, ditulis Sabtu (2/4/2022).Pada pekan ini, Herditya menilai, hal tersebut dipengaruhi sentimen global antara lain perkembangan konflik Rusia-Ukraina.  Selain itu, resesi yang mengintai AS apabila the Fed tidak mampu meredam laju inflasi. “Harga komoditas minyak yang cenderung mengalami penurunan,” kata dia. Sedangkan dari internal, Herditya belum ada sentimen yang signifikan. Pada pekan depan, Herditya prediksi, IHSG akan menguatt terbatas dan rawan koreksi. IHSG akan bergerak di support 7.022 dan resistance 7.100.“Sentimen ke depan akan ada data rilis cadangan dan indeks keyakinan konsumen. Seputar konflik Rusia-Ukraina dan kebijakan ekonomi Amerika Serikat,” kata dia."
"Lockdown Diperpanjang, Warga Shanghai Mulai Kehabisan Bahan Makanan",02-4-2022,Benedikta Miranti T.V,https://www.liputan6.com/global/read/4927457/lockdown-diperpanjang-warga-shanghai-mulai-kehabisan-bahan-makanan,biasa,liputan,"Liputan6.com, Shanghai - Penduduk Shanghai menyuarakan rasa frustrasi yang meningkat pada Jumat (1 April) atas kebingungan selama seminggu lockdown COVID-19, menggunakan media sosial untuk mengeluh tentang kekurangan makanan dan perintah tinggal di rumah yang membingungkan.Setelah awalnya bersumpah mereka akan menghindari lockdown di seluruh kota, para pejabat mengubah taktik minggu ini dan mengumumkan penutupan bertahap yang membagi pusat keuangan China menjadi dua sehingga pihak berwenang dapat menguji 25 juta penduduknya. Demikian seperti dikutip dari laman Channel News Asia, Jumat (1/4/2022). Penguncian empat hari di daerah Pudong dimulai pada hari Senin, diikuti oleh perintah tinggal di rumah untuk zona Puxi yang berpenduduk padat yang akan dimulai pada hari Jumat.Tetapi banyak lingkungan Puxi tiba-tiba diperintahkan masuk pada Kamis pagi, sementara sebagian besar Pudong masih ditutup pada hari Jumat, membuat marah warga di kedua sisi.""Ini adalah lockdown seluruh kota secara de facto,"" kata seorang pengguna Weibo. ""Banyak jalan dan kompleks Pudong masih terkunci, hanya sedikit yang dicabut.""  Pihak berwenang pada Kamis malam menerbitkan rencana ""manajemen jaringan"" yang membingungkan untuk pembukaan kembali, yang akan membuat semua kompleks perumahan di mana tes positif ditemukan ditutup, serta ""sel"" di sebelahnya.Pembatasan telah menyebabkan pembelian panik di toko-toko serta kekurangan pengemudi pengiriman untuk mendapatkan makanan bagi jutaan orang yang sekarang terjebak di rumah.""Apakah lockdown yang berkelanjutan ini bertujuan untuk membuat kita kelaparan?"" poster lain di Weibo mengatakan, menyebut janji pemerintah sejauh ini sebagai ""penutup jendela"".Penduduk beberapa kompleks telah melewati pembatasan dengan menerima pengiriman yang diikat dengan tali yang diturunkan ke tanah, menurut wartawan AFP.Ketika kesabaran mulai memudar di Shanghai di antara publik yang secara luas menyetujui pengendalian virus selama dua tahun, pejabat kota terkemuka Ma Chunlei pada hari Kamis membuat pengakuan kegagalan yang langka, dengan mengatakan kota itu ""tidak cukup siap"" untuk wabah tersebut."
Jadwal MPL ID S9 Hari Ini 2 April 2022: Onic Esports hingga RRQ Hoshi Siap Tanding,02-4-2022,Yuslianson,https://www.liputan6.com/tekno/read/4927835/jadwal-mpl-id-s9-hari-ini-2-april-2022-onic-esports-hingga-rrq-hoshi-siap-tanding,biasa,liputan,"Liputan6.com, Jakarta - Enam tim esports Mobile Legends pada hari kedua dari pekan ke-7 MPL ID S9 hari ini siap bertarung di land of dawn.Pertandingan hari ini dibuka oleh laga Bigetron Alpha vs Onic Esports, dilanjutkan dengan pertarungan Evos Legends vs Geek Fam.Sementara itu, RRQ Hoshi vs Alter Ego akan menjadi laga penutup MPL ID S9 hari ini 2 April 2022.Adapun jadwal MPL ID S9 hari ini 2 April 2022, adalah sebagai berikut:Sepanjang MPL ID musim ini, track record RRQ Hoshi memang lebih unggul ketimbang Bigetron Alpha saat keduanya bertarung.Dari tiga kali bertemu, RRQ Hoshi mampu menang telak dengan skor 2-0 atas Bigetron Alpha. Lalu bagaimana dengan laga hari ini?Apakah Bigetron Alpha akan kembali tunduk dari tim berjulukan ""Raja dari Segala Raja"" ini, atau mampu meraih kemenangan pertama mereka? Geek Fam memang sedang mengalami masa sulit, dengan tidak pernah menang sama sekali di MPL ID S9 ini.Sementara itu, Evos Legends yang sedang winning streak dalam dua laga sebelumnya pastinya mengincar kemenangan ketiga secara berurutan di leg kedua ini.RRQ Hoshi yang berada di puncak kelasemen MPL ID S9 tampaknya tidak ingin bersantai-santai dan mengincar poin penuh agar menjaga jarak dari Aura Fire dan Onic Esports yang berada di posisi kedua dan ketiga.Sedangkan Alter Ego yang berada di posisi ke-6 harus menang agar tidak jatuh dari peringkat mereka sekarang.(Ysl/Tin)"
"Daftar Kebutuhan Pokok yang Harganya Naik di 2022, Rakyat Makin Susah",02-4-2022,Liputan6.com,https://www.liputan6.com/bisnis/read/4927797/daftar-kebutuhan-pokok-yang-harganya-naik-di-2022-rakyat-makin-susah,biasa,liputan,"Liputan6.com, Jakarta Jelang Ramadhan, masyarakat harus kembali bersabar lantaran sejumlah harga kebutuhan pokok naik. Jika minyak goreng hingga saat ini juga masih mahal, ditambah kebijakan tarif PPN 11 persen yang menyebabkan harga-harga kebutuhan lainnya juga naik.Tidak hanya itu, sebelumnya, pemerintah melalui PT Pertamina (Persero) juga telah menaikkan harga LPG nonsubsidi. Dalihnya, harga produksi meningkat imbas harga minyak duni ayang melambung. Tidak berhenti di situ, Pertamina juga baru saja menaikkan harga Pertamax di seluruh Indonesia.Kenaikan sejumlah bahan pokok dan juga kebutuhan lainnya ini, disebutkan jelas memberatkan masyarakat. Bahkan, keputusan pemerintah ini bisa mempengaruhi target pertumbuhan ekonomi Indonesia pada 2022. ""Stabilitas harga ini merupakan kunci untuk memperkuat pemulihan ekonomi ya. Jadi seharusnya pemerintah bisa untuk mencegah terjadinya kenaikan harga yang diatur oleh pemerintah seperti BBM, LPG kemudian tarif listrik,"" kata Direktur Center of Economics and Law Studies (Celios) Bhima Yudhistira.Berikut daftar sejumlah kebutuhan pokok yang sudah naek selama 2022:1. LPGHarga LPG nonsubsidi kembali mengalami kenaikan. Ini berarti kenaikan kedua pasca kenaikan harga pada Desember 2021 lalu.PT Pertamina Patra Niaga, Sub Holding Commercial & Trading PT Pertamina (Persero) kembali menyesuaikan harga LPG nonsubsidi. Kini, harganya dipatok Rp15.500 per kilogram.Harga baru seluruh produk LPG nonsubsidi ini berlaku mulai tanggal 27 Februari 2022.""Penyesuaian harga ini telah mempertimbangkan kondisi serta kemampuan pasar LPG nonsubsidi, selain itu harga ini masih paling kompetitif dibandingkan berbagai negara di ASEAN,"" kata Pjs. Corporate Secretary PT Pertamina Patra Niaga, SH C&T PT Pertamina (Persero) Irto Ginting dalam keterangan resmi, Minggu (27/2/2022).2. KedelaiIndonesia saat ini masih menjadi negara pengimpor kedelai. Akibatnya, harga kedelai tak bisa dikendalikan dan saat ini masih mahal. Mahalnya harga kedelai ini, bahkan sempat mebuat para pengrajin tahu tempe mogok produksi sebagai aksi protes.Asosiasi Kedelai Indonesia (Akindo) selaku importir kedelai dari pasar internasional coba menjelaskan, kenaikan harga kedelai impor ini tak bisa dihindari akibat adanya sejumlah faktor.Alasan pertama dan yang terbesar, gejolak inflasi di Amerika Serikat (AS) selaku importir terbesar. Pada 2021 lalu, angka inflasi di Negeri Paman Sam menyentuh 7 persen, dan menguat jadi 7,5 persen secara year on year pada Januari 202.""Itu memicu harga-harga input produksi pertanian naik. Sehingga petani di Amerika kan harus jual lebih mahal dari biasanya,"" terang Direktur Akindo Hidayat kepada Liputan6.com, Senin (21/2/2022).Masyarakat tengah dihadapkan oleh kenaikan harga komoditas pangan. Mulai dari minyak goreng yang sulit ditemukan hingga harga daging sapi yang belakangan mengalami kenaikan hingga Rp 165 Ribu per Kilogram.Koordinator Nasional Koalisi Masyarakat untuk Kedaulatan Pangan (KRKP) Said Abdullah mengungkapkan sejumlah penyebab harga komoditas pangan itu mengalami kenaikan. Untuk komoditas yang dengan tingkat produksi dalam negeri cukup besar, penyebabnya ada pada kapasitas produksi dan distribusi.“Di tingkat produksi sebenarnya kita secara umum tidak ada masalah, terutama pangan yang dihasilkan dalam negeri seperti beras dan minyak goreng. produksinya baik baik saja,” katanya kepada Liputan6.com, Jumat (25/2/2022).Sementara itu, untuk komoditas yang cukup bergantung pada impor, seperti daging, gula dan kedelai, ini dipengaruhi oleh pasokan internasional. Sehingga harga di dalam negeri juga dipengaruhi fluktuasi harga dan supply chain global.4. Minyak GorengHarga minyak goreng ini menjadi salah satu yang belum turun. Padahal, pemerintah sudah melakukan berbagai cara untuk menurunkannya. Tapi hasilnya nihil. Presiden Joko Widodo (Jokowi) menilai harga minyak goreng curah masih belum pada posisi yang diinginkan pemerintah yakni sebesar Rp 14.000 per liter. Serta stok minyak goreng curah belum banyak.Ini disampaikan kepala negara saat mengecek ketersediaan sejumlah bahan kebutuhan pokok masyarakat di sejumlah pasar tradisional, beberapa hari menjelang bulan suci Ramadan.Salah satu pasar yang dikunjungi Jokowi adalah Pasar Rakyat di Desa Tempurejo, Kecamatan Tempuran, Kabupaten Magelang, Provinsi Jawa Tengah, pada Rabu (30/03/2022).“Utamanya untuk minyak memang yang di kemasan harganya rata-rata Rp 24.000, tapi untuk minyak curah ada tetapi stoknya tidak banyak. Tadi saya lihat sisanya di situ tinggal kira-kira 2 liter, harganya Rp 15.500 masih belum mencapai apa yang kita inginkan di Rp14.000. Untuk harga-harga yang lain masih pada posisi yang baik,” ujar Jokowi melansir laman Setkab, Rabu (30/3/2022).Jokowi mengatakan ingin memantau langsung harga pangan terutama menjelang Ramadan. Utamanya melihat komoditas minyak goreng. Dikatakan jika saat ini harga minyak kemasan rata-rata Rp 24.000. Mulai 1 April 2022 pukul 00.00 waktu setempat, harga Pertamax resmi naik. Informasi ini sudah dipastikan oleh Pertamina melalui PT Pertamina Patra Niaga.Pjs. Corporate Secretary PT Pertamina Patra Niaga, SH C&T PT Pertamina (Persero), Irto Ginting menjelaskan penyesuaian harga BBM RON 92 ini menjadi Rp 12.500 per liter (untuk daerah dengan besaran pajak bahan bakar kendaraan bermotor /PBBKB 5 persen), dari harga sebelumnya Rp 9.000 per liter.""Pertamina selalu mempertimbangkan daya beli masyarakat, harga Pertamax ini tetap lebih kompetitif di pasar atau dibandingkan harga BBM sejenis dari operator SPBU lainnya. Ini pun baru dilakukan dalam kurun waktu 3 tahun terakhir, sejak tahun 2019,"" jelas Irto Ginting, Kamis (31/3/2022).Penyesuaian harga Pertamax ini, lanjut Irto, masih jauh di bawah nilai keekonomiannya. Sebelumnya, Kepala Biro Komunikasi, Layanan Informasi Publik dan Kerjasama Kementerian ESDM, Agung Pribadi dalam keterangan tertulisnya menyatakan dengan mempertimbangkan harga minyak bulan Maret yang jauh lebih tinggi dibanding Februari, maka harga keekonomian atau batas atas BBM umum RON 92 bulan April 2022 akan lebih tinggi lagi dari Rp 14.526 per liter, bisa jadi sekitar Rp 16.000 per liter.6. Token Listrik hingga Baju LebaranPemerintah juga secara resmi menaikkan PPN menjadi 11 persen per 1 April 2022. Akibatnya, sejumlah harga barang mengalami kenaikan, mulai dari pulsa, token listrik, hingga baju lebaran.Tarif PPN 11 persen mulai berlaku hari ini, 1 April 2022. Kementerian Keuangan menjelaskan, kenaikan tarif PPN 11 persen ini merupakan amanat pasal 7 Undang-Undang Nomor 7 Tahun 2021 tentang Harmonisasi Peraturan Perpajakan (UU HPP).Selain itu, kebijakan tersebut merupakan bagian tidak terpisahkan dari reformasi perpajakan dan konsolidasi fiskal sebagai fondasi sistem perpajakan yang lebih adil, optimal, dan berkelanjutan.Adapun barang-barang yang berpotensi mengalami kenaikan per 1 April 2022 antara lain:1. Barang elektronik2. Baju atau pakaian3. Sabun dan perlengkapan mandi4. Sepatu5. Berbagai jenis produk tas6. Pulsa telepon dan tagihan internet7. Rumah atau hunian8. Motor/mobil atau kendaraan dan barang lainnya yang dikenakan PPNPemerintah berencana akan menaikkan harga Bahan Bakar Minyak (BBM) subsidi jenis Pertalite, Premium, hingga LPG 3 kg secara bertahap pada periode Juli hingga Maret 2022.Hal itu disampaikan langsung oleh Menteri Koordinator Bidang Kemaritiman dan Investasi, Luhut Binsar Panjaitan atau Menko Luhut.""Over all, yang akan terjadi itu Pertamax, Pertalite, Premium, gas yang 3 kilo itu bertahap. Jadi 1 April, nanti Juli, nanti September itu bertahap (naiknya) dilakukan oleh pemerintah,"" ujarnya saat meninjau Proyek LRT di Depo LRT Jabodebek Bekasi, Jumat (1/4/2022).Menko Luhut menyebut, kebijakan penyesuaian harga itu bagian dari efisiensi pemerintah imbas dari kenaikan sejumlah komoditas. Menurutnya, rencana tersebut menemuka dalam rapat terbatas bersama Presiden Joko Widodo.""Semua efisiensi kita lakukan. kKita akan mendorong perintah Presiden kemarin dalam rapat pemakaian mobil listrik tempatnya Pak Budi Karya (Menhub),"" tegasnya."
"15 Link Twibbon untuk Rayakan Ramadhan dan Cara Menggunakannya, Cocok Dibagikan ke Media Sosial!",02-4-2022,Sabrina Julie,https://jateng.liputan6.com/read/4927723/15-link-twibbon-untuk-rayakan-ramadhan-dan-cara-menggunakannya-cocok-dibagikan-ke-media-sosial,biasa,liputan,"Liputan6.com, Semarang - Akhirnya bulan suci Ramadhan telah tiba. Sudah semestinya umat muslim menyambut bulan yang penuh berkah ini dengan perasaan suka cita dan bersiap untuk memperbanyak amalan ibadah. Dalam menyambut bulan suci Ramadhan, banyak orang yang saling berkirim ucapan ataupun mengunggah potret di media sosial. Agar foto lebih menarik  dan estetik yuk pakai beberapa Twibbon berikut. 1. https://www.twibbonize.com/syahruramdhn2. https://www.twibbonize.com/marhabanyaramadhan1443h3. https://www.twibbonize.com/ramadhan2022nailla4. https://www.twibbonize.com/selmtdngramadhn5. https://www.twibbonize.com/bulnramdhan6. https://www.twibbonize.com/selamat-puasa-ramadhan7. https://www.twibbonize.com/puasaramdhn8. https://www.twibbonize.com/ramadhan-1443h9. https://www.twibbonize.com/selamat-puasa10. https://www.twibbonize.com/myr0711. https://www.twibbonize.com/ramadankareem1443h12. https://www.twibbonize.com/alfatihramadhan202213. https://www.twibbonize.com/ramadhan1443hijriah00814. https://www.twibbonize.com/ramadhan1443hijriah00315. https://www.twibbonize.com/ramadan-berkah2"
Doa Mandi Sebelum Puasa Ramadhan dan Tata Caranya,01-4-2022,Sulung Lahitani,https://www.liputan6.com/ramadan/read/4927056/doa-mandi-sebelum-puasa-ramadhan-dan-tata-caranya,popular,liputan,"Liputan6.com, Jakarta - Sebelum memasuki bulan puasa Ramadhan, umat Islam biasanya melakukan amalan yang amat khas. Tidak hanya ziarah kubur, mandi besar sebelum puasa juga kerap menjadi amalan yang dilakukan oleh kebanyakan orang.Mandi besar sebelum puasa Ramadhan dimaknai sebagai salah satu usaha untuk menyiapkan diri, lahir dan batin dalam menyambut bulan Ramadhan.Untuk diketahui, mandi keramas sebelum puasa bukanlah aturan atau kewajiban dalam Islam. Jadi Anda boleh melakukannya, boleh pula tidak.Berikut bacaan doa mandi sebelum puasa Ramadhan yang perlu kamu ketahui:Artinya:"" Aku berniat mandi sunnah memasuki bulan Ramadan karena Allah Ta’ala."" 0811 9787 670 hanya dengan ketik kata kunci yang diinginkan.Tata cara mandi sebelum puasa tidak jauh berbeda dengan mandi wajib atau mandi besar pada umumnya. Mandi sebelum puasa kerap dilakukan dengan membersihkan rambut atau keramas.Berikut tata cara mandi wajib sebelum puasa:"
"Kelas BPJS Kesehatan Bakal Dihapus, Ini 12 Kriteria Rawat Inap Standar RS",01-4-2022,Diviya Agatha,https://www.liputan6.com/health/read/4927079/kelas-bpjs-kesehatan-bakal-dihapus-ini-12-kriteria-rawat-inap-standar-rs,popular,liputan,"Liputan6.com, Jakarta - Kelas rawat inap standar (KRIS) untuk peserta Jaminan Kesehatan Nasional (JKN) BPJS Kesehatan akan dihapuskan. Seperti diketahui, kelas yang ada sebelumnya adalah 1, 2, 3.Ketua Dewan Jaminan Kesehatan Nasional (DJSN) Andie Megantara mengungkapkan peta jalan (road map) implementasi KRIS JKN yang baru untuk tahun 2022-2024 pun telah tersusun.""Terdapat 12 kriteria yang telah disepakati bersama antar pemerintah dan menjadi dasar penyelenggaraan KRIS JKN,"" ujar Andie dalam Rapat Kerja Komisi IX DPR RI dengan Menteri Kesehatan RI ditulis Jumat, (1/4/2022).""12 kriteria tersebut ditetapkan untuk memenuhi standar pencegahan dan pengendalian infeksi serta mengedepankan keselamatan pasien. Seluruh rumah sakit diharapkan dapat memenuhi 12 kriteria tersebut,"" tambahnya.Andie juga menjelaskan bahwa kriteria ini bukanlah kriteria baru, melainkan sebelumnya telah ditetapkan oleh Kementerian Kesehatan (Kemenkes) melalui Permenkes No 24 Tahun 2016 tentang Persyaratan Teknis Bangunan dan Prasarana Rumah Sakit.Adapun 9 dari 12 kriteria yang ada merupakan kriteria wajib, sedangkan kriteria nomor 10 sampai 12 dapat dilakukan secara bertahap.Maka berkaitan dengan hal tersebut, ada 12 kriteria rawat inap standar di rumah sakit nantinya yang akan ditanggung oleh JKN.Lalu apa sajakah ke 12 kriteria tersebut? Berikut diantaranya.1. Bahan bangunan di rumah sakit tidak memiliki porositas yang tinggi2. Ventilasi udara3. Pencahayaan ruangan4. Kelengkapan tempat tidur dengan minimal 2 setop kontak dan tidak boleh ada percabangan atau sambungan langsung tanpa pengamanan arus. Serta, nurse call yang terhubung dengan ruang jaga perawat5. Tersedia meja nakas 1 buah per tempat tidur6. Dapat mempertahankan dengan stabil suhu ruangan 20-26 derajat celsius7. Ruangan terbagi jenis kelamin, usia, jenis penyakit (infeksi, noninfeksi, bersalin)8. Kepadatan ruang rawat dan kualitas tempat tidur bagi KRIS JKN: Jarak antar tempat tidur 2,4 meter, minimal luas per tempat tidur 10 meter persegi, antar tepi tempat tidur minimal 1,5 meter, jumlah maksimal tempat tidur per ruangan sebanyak 4 tempat tidur, tempat tidur dapat disesuaikan (adjustable), 200x90x(50-80) cm9. Tirai atau partisi rel dibenamkan atau menempel plafon dan bahan tidak berpori10. Kamar mandi di dalam ruangan inap11. Kamar mandi sesuai standar aksesibilitas12. Outlet oksigen"
"Menko Luhut: Usai Pertamax, Harga LPG 3 Kg hingga Pertalite Juga Naik",01-4-2022,Liputan6.com,https://www.liputan6.com/bisnis/read/4927010/menko-luhut-usai-pertamax-harga-lpg-3-kg-hingga-pertalite-juga-naik,popular,liputan,"Liputan6.com, Jakarta Pemerintah berencana akan menaikkan harga Bahan Bakar Minyak (BBM) subsidi jenis Pertalite, Premium, hingga LPG 3 kg secara bertahap pada periode Juli hingga Maret 2022.Hal itu disampaikan langsung oleh Menteri Koordinator Bidang Kemaritiman dan Investasi, Luhut Binsar Panjaitan atau Menko Luhut.""Over all, yang akan terjadi itu Pertamax, Pertalite, Premium, gas yang 3 kilo itu bertahap. Jadi 1 April, nanti Juli, nanti September itu bertahap (naiknya) dilakukan oleh pemerintah,"" ujarnya saat meninjau Proyek LRT di Depo LRT Jabodebek Bekasi, Jumat (1/4/2022).Menko Luhut menyebut, kebijakan penyesuaian harga itu bagian dari efisiensi pemerintah imbas dari kenaikan sejumlah komoditas. Menurutnya, rencana tersebut menemuka dalam rapat terbatas bersama Presiden Joko Widodo.""Semua efisiensi kita lakukan. kKita akan mendorong perintah Presiden kemarin dalam rapat pemakaian mobil listrik tempatnya Pak Budi Karya (Menhub),"" tegasnya.Dia menyebut kenaikan BBM nonsubsidi jenis Pertamax tergolong terlambat. Menyusul kenaikkan harga minyak mentah dunia sudah berlangsung lama dan telah melebihi batas kewajaran di APBN 2022.""Saya ingin berikan gambaran, seluruh dunia kemarin (naik) paparan saya kepada presiden (Jokowi). Memang kita yang paling terlambat menaikkan (BBM). Semua negara-negara sudah naik,"" katanya.  Menko Luhut mencatat, saat ini, harga minyak mentah dunia telah menembus level USD 100 per barel. Sedangkan, dalam asumsi alokasi APBN harga minyak dipatok USD 63 per barel.""Kan angkanya sudah luar biasa,"" tekannya.Menko Luhut menyebut, kenaikan komoditas minyak mentah dunia sendiri dipengaruhi oleh sejumlah faktor. Antara lain dengan peningkatan permintaan akibat pemulihan ekonomi global hingga perang antara Rusia dan Ukraina.""Sekarang sunflower tidak bisa impor atau ekspor dari Ukraina karena perang,"" ungkapnya.Untuk itu, dia menyatakan kenaikkan harga BBM jenis Pertamax sudah harus dilakukan pada 1 April 2022. Hal ini demi menyelamatkan keuangan Pertamina imbas mahalnya harga minyak mentah dunia.""Kalau di tahan terus nanti akan jebol (keuangan) Pertamina. Jadi, terpaksa harus kita lakukan,"" tutupnya.Reporter: SulaemanSumber: Merdeka.com"
