title,date,author,link,category,website,content
7 Keutamaan 10 Hari Pertama Bulan Ramadhan yang Tidak Boleh Dilewatkan,02-4-2022,Husnul Abdi,https://www.liputan6.com/ramadan/read/4926556/7-keutamaan-10-hari-pertama-bulan-ramadhan-yang-tidak-boleh-dilewatkan,biasa,liputan,"Liputan6.com, Jakarta Keutamaan 10 hari pertama bulan Ramadhan  perlu diketahui oleh setiap muslim. Pasalnya, 10 hari pertama ini dianggap sebagai fase terberat berpuasa, di mana kamu baru beradaptasi dengan aktivitas tanpa makan di siang hari. Hal ini tentunya juga memberikan keutamaan yang besar untuk kamu yang memaksimalkan ibadah.Tidak hanya berpuasa, kamu juga bisa melakukan amalan-amalan lainnya seperti membaca Al-Qur’an, membaca doa, banyak berzikir, salat malam, hingga bersedekah. Bila kamu melakukan amalan-amalan tersebut secara rutin, kamu tentu akan mendapatkan balasan yang setimpal dari Allah SWT.Keutamaan 10 hari pertama bulan Ramadhan bisa kamu dapatkan dengan rajin beribadah. Pada awal bulan Ramadhan, Allah SWT  membuka pintu rahmat-Nya untuk setiap hamba yang berpuasa dan rajin beribadah.Dari Abu Hurairah Radhiyallahu 'Anhu, ia berkata bahwa Rasulullah Shallallahu Alaihi wa Sallam bersabda:""Awal bulan Ramadan adalah Rahmat, pertengahannya Maghfirah, dan akhirnya 'Itqun Minan Nar (pembebasan dari api neraka).""Berikut Liputan6.com rangkum dari berbagai sumber, Kamis (31/3/2022) tentang keutamaan 10 hari pertama bulan Ramadhan.Terbukanya Pintu RahmatSeperti yang telah disinggung sebelumnya, keutamaan 10 hari pertama bulan Ramadhan sesuai hadis yaitu terbukanya pintu rahmat. Dari Abu Hurairah Radhiyallahu 'Anhu, ia berkata bahwa Rasulullah Shallallahu Alaihi wa Sallam bersabda:""Awal bulan Ramadan adalah Rahmat, pertengahannya Maghfirah, dan akhirnya 'Itqun Minan Nar (pembebasan dari api neraka).""Pada 10 hari pertama di bulan Ramadhan, Allah SWT membuka pintu rahmat-Nya untuk setiap hamba yang melakukan puasa, dan dipandang sebagai seorang yang mulia karena menjalankan ibadah sejak awal.Penuh Berkah dan KeberuntunganKeutamaan 10 hari pertama bulan Ramadhan berikutnya adalah mendapatkan berkah dan keberuntungan. Keberuntungan akan didapat oleh orang yang menjalankan puasa di 10 hari pertama Ramadan. Ia akan selalu dalam lindungan Allah SWT selama bulan Ramadhan serta selalu berada dalam petunjukNya.Pahala Berlipat Ganda saat Membaca Al-Qur’anAl-Qur’an diturunkan pada bulan Ramadhan, sebagai ilmu dan pengetahuan, serta sebagai penunjuk jalan kehidupan. Nah di bulan ini pahala membaca Al-Quran dilipatgandakan. Membaca Al-Quran juga bisa mendatangkan ketenangan hati dan rahmat Allah SWT.""Di antara amal kebajikan yang sangat dianjurkan dilakukan di bulan Ramadan adalah tadarus Al-Quran. Tadarus Al-Quran berarti membaca, merenungkan, menelaah, dan memahami wahyu-wahyu Allah SWT yang turun pertama kali pada malam bulan Ramadan."" (QS. Al Baqarah ayat 185).Belajar Memperbanyak ZikirZikir adalah salah satu bentuk ibadah yang dapat dilakukan kapanpun dan di manapun tempatnya selama tempat itu suci. Zikir adalah mengingat Allah dan barangsiapa ingin selalu dekat denganNya maka perbanyaklah berzikir. Hati yang senantiasa berzikir akan selalu teringat pada Allah SWT dan dekat dengannya.Waktu yang Tepat untuk BerdoaDi bulan suci Ramadan, banyak waktu yang mustajab untuk berdoa, yaitu saat berpuasa, saat waktu sahur, saat azan berkumandang, dan saat malam lailatul qadar. Bahkan, kamu bisa menerapkan doa di 10 hari pertama bulan Ramadhan, dari hari pertama puasa hingga hari ke-10. Setiap harinya ada doa-doa yang berbeda yang bisa kamu lantunkan, yang mana tentunya memiliki keistimewaannya masing-masing.Membiasakan Diri untuk Salat BerjamaahSalat berjamaah pada bulan puasa perlu diutamakan, terutama bagi kaum pria. Salat berjamaah juga sebagai cara silahturahmi, serta menjaga hubungan baik antarmuslim yang juga merupakan sebuah ibadah. Rasulullah SAW tidak pernah meninggalkan salat berjamaah, meskipun dalam keadaan sakit maupun cuaca yang tidak menentu.Memperbanyak Amal Ibadah SunahBulan Ramadhan juga waktunya untuk umat muslim memperbanyak ibadah sunah. Jangan melewatkan waktu di 10 hari pertama bulan Ramadhan tanpa memperbanyak ibadah sunah. Luangkan waktu kamu untuk beribadah sunah seperti salat dhuha, salat rawatib, salat tarawih, salat witir, dan membaca Alquran."
"Masjid Erick Thohir di Los Angeles Diresmikan, Jadi Tempat Dakwah Baru Warga AS",02-4-2022,Arief Rahman Hakim,https://www.liputan6.com/bisnis/read/4927878/masjid-erick-thohir-di-los-angeles-diresmikan-jadi-tempat-dakwah-baru-warga-as,biasa,liputan,"Liputan6.com, Jakarta Pembangunan Masjid At-Thohir di Los Angeles California oleh Erick Thohir telah rampung. Ini jadi masjid kedua yang diresmikan dengan nama serupa setelah masjid di Tapos, Depok.Menteri Badan Usaha Milik Negara (BUMN) Erick Thohir berharap adanya masjid ini bisa dimanfaatkan oleh muslim di Los Angeles. Salah satunya bisa menjadi rumah untuk kegiatan dakwah.""Dalam menyambut bulan suci Ramadan, besar harapan saya agar Masjid At-Thohir di LA bisa menjadi rumah bagi seluruh umat Islam yang ada di sana,"" katanya melalui akun Instagram @erickthohir, Sabtu (2/3/2022).""Selain itu, masjid ini dapat berkontribusi menjadi pusat syiar dan dakwah di Amerika Serikat,"" imbuhnya.Masjid ini dibalut dengan warna putih yang cukup mencolok diantara deretan gedung di sebelahnya. Terlihat jelas tulisan Masjid At-Thohir berwarna biru dongker di sisi atas dinding Masjid.""Alhamdulillah masjid AtThohir sudah diremikan, terima aksih atas dukungannya dan supportnya. InsyaAllah masjid ini bisa bermfaat bagi umat musik indonesia atau lainnya yang ada di Los Angeles,"" kata Erick.Ia pun mengajak sekuruh umat muslim di LA untuk bisa memanfastkan masjid yang didedikasikan untuk mendiang Almarhun amUhammad Thohir, ayah Erick.""Kepada seluruh umat muslim di Amerika Serikat, kami undang saudara-saudara sekalian untuk beribadah bersama di Masjid At-Thohir yang berlokasi di Los Angeles, California,"" tuturnya. Duta Besar Indonesia untuk Amerika Serikat, Rosan Roeslani meresmikan Masjid At-Thohir di Jalan Kenmore, di pusat kota Los Angeles, Minggu, 27 Maret 2022 waktu setempat.Masjid bernuansa putih dan berlantai dua ini baru selesai direnovasi sekitar dua bulan lalu. Masjid ini dibeli dan direnovasi atas amal jariyah umat muslim Indonesia dan mayoritas bantuan keluarga besar almarhum Mochamad Thohir pada 2018 lalu.Dengan izin Allah SWT dan mengucap bismillahirrahmanirrahim saya buka masjid At-Thohir ini,"" kata Dubes Rosan.Rosan mengatakan Masjid berlantai dua ini baru selesai direnovasi dua bulan lalu. Masjid bernuansa putih ini dibeli dan direnovasi atas amal jariyah umat muslim Indonesia dan bantuan keluarga besar almarhum Mochamad Thohir pada 2018.Rosan berharap kehadiran masjid At-Thohir akan membuat makin berkembangnya komunitas muslim di Los Angeles.""Semoga dapat mempererat silaturahim dan juga berdampak positif untuk komunitas muslim dan komunitas agama lain,"" harap Rosan.Rosan menyampaikan terima kasih atas upaya masyarakat muslim di Los Angeles dan Boy Thohir serta keluarga Mochamad Thohir atas berdirinya masjid ini."
Prediksi Liga Inggris Manchester United vs Leicester City: Duel Krusial,02-4-2022,Defri Saefullah,https://www.liputan6.com/bola/read/4927675/prediksi-liga-inggris-manchester-united-vs-leicester-city-duel-krusial,biasa,liputan,"Liputan6.com, Jakarta Manchester United atau MU menjalani duel krusial menghadapi Leicester City di Old Trafford, Sabtu (2/4/2022) malam ini. Menjelang 9 laga terakhir, poin penuh di laga ini begitu penting bagi Man Utd.Seperti diketahui, MU saat ini terperosok ke peringkat enam klasemen Liga Inggris. Mereka masih terpaut 4 poin dari Arsenal yang nyaman berada di posisi keempat.Arsenal bahkan masih punya tabungan satu laga. Karena itu, Man Utd menjalani duel hidup mati lawan Leicester City.Hasil imbang atau kalah akan membawa mereka semakin jauh dari Arsenal. Zona Liga Champions yang jadi target realistis pun bakal jauh dari genggaman.Skuat MU sangat siap menghadapi duel lawan Leicester City. Menurut manajer sementara Man Utd, Ralf Rangnick, hanya Edinson Cavani yang belum fit dari cedera. Rangnick juga menyoroti soal pemain MU yang baru pulang membela tim nasional. Pemain yang cukup jauh menempuh perjalanan yaitu duo Brasil, Alex Telles dan Fred.""Mereka langsung pulang setelah pertandingan. Saya pikir mereka sudah mengatasi jet lag dan siap main di laga melawan Leicester City,"" katanya.""Semua pemain yang main di kalender FIFA cukup fit, kecuali Edinson Cavani. Dia kembali mengalami cedera karena masalah tulang kering,"" dia menambahkan.  16/10/21 LIP Leicester City FC 4 - 2 Manchester United FC12/05/21 LIP Manchester United FC 1 - 2 Leicester City FC22/03/21 FAC Leicester City FC 3 - 1 Manchester United FC26/12/20 LIP Leicester City FC 2 - 2 Manchester United FC26/07/20 LIP Leicester City FC 0 - 2 Manchester United FC  Manchester United: De Gea; Dalot, Varane, Maguire, Shaw; McTominay, Fred; Rashford, Fernandes, Sancho; RonaldoLeicester City : Schmeichel; Fofana, Evans, Soyuncu; Justin, Dewsbury-Hall, Tielemans, Castagne; Maddison, Daka, Barnes"
Daikin Ceiling Mounted Cassette Round Flow: AC Hemat dan Minimalis untuk Ruang Usaha Kekinian,25-3-2022,Gilar Ramdhani,https://www.liputan6.com/lifestyle/read/4918488/daikin-ceiling-mounted-cassette-round-flow-ac-hemat-dan-minimalis-untuk-ruang-usaha-kekinian,biasa,liputan,"Liputan6.com, Jakarta Beriring dengan perkembangan desain interior bagi hunian, ruang usaha pun mengikut pada penataan yang lebih minimalis di tengah upayanya untuk tetap menjadikan ruangan nyaman dan menarik bagi orang yang beraktivitas di dalamnya. Bila cukup waktu luang sedikit saja untuk diperhatikan, cafe, restoran hingga perkantoran pun semakin bergerak pada nuansa yang lebih minimalis.  Terlebih di tengah semakin maraknya ruang kerja bersama (co-working space). Tak hanya kelengkapan fasilitas, seperti halnya café atau tempat hang out lainnya, kenyamanan desain interior keseluruhan co working space semakin menjadi pertimbangan bagi calon pengguna untuk memanfaatkan jasa ini.  Bila penataan ruang dan segala kelengkapan ruang usaha sudah mendapatkan sentuhan, satu hal yang tak boleh luput dari perhatian adalah perangkat penyejuk ruangan (air conditioner). Di tengah tren minimalis ini, para pelaku usaha tak dapat lagi memaknai keberadaannya hanya dari fungsi utamanya sebagai penyejuk ruangan. Lebih dari itu, kehadirannya pun harus diperhitungkan sebagai elemen penting yang dapat menyatu dengan keseluruhan tata ruang dalam.  Untuk kebutuhan ini, DAIKIN sebagai pemimpin pasar perangkat penyejuk ruangan di Indonesia memiliki solusinya. Hal ini dilakukan melalui kehadiran AC DAIKIN Sky Air Ceiling Mounted Cassette Round Flow. Tak hanya desain dan performa penyejukan yang hemat, kemudahan perawatan pun menjadi fokus DAIKIN dalam pengembangan produk ini.  Dari sisi estetika, penempatannya yang menempel pada langit-langit (ceiling mounted cassette), memungkinkan pemiliknya memiliki fleksibilitas lebih dalam penataan dekorasi dinding yang biasanya harus terganggu dengan penempatan unit indoor AC single split. Apalagi dengan penampang depannya yang tampak simpel, mencuatkan kesan canggih sekaligus elegan bagi keseluruhan desain ruang.  Di balik kesan simpelnya ini, AC DAIKIN Sky Air Ceiling Mounted Cassette Round Flow menyimpan kemampuan performa penyejukan yang optimal. Pasalnya, bentuk membundar penampang depannya ini didesain mampu mengalirkan hembusan udara sejuk ke delapan penjuru. Tak hanya membuatnya dapat mencakup seluruh bagian ruangan tempatnya dipasang, namun pula didukung dengan kuat pendinginan yang merata di setiap sudutnya. Hal yang memberi keuntungan bagi pemilik usaha yang memperhitungkan keseluruhan biaya operasional dalam unit usahanya.Meski hadir dengan performa penyejukan mumpuni, pengguna tak perlu risau dengan besarnya konsumsi listrik. Hal ini karena seri AC DAIKIN Sky Air ini telah mengadopsi teknologi inverter pada kompresornya. Sebagai teknologi yang diakui dari berbagai pengujian lebih hemat listrik dibanding teknologi kompresor standar, membuat beban tagihan listrik penggunaan AC DAIKIN ini terhitung lebih rendah dalam pemakaian durasi panjang.  Peletakannya di langit-langit, tak lantas membuatnya kehilangan daya saat memberi kesejukan bagi aktivitas orang di dalam ruang mengingat ketinggiannya. Hal ini karena seri DAIKIN Sky Air Ceiling Mounted Cassette Round Flow ini telah dilengkapi pengaturan khusus yang membuatnya dapat menyesuaikan ketinggian dalam pemasangan. Hingga ketinggian 4.2 meter, AC DAIKIN Sky Air ini dapat mengalirkan kesejukan hingga menyentuh lantai.  Apalagi, melengkapi kemampuannya untuk mengalirkan kesejukan ke berbagai arah, AC Daikin berjenis cassette ini memiliki lima tingkatan laju kipas dalam mengalirkan udara sejuk. Bila pun tak ingin kerepotan berulang kali menyesuaikan laju kipas karena dinamika jumlah orang yang beraktivitas didalam ruang, seperti halnya café atau restoran, pengguna pun dapat memanfaatkan pengaturan Auto. Tersirat dari namanya, pengaturan ini akan membuat laju aliran udara secara otomatis menyesuaikan dengan tingkat beban. Nyaman dalam memberi kesejukan serta terhitung lebih hemat dari beban tagihan, tak lantas membuat DAIKIN alpa pada bagian penjagaan kesehatan pengguna dari berbagai partikel berbahaya bagi kesehatan. Salah satunya dari penggunaan silver ion anti-bacterial drain pan.Terletak pada tempat pengumpulan air dari hasil pengembunan evaporator, penggunaan silver ion yang ditaruh dalam wadah khusus ini berguna untuk mencegah tumbuhnya bakteri dan jamur yang mungkin menimbulkan bau tak sedap ataupun sumbatan. Di samping itu, AC DAIKIN Sky Air inverter ini juga dilengkapi filter anti bakteri dan jamur untuk mengeliminasi pertumbuhan jamur dan bakteri yang hadir bersama debu maupun kelembaban ruang.  Pemilik ruang usaha pun tak perlu ragu terkait dengan pemeliharaan. Berbeda dengan AC single split karena letaknya yang di langit-langit, tak membuat perawatan AC DAIKIN ini sulit dilakukan. Desain khusus unit indoor AC cassette ini membuat pemiliknya dapat melakukan perawatan dari penampang mukanya tanpa harus melepaskan banyak bagian dari unit. Penempatan outlet drain yang digunakan untuk memeriksa drain pan dan pengeringan air misalnya, diletakkan pada salah satu sudut penampang depan yang dapat dilihat setelah membuka grill AC.  Di sisi lain, teknologi microchannel heat exchanger diterapkan pada bagian penukar panas yang terbuat dari campuran alumunium. Selain lebih efisien dalam memindahkan panas, penggunaan campuran alumunium ini memberikan perlindungan lebih baik dari kemungkinan terjadinya karat. Hal yang memberikan keuntungan pada faktor ketahanan perangkat secara keseluruhan.  Dengan keseluruhan keunggulan yang ditawarkannya ini, tak heran bila kemudian AC DAIKIN Sky Air Ceiling Mounted Cassette Round Flow mudah meraih popularitasnya di kalangan pelaku usaha. Apalagi, AC DAIKIN ini tersedia dalam pilihan kapasitas pendinginan yang luas. Mulai dari 1.5 PK, 2 PK, 2.5 PK, 3 PK, 4 PK, 5 PK hingga 6 PK. Bagi peminat AC DAIKIN Sky Air ini, dapat mengunjungi jaringan dealer resmi DAIKIN yang tersebar di berbagai kota di Indonesia untuk meminang ataupun berkonsultasi langsung dengan tenaga ahli DAIKIN di sana.  (*)"
