title,date,author,link,category,website,content
"Tempat Karaoke di Jakarta Boleh Beroperasi Selama Ramadhan, Ini Jam Operasionalnya",02-4-2022,Delvira Hutabarat,https://www.liputan6.com/news/read/4927925/tempat-karaoke-di-jakarta-boleh-beroperasi-selama-ramadhan-ini-jam-operasionalnya,biasa,liputan,"Liputan6.com, Jakarta - Dinas Pariwisata dan Ekonomi Kreatif (Disparekraf) Provinsi DKI Jakarta menerbitkan Surat Edaran (SE) Nomor e-0001/SE/2022 Tentang Waktu Penyelenggaraan Usaha Pariwisata, pada Bulan Suci Ramadhan dan Hari Raya Idul Fitri Tahun 1443 H/2022 M.""Aturan ini dibuat untuk menghormati pelaksanaan Bulan Suci Ramadhan dan Hari Raya Idul Fitri, serta demi kebaikan bersama. SE ini mengatur jenis usaha dan jam operasional selama bulan Ramadan,"" kata Kepala Dinas Pariwisata dan Ekonomi Kreatif Provinsi DKI Jakarta Andhika Permata, Sabtu (2/4/2022).Andhika menyatakan, industri Pariwisata tetap dapat beroperasional, namun dengan beberapa penyesuaian.Salah satu aturan adalah untuk jenis usaha karaoke keluarga selama bulan Ramadhan, beroperasional mulai pukul 14.00 WIB sampai dengan pukul 21.00 WIB.""Jenis usaha bar/rumah minum yang berdiri sendiri dan yang menjadi fasilitas usaha karaoke, pub musik hidup (live music) tidak diperbolehkan menjual minuman beralkohol selama Ramadhan, kecuali diselenggarakan menyatu dengan area hotel minimal bintang 4,"" kata Andhika.Andhika menambahkan, akan ada sanksi bagi setiap pelanggaran. Yakni, mulai dari sanksi administratif hingga pencabutan tanda daftar usaha pariwisata bagi usaha yang melanggar ketentuan.""Diharapkan para pelaku usaha pariwisata di Jakarta dapat mengikuti aturan yang sudah ditetapkan agar suasana bulan Ramadhan hingga Hari Raya Idul Fitridi Jakarta tetap nyaman dan kondusif,"" jelas dia.Berikut aturan yang berlaku saat bulan Ramadhan untuk penyelenggaraan usaha pariwisata :- Tidak diperbolehkan memasang reklame/poster/publikasi/serta pertunjukan film dan pertunjukan lainnya yang bersifat pornografi, pornoaksi dan erotisme;- Tidak diperbolehkan menimbulkan gangguan terhadap lingkungan;- Tidak diperbolehkan menyediakan hadiah dalam bentuk dan jenis apapun;- Tidak diperbolehkan memberikan kesempatan untuk melakukan taruhan/perjudian, peredaran dan pemakaian narkoba;- Harus menghormati/menjaga suasana yang kondusif pada bulan Ramadhan dan Hari Raya Idul Fitri; dan- Mengharuskan setiap karyawan dan mengimbau pengunjung agar berpakaian sopan.Pemerintah melalui Kementerian Agama menetapkan 1 Ramadhan 1443 Hijriah jatuh pada 3 April 2022. Keputusan tersebut berdasarkan hasil sidang isbat penentuan awal puasa di Kementerian Agama, Jakarta.""Secara mufakat, 1 Ramadhan 1443 jatuh pada Ahad 3 April 2022 masehi,"" kata Menteri Agama Yaqut Cholil Qoumas dalam konferensi pers di Jakarta, Jumat (1/4/2022).Menag membeberkan alasan mengapa awal puasa Ramadhan 1443 H jatuh pada 3 April 2022. Menurut dia, ada dua perhitungan untuk mengetahui posisi ketinggian hilal yang digunakan Kemenag. Dua metode tersebut saling melengkapi, yaitu hisab dan rukyat.""Metode hisab atau dengan cara perhitungan dan metode rukyat atau dengan cara melihat langsung keberadaan hilal,"" kata dia. Hasilnya dalam kedua komponen itu, diketahui belum ada yang menjadi validasi untuk 1 Ramadhan jatuh pada 2 April 2022.""Informasi hitungan hisab telah dilaporkan sejumlah Kantor Kementerian Agama di daerah yang kita tempatkan pada 101 titik rukiyat di 34 provinsi. Dari 101 titik ini tidak ada yang melaporkan melihat hilal,"" jelas Yaqut.Kemudian terkait hisab, berdasarkan posisi hilal sudah harus berada di atas ufuk. Namun hal itu belum memenuhi kriteria MABIMS atau aturan yang disepakati bersama Menteri Agama Brunei Darussalam, Indonesia, Malaysia dan Singapura (MABIMS).""Hisab terlihat yaitu memiliki ketinggian minimal 3 derajat dan elongasinya minimal 6,4 derajat. Namun ketinggian hilal di seluruh wilayah Indonesia pada hari ini baru ada posisi antara 1 derajat 6,78 menit sampai dengan 2 derajat 10,02 menit,"" jelas Yaqut."
"Heboh Video Seorang Bapak Bungkus Sisa Makanan dari Restoran Mahal, Simpan Pesan Menyentuh",02-4-2022,Asnida Riani,https://www.liputan6.com/lifestyle/read/4927527/heboh-video-seorang-bapak-bungkus-sisa-makanan-dari-restoran-mahal-simpan-pesan-menyentuh,biasa,liputan,"Liputan6.com, Jakarta - Membungkus sisa makanan bukan kebiasaan yang dilakukan banyak orang, terlebih pengunjung restoran mahal. Namun, seorang bapak di India justru melakukan hal itu dengan membawa pesan menyentuh.""Ayah saya membungkus sisa makan ke dalam dabba (wadah makanan) tanpa rasa malu,"" tulis pemilik akun Instagram @nayana_premnath dalam unggahannya, baru-baru ini.Sementara di keterangan video tersebut, ia menuliskan narasi panjang. Ia berkomentar, ""Baca caption sebelum berkomentar! Kirim ini pada mereka yang malu melakukan ini! Yang masih malu mengemasi sisa makanan di depan teman atau keluarganya.""""Orangtua saya tidak berubah dalam semalam. Mungkin saya butuh tiga tahun penuh untuk melihat perubahan ini,"" ia menyambung. ""Hari ini, ibu saya adalah orang yang mengingatkan saya untuk mengambil dabba setiap kali kami pergi ke restoran.""""Adik saya membawa sedotan stainless sendiri untuk digunakan di kafe. Ayah saya mengejutkan saya dengan mengambil dabba dari saya dan memasukkan sisa makanannya sendiri. Ini membuat saya (merasa) paling bahagia,"" si pemilik akun menuliskan.""Dengan melakukan ini, ia mencegah kami membawa pulang sebungkus plastik makanan. Juga, ini terjadi di sebuah restoran yang sangat mahal,"" Premnath mengutarakan. ""Suami saya selalu mengatakan tidak pada botol air sekali pakai yang disimpan di meja restoran dan meminta air biasa untuk kami semua.""""Jika saya mempertahankan rasa malu dan menahan diri dari melakukan semua ini sejak awal, saya hampir yakin bahwa tidak satu pun dari kebiasaan ini akan dikembangkan oleh orang-orang dekat saya, selama bertahun-tahun. Tolong jangan malu untuk mengambil langkah berkelanjutan di depan orang yang Anda cintai,"" ia mengaku.Premnath menyambung, ""Bila mereka mengkritik Anda sekarang, mereka pasti akan melihat perubahan dan akhirnya menyadari bahwa itu bukan masalah besar dan mulai melakukannya sendiri. Ya, perubahannya mungkin lambat. Tapi Anda tetap melakukan apa yang Anda lakukan. Dan jangan menyimpan harapan apapun. Biarkan mereka menemukan langkah transformasi mereka.""""Apakah Anda membawa dabba Anda untuk membawa sisa makanan Anda setiap kali Anda pergi makan? Adakah latihan rutin lainnya yang Anda lakukan?"" ia menutup. Cerita Premnath tampak mendapat respons positif dari warganet. Banyak dari mereka yang mengatakan bahwa ini adalah ""ide genius."" Beberapa juga menyoroti kebiasaan ini dibangun dengan cara lebih sehat, karena selain mengurangi sampah makanan, wadah makanan yang digunakan juga bisa dipakai berulang kali dan tidak terbuat dari plastik.""Saya suka ini! Terutama bagian mereka mengkritik di awal, tapi segera mereka jadi bagian dari kebiasaan itu! Tidak ada jumlah debat dan kuliah yang dapat mencapai apa yang dapat dilakukan dengan memberi contoh,"" salah satu pengguna berkomentar.Di samping, langkah lebih berkelanjutan ini juga bisa dilakukan dimulai dari rumah Anda sendiri. Pertama, belanja seperlunya. Tidak perlu menyimpan stok makanan terlalu berlebihan yang berisiko terbuang karena rusak atau busuk. Kemudian, memasak sesuai porsi keluarga di rumah.Ketiga, mengambil makanan ke piring sesuai porsi masing-masing dan selalu menghabiskannya. Praktik ini juga bisa dibarengi dengan mindful eating yang dipercaya meningkatkan kesehatan pencernaan. Lalu, tahu cara menyimpan makanan yang benar agar tahan lama dan tidak mudah basi. Sebagai catatan, tidak semua bahan makanan harus masuk kulkas. Beberapa di antaranya justru akan lebih tahan lama jika disimpan dalam suhu ruang.Kelima, pintar berkreasi dengan sisa makanan agar bisa dikonsumsi sampai habis. Lagi-lagi, ini dilakukan agar tidak ada makanan sisa yang dibuang. Terakhir, berbagi makanan berlebih, entah ke keluarga maupun tetangga."
"Penjualan Properti Kembali Bergairah, Pengembang Semringah",02-4-2022,Liputan6.com,https://www.liputan6.com/bisnis/read/4927907/penjualan-properti-kembali-bergairah-pengembang-semringah,biasa,liputan,"Liputan6.com, Jakarta Keputusan Citra Swarna Group memilih Kota Serang, Banten, sebagai wilayah ekspansi pengembangan bisnis properti dinilai tepat. Hal ini terlihat dari penawaran perdana unit-unit rumah Citra Swarna Tembong City, langsung diserbu konsumen.Alhasil, sebanyak 250 unit rumah di Cluster Amara ludes hanya dalam waktu dua jam.Chief Marketing Officer (CMO) Citra Swarna Group, Hengky Japri mengungkapkan, animo masyarakat Kota Serang terbilang sangat tinggi. Konsumen telah mengambil antrean Nomor Urut Pemesanan (NUP) unit sejak Januari 2022 silam.“Buktinya, pemesan berlebih, dari 250 unit yang ditawarkan, kami berhasil mengumpulkan sebanyak 550 NUP. Kami berterima kasih atas kepercayaan masyarakat Serang, yang telah memilih Citra Swarna Tembong City sebagai hunian masa depan. Bersyukur, kami bisa mencetak penjualan yang fantastik, sold out ratusan unit di tengah pandemik seperti sekarang ini, serta ucapan terima kasih kepada pembeli tahap 1, selain itu mohon maaf untuk konsumen yang tidak kebagian unit, agar menunggu kehadiran tahap 2 dalam waktu dekat” ujarnya dikutip Sabtu (2/4/2022).Hengky menjelaskan, Amara merupakan klaster pertama di Kawasan perumahan Citra Swarna Tembong City yang dibangun di atas area 110 hektar. Unit-unit rumah pada klaster ini dibandrol dengan harga terjangkau, hanya Rp140 jutaan.Untuk memenuhi tingginya permintaan akan hunian terjangkau di Kota Serang dan sekitarnya.Citra Swarna Tembong City mengusung konsep every day is holiday.Melalui konsep ini, konsumen akan dimanjakan dengan berbagai fasilitas lengkap bernuansa alam yang dapat dinikmati setiap saat. Sejumlah fasilitas dimaksud antara lain Mini Zoo, Amphitheater Area, dan Commercial Area.Selain itu, memiliki suhu udara lebih sejuk nan menyehatkan karena dikelilingi view pegunungan serta danau alami lengkap dengan sarana olahraga air. Head Sales Citra Swarna Tembong City, Henri Wibisono menambahkan, Citra Swarna Tembong City dirancang dengan gaya desain arsitektur minimalis serta mengadaptasi unsur alam dan humanis. Sehingga, tergolong Kawasan hunian paling ideal bagi masyarakat Serang, Banten, yang lebih cenderung pada keseimbangan alam dan kehidupan berkualitas.Dikatakan, Citra Swarna Tembong City berada di Lokasi ideal, dekat akses jalan tol Jakarta-Merak, Stasiun Commuter Line Serang serta hanya selangkah ke pusat Kota Serang, pusat pemerintahan, pusat perbelanjaan, dan rumah sakit.“Dengan segala macam keunggulan yang dimiliki, tentunya akan menambah value edit dari proyek besutan Citra Swarna Group,” katanya.Citra Swarna Group merupakan pengembang properti yang sedang berkembang pesat, menjalankan bisnis properti pada beberapa wilayah di Jadebotabek dan Karawang. Hingga saat ini, perseroan telah sukses mengembangkan 18 proyek perumahan, antara lain Kartika Residence Karawang, Citra Swarna Grande Karawang, dan Citra Swarna Riverside Cileungsi, Bogor.“Berangkat dari kesuksesan tersebut, kini Citra Swarna Group mulai melebarkan sayap bisnis ke Kota Serang, Banten. Di sana, kami mengembangkan proyek kawasan perumahan yang diberi nama Citra Swarna Tembong City. Selanjutnya, tidak menutup kemungkinan, perseroan juga akan mengembangkan proyek properti di wilayah lain seluruh Indonesia,” pungkas Henri."
"Cara Bermain UNO dan Aturannya yang Benar, Pahami Fungsi Kartu",02-4-2022,Husnul Abdi,https://hot.liputan6.com/read/4927664/cara-bermain-uno-dan-aturannya-yang-benar-pahami-fungsi-kartu,biasa,liputan,"Liputan6.com, Jakarta Cara Bermain UNO perlu diketahui oleh orang-orang yang ingin memainkannya. Pasalnya, ada berbagai peraturan yang perlu diikuti saat kamu seru-seruan main kartu warna-warni ini. Main UNO menjadi pilihan yang tepat saat bersantai bersama teman-teman. Tidak jarang kamu melihat tersedianya kartu UNO di kafe-kafe, karena memang permainan ini cocok dimainkan sembari nongkrong bareng teman-teman. Bahkan, anak-anak hingga orang dewasa pun bisa ikut bermain karena UNO tidak begitu sulit dimainkan.Cara bermain UNO cukup mudah dipahami. Namun, sebelum bermain kamu tentu perlu memahami fungsi-fungsi dari setiap kartu. Melihat angka dan warna dari kartu UNO juga sangat penting dalam permainan ini.Berikut Liputan6.com rangkum dari berbagai sumber, Sabtu (2/4/2022) tentang cara bermain UNO.Sebelum mengenali cara bermain UNO, kamu perlu mengetahui penjelasan dari simbol-simbolnya terlebih dahulu. Seperti yang telah diketahui, dalam kartu UNO terdapat berbagai macam simbol, seperti angka, warna, +2, +4, reverse, skip, blank, wild, hingga blank.Setiap simbol pada kartu UNO tersebut memiliki fungsi masing-masing dan sangat penting dipahami sebagai cara bermain UNO. Berikut penjelasan simbol pada kartu UNO:1. Kartu angkaKartu angka memiliki 4 warna, yaitu merah, kuning, hijau, dan biru. Setiap kartu bertuliskan 1 angka mulai dari 0 sampai 9. Angka 1 hingga 9 memiliki 2 kartu di setiap warna. Sementara itu, angka 0 hanya berjumlah 1 kartu setiap warnanya. Jadi, total dari setiap warna adalah 19. Sehingga ada 19 merah, 19 kuning, 19 biru, dan 19 hijau.2. Kartu +2Kartu +2 digunakan ketika warna kartu teratas sama dengan warna kartu +2 yang kamu miliki, atau sama-sama merupakan kartu +2. Pemain selanjutnya yang terkena kartu ini dan tidak memiliki kartu +2 saat pemain sebelumnya mengeluarkan kartu +2, harus mengambil 2 kartu, dan tidak mendapat kesempatan bermain.3. Kartu reverse atau putar balikKartu reverse boleh dikeluarkan menyesuaikan warna kartu sebelumnya, atau bisa juga dikeluarkan saat ada sesama reverse card. Kartu ini berfungsi untuk mengubah arah permainan, misal sebelumnya kita bermain searah jarum jam. Dengan adanya kartu reverse, maka perputaran permainan harus berubah berlawanan. Sementara itu, jika hanya ada dua pemain, maka kartu ini berubah menjadi kartu skip, artinya kamu bisa bermain lagi setelah mengeluarkan kartu ini.4. Kartu skipUntuk mengeluarkan kartu skip juga perlu menyesuaikan warna atau simbol pada kartu sebelumnya. Fungsi dari kartu ini adalah memberhentikan pemain selanjutnya sesuai dengan jumlah kartu skip yang dikeluarkan. Kalau kartu ini keluar pada awal permainan maka pemain pertama yang ada di sebelah kiri pengocok tidak boleh bermain, langsung lanjut ke pemain kedua.5. Kartu +4Kartu +4 hanya boleh digunakan ketika kamu tidak memiliki kartu lain di tangan yang dapat dimainkan. Maksud dari kartu ini hampir sama dengan +2, namun kali ini yang harus diambil adalah 4 kartu. Selain itu, kamu juga diperbolehkan memilih warna yang akan dimainkan selanjutnya jika mengeluarkan kartu ini. Kartu ini tidak sah di awal permainan, jadi jika pada permulaan yang muncul adalah kartu ini maka harap untuk dimasukkan lagi ke tumpukan kartu dan diganti dengan kartu lain.6. Kartu wildKartu ini bisa dikeluarkan kapan saja, dan pada warna apa saja. Fungsinya hanyalah untuk mengganti atau memilih warna. Ini biasanya digunakan ketika pemain tidak mempunyai warna yang ada pada bagian atas kartu buangan. Jika kartu ini muncul pada permulaan permainan, pemain yang berada di sebelah kiri pengocok pada pemain pertama bisa bebas memilih warna apa yang ingin dia mainkan, kemudian mengeluarkan kartu pertamanya.7. Kartu blankKartu ini dapat digunakan sebagai pengganti kartu yang hilang. Misal kartu 7 kuning hilang, kamu bisa menggantinya dengan kartu kosong ini. Bisa juga dijadikan kartu lain dengan aturan yang kamu buat sendiri. Misalnya menjadi kartu keberuntungan yang bisa digunakan sesuka hati ketika hampir kalah, atau sebagai kartu mirror yang menduplikat kartu sebelumnya.Cara bermain UNO tidak begitu sulit untuk dipahami. Kamu juga bisa belajar dengan langsung praktik agar lebih cepat mengerti cara bermain UNO. Memahami cara bermain UNO akan membantu kamu untuk memenangkan permainan.Berikut cara bermain UNO:1. Kamu bisa bermain dengan 2 hingga 10 pemain. Setalah pemain terkumpul dan siap bermain, kocok kartu dan bagikan 7 kartu ke setiap pemain.2. Setelah itu, letakkan sisa kartu UNO di tengah meja. Pastikan kartu dalam keadaan tertutup dalam tumpukan. Nantinya, tumpukan kartu tersebut akan diambil masing-masing pemain sepanjang permainan.3. Selanjutnya, kamu bisa memulai pertandingan, balik kartu teratas di tumpukan kartu. Lalu, letakkan kartu teratas di sebelah tumpukan kartu dengan posisi menghadap ke atas.4. Cara bermain UNO berikutnya yaitu keluarkan kartu sesuai warna, simbol, atau angka pada kartu yang telah dibuka.5. Ambil kartu dari tumpukan jika kamu tidak memiliki kartu yang bisa dikeluarkan.6. Langkah selanjutnya tergantung pada kartu apa yang kamu keluarkan.- Jika mengeluarkan kartu wild, kamu dapat menentukan warna yang harus dimainkan pada giliran selanjutnya.- Jika kamu mengeluarkan kartu ""Ambil 2"" (+2), pemain berikutnya harus mengambil 2 kartu dan gilirannya dilewati.- Sementara itu, jika kamu mengeluarkan kartu “Reverse” atau ""Putar Balik"", arah giliran di balik, sehingga pemain yang bermain sebelum kamu mengeluarkan kartu kembali mendapatkan giliran.- Hal ini berlaku juga saat kamu mengelurkan kartu +4 dan skip. Langkah selanjutnya tergantung pada fungsi kartu-kartu spesial tersebut.7. Katakan ""UNO"" jika kamu tinggal menyisakan satu kartu di tangan. Pastikan untuk tetap memainkan giliran sampai seorang pemain memiliki satu kartu saja.8. Jika tidak mengatakan ""UNO"" di tahap ini, pemain lain yang mengetahuinya akan menghukum kamu. Namun, jika tidak ada pemain yang menyadari bahwa kamu tidak mengatakan ""UNO"", maka kamu tidak perlu mendapatkan hukuman.9. Jika kamu bisa mengeluarkan kartu terakhir sebelum orang lain selesai, maka kamu akan memenangkan permainan.10. Cara bermain UNO terakhir yaitu menghitung poin setiap ronde. Pemain yang memenangkan permainan akan mendapatkan poin dari jumlah kartu yang tersisa di tangan para pemain lain. Catat poin untuk setiap ronde dan tetap bermain sampai ada pemain yang bisa mencapai 500 poin."
"Klasemen Liga Inggris: Liverpool Bikin Manchester City Tidak Nyaman, MU di Luar 4 Besar",02-4-2022,Bogi Triyadi,https://www.liputan6.com/bola/read/4927876/klasemen-liga-inggris-liverpool-bikin-manchester-city-tidak-nyaman-mu-di-luar-4-besar,biasa,liputan,"Liputan6.com, Jakarta - Persaingan Manchester City dengan Liverpool dalam perburuan trofi Liga Inggris musim ini kembali dilanjutkan. Sebelumnya, persaingan itu sempat terhenti sementara selama dua pekan karena jeda internasional.Memasuki pekan ke-31, Manchester City masih menguasai puncak klasemen. Skuad besutan Pep Guardiola itu telah mengumpulkan 70 poin dari 29 pertandingan.Tapi, posisi Manchester City tidak aman. Karena, Liverpool yang berada urutan kedua kini hanya tertinggal satu poin.Di posisi ketiga ada Chelsa dengan 59 dan diikuti Arsenal yang terpaut empat poin. Kedua klub London ini baru memainkan 28 pertandingan.Tottenham Hotspur menempati urutan kelima dengan 51 poin. Sedangkan Manchester United atau MU di posisi keenam dengan 50 poin.Simak dan klasemen Liga Inggris di halaman berikutnya.Sabtu, 2 April 202218:30 WIB, Liverpool vs Watford21:00 WIB, Brighton & Hove Albion vs Norwich City21:00 WIB, Burnley vs Manchester City21:00 WIB, Chelsea vs Brentford21:00 WIB, Leeds United vs Southampton21:00 WIB, Wolverhampton Wanderers vs Aston Villa23:30 WIB, Manchester United vs Leicester City Minggu, 3 April 202220:00 WIB, West Ham United vs Everton22:30 WIB, Tottenham Hotspur vs Newcastle UnitedSenin, 5 April 202202:00 WIB, Crystal Palace vs Arsenal"
Pandji Pragiwaksono Sayangkan Warga Tanah Air yang Membela Aksi Will Smith Menampar Chris Rock,02-4-2022,Ruly Riantrisnanto,https://www.liputan6.com/showbiz/read/4927639/pandji-pragiwaksono-sayangkan-warga-tanah-air-yang-membela-aksi-will-smith-menampar-chris-rock,biasa,liputan,"Liputan6.com, Jakarta Komika Pandji Pragiwaksono menyorot insiden Will Smith menampar Chris Rock di Academy Awards ke-94 akibat melontarkan lelucon tentang istri Will Smith, Jada Pinkett Smith yang menyebut kepala plontosnya akibat penyakit autoimun, mirip dengan karakter G.I. Jane.Akibat aksi Will Smith di perhelatan Piala Oscar 2022 pada Senin (28/3/2022) lalu, masyarakat dunia sampai terpecah dua kubu. Ada yang membela aksi Will Smith, sebagian lagi menganggap lelucon Chris Rock tak seharusnya mendapatkan tamparan.Namun begitu, Pandji menyebut bahwa di Amerika Serikat, lebih banyak warganya yang membela Chris Rock. Pandji lantas menyayangkan warga Tanah Air yang menganggap aksi penamparan Will Smith sebagai tindakan yang wajar dalam rangka membela istrinya. Untuk mengetahui kebenaran informasi yang beredar, silakan WhatsApp ke nomor 0811 9787 670 hanya dengan ketik kata kunci yang diinginkan.Ungkapan tersebut disampaikan oleh Pandji saat komika yang tengah merintis karier di Amerika Serikat ini tampil di sebuah pentas. Di hadapan para penonton Indonesia, ia tampak menggunakan insiden Oscar 2022 sebagai materi stand up comedy-nya..""Ada komika idola gua ditampar sama idola gua satu lagi. Dua-duanya idola gue. Chris Rock lagi nge-beat. Ngomongin rambutnya, kepalanya Jeda Pinkett. Suaminya marah, ditampar,"" ujar Pandji mengawali lawakannya, mengintip akun TikTok @pandji.pragiwaksono. Pandji lantas berpendapat bahwa respons warga Indonesia yang membela Will Smith kurang tepat. Menurutnya, sesalah-salahnya Chris Rock dalam melontarkan lelucon, tak selayaknya ia mendapat perlakuan kasar seperti itu.""Habis itu yang bikin gua bingung, respons orang di Indonesia sama di Amerika tuh beda. Di Amerika, orang ngebelain Chris Rock, di Indonesia semua ngebelain Will Smith,"" ujar Pandji melanjutkan.""Orang Amerika ngebelain Chris Rock karena mereka tahu itu cuma jokes. Dan set***l-t***lnya jokes, enggak bisa dibenarkan untuk dipukul,"" sambung Pandji. Pandji lantas mengatakan bahwa tak sepatutnya aksi Will Smith mendapat pembelaan. Terlebih, di Tanah Air banyak yang justru menganggap Chris Rock pantas mendapatkan perlakuan seperti itu.""Orang Indonesia.... Semuanya belain Will Smith dengan tanggapan, 'Biarin aja kalau tersinggung, enggak apa-apa dipukul,'"" ceplos Pandji dengan nada tinggi. Pandji lantas mengaitkan hal tersebut dengan isu ketersinggungan di Indonesia yang hampir selalu diselesaikan dengan cara kekerasan atau fisik.""Susah memang kalau masih senang gebukin maling yang ketangkap,"" tulisnya sebagai keterangan video tersebut.Namun, dalam videonya Pandji melemparkan contoh yang cukup kocak terkait masalahnya dengan para pecinta kucing beberapa waktu lalu.""Masalahnya, di Indonesia tuh kasus-kasus tersinggung semuanya culun. Gue tersinggung gara-gara apa? Kucing. Kalau gue dipukul gara-gara kucing, yang malu gue,"" celetuknya disusul tawa penonton."
Perbarindo Luncurkan Transaksi Digital Permudah Layanan BPR-BPRS,02-4-2022,Liputan6.com,https://www.liputan6.com/bisnis/read/4927922/perbarindo-luncurkan-transaksi-digital-permudah-layanan-bpr-bprs,biasa,liputan,"Liputan6.com, Jakarta Perhimpunan Bank Perkreditan Rakyat Indonesia (Perbarindo) telah meluncurkan layanan berbasis digital yang diberi nama BPR e-cash dan BPR Digi.Hal ini sejalan dengan perkembangan bisnis dan teknologi yang semakin dinamis. Selain itu, Pandemi COVID-19 mendorong naiknya preferensi masyarakat menggunakan transaksi digital untuk layanan perbankan maupun berbelanja melalui aplikasi dan e-commerce.“Perhimpunan Bank Perkreditan Rakyat Indonesia (Perbarindo) berinovasi dengan merampungkan produk uang elektronik yang mempermudah transaksi untuk pembelian dan pembayaran beragam kebutuhan serta dilengkapi dengan QRIS,"" tegas Ketua Umum Perbarindo Joko Suyanto dalam keterangan tertulis di Jakarta, Sabtu (2/4/2022).Joko Suyanto menambahkan, Perbarindo juga telah mengembangkan produk BPR Digi, untuk menjawab kebutuhan masyakarat akan pelayanan transaksi yang mudah, cepat, sederhana dan aman.Produk BPR Digi merupakan produk layanan digital berbasis rekening (number of account) yang memberikan kemudahan akses informasi dan berbagai layanan transaksi kepada nasabah BPR, cukup menggunakan telepon seluler dan koneksi internet tanpa harus datang ke kantor BPR.Selain itu, launching produk tersebut merupakan komitmen dari Perbarindo untuk membawa dan mengawal Industri BPR – BPRS dalam meningkatkan service level dan daya saingnya.”Pengembangan teknologi merupakan sebuah keniscayaan bagi sebagian pelaku Industri BPR-BPRS, tapi kami akan terus mengupayakan hadirnya layanan berbasis digital untuk membawa BPR-BPRS naik kelas dengan bersinergi serta kolaborasi berbagai pihak ketiga,"" kata Joko Suyanto Sementara itu, Head of FNB & Microfinancing Telkomsigma, Dindin Syarifudin mengatakan, pihaknya hadir untuk menyediakan layanan berbasis digital yang mudah, murah, cepat, handal dan aman.“Kami hadir untuk bersinergi dengan Perbarindo beserta BPR – BPRS anggotanya untuk menyediakan layanan berbasis digital yang mudah, murah, cepat, handal dan aman. Kami siap mendukung program digitalisasi yang dilakukan oleh Perbarindo,"" katanya.Hal yang sama juga disampaikan oleh Rakhmad Tunggal Afifuddin, Direktur Utama PT Finnet Indonesia. Kedepan, Finnet akan mempererat hubungan dengan Perbarindo dalam menciptakan ekosistem digital untuk meningkatkan layanan digital bagi nasabah BPR-BPRS.Fitur-fitur transaksi akan terus kami kembangkan dengan melakukan penambahan fitur antara lain; Bill Payment Point, Instant Payment, P2P Transfer, dan Collection melalui aplikasi BPR E-Cash."
