title,date,author,link,category,website,content
Top 3 News: Puasa Ramadhan 1443 Hijriah Jatuh pada Minggu 3 April 2022,02-4-2022,Muhammad Ali,https://www.liputan6.com/news/read/4927887/top-3-news-puasa-ramadhan-1443-hijriah-jatuh-pada-minggu-3-april-2022,biasa,liputan,"Liputan6.com, Jakarta - Kementerian Agama (Kemenag) memutuskan 1 Ramadhan 1443 H jatuh Minggu 3 April 2022, setelah tim pemantau tidak melihat adanya hilal dari 101 titik yang tersebar di 34 provinsi di Tanah Air.Sementara itu, Muhammadiyah telah mengawali puasa Ramadhan pada Sabtu, 2 April 2022. Mengapa berbeda?Perbedaan tersebut karena adanya pedoman baru dari kesepakatan Menteri Agama Brunei Darussalam, Indonesia, Malaysia, dan Singapura (MABIMS) yang ditetapkan pada 2021.Adapun dimulainya awal puasa Ramadhan bagi Muhammadiyah didasarkan pada hasil hisab hakiki wujudul hilal yang dipedomani oleh Majelis Tarjih dan Tajdid Pimpinan Pusat Muhammadiyah. Berita mengenai perbedaan penetapan awal Ramadhan tersebut masuk dalam top 3 news. Berita terpopuler kedua di top 3 news, Jumat 1 April kemarin soal cerita warga Tangerang yang ikut merasakan getaran saat gempa mengguncang Bayah, Banten.Sementara itu, Rancangan Undang-Undang Sistem Pendidikan Nasional (RUU Sisdiknas) juga tak kalah menuai sorotan. Bagaimana tidak, kebijakan Kemendikbudristek tersebut telah menghilangkan kata madrasah dalam RUU tersebut. Sang Ketua Umum PB Perkumpulan Guru Madrasah Nasional Indonesia (PGMNI) pun angkat suara terkait hal ini. Heri Purnama menilai dengan dihilangkannya kata madrasah dalam RUU Sisdiknas disebut sebagai i'tikad tidak baik pemerintah terhadap keberlangsungan Madrasah. Berikut deretan berita terpopuler di kanal News Liputan6.com sepanjang Jumat, 1 April 2022:Puasa Ramadhan 2022 tinggal hitungan hari. Baik pemerintah maupun Muhammadiyah kemungkinan memiliki perbedaan terkait penetapan awal Ramadhan 1443 hijriah.Mengapa jadwal puasa Ramadhan tahun ini berbeda? Anggota Tim Unifikasi Kalender Hijriah Indonesia Kementerian Agama Thomas Djamaluddin menjelaskan, perbedaan tersebut karena adanya pedoman baru dari kesepakatan Menteri Agama Brunei Darussalam, Indonesia, Malaysia, dan Singapura (MABIMS) yang ditetapkan pada 2021.""Kalau masih menggunakan kriteria lama ini di bagian barat wilayah Indonesia, ini 1 April masih 2 derajat, kalau kriteria lama ada potensi dengan wujudul hilal, tapi kalau lihat garis ini ada potensi perbedaan,"" ujar Thomas. Sementara itu, awal puasa untuk Muhammadiyah akan dimulai esok hari, Sabtu 2 April 2022 yang diketahui berdasarkan hasil hisab hakiki wujudul hilal yang dipedomani oleh Majelis Tarjih dan Tajdid Pimpinan Pusat Muhammadiyah.Dengan awal puasa Ramadhan 1443 H yang jatuh pada Sabtu, 2 April esok, maka warga Muhammadiyah akan melaksanakan salat tarawih perdana pada malam ini, Jumat (1/4/2022). Selengkapnya.... Gempa bumi dengan magnitudo 5,1 yang berpusat di Bayah, Banten, terasa sampai wilayah Tangerang dan sebagian Jakarta, Jumat (1/4/2022). Lindu terjadi pada pukul 14.14 WB.Seperti dirasakan oleh Fajar Aditya, yang saat kejadian berada di Gedung PU Puspemkab Tangerang.""Lagi nyender di tangga, kok pusing, goyang. Enggak taunya gempa bumi, terasanya sebentar sih,"" kata Fajar.Karena dirasakan sebentar, tidak ada evakuasi yang dilakukan di gedung tersebut. Selengkapnya...Kemendikbudristek kembali menjadi sorotan. Setelah berbagai kebijakannya menuai kegaduhan, kini Rancangan Undang-Undang Sistem Pendidikan Nasional (RUU Sisdiknas) juga memunculkan gelombang protes dari banyak pihak.Masyarakat menolak hilangnya kata Madrasah dalam RUU Sisdiknas tersebut. Hilangnya frasa itu dianggap sebagai bentuk i'tikad tak baik pemerintah terhadap keberlangsungan Madrasah.""Meghilangkan nama madrasah dalam RUU Sisdiknas, sama saja dengan mau menghilangkan madrasah dari negeri ini, menghilangkan guru, anak dan santri serta siswa, juga anggaran pendidikan untuk madrasah,"" kata Ketua Umum PB Perkumpulan Guru Madrasah Nasional Indonesia (PGMNI), Heri Purnama saat dihubungi Liputan6.com, Kamis (31/3/2022).Menurut dia, RUU Sisdiknas yang beredar di tengah masyarakat ini dapat memicu emosi seluruh komunitas guru-guru madrasah. PGMNI mencatat, ada 1.000.050 guru yang tersebar di hampir 16 juta madrasah di seluruh Indonesia yang akan merasakan dampak RUU ini.Heri menuturkan, dengan tidak mencantumkan kata madrasah dalam RUU Sisdiknas, akan berdampak kepada seluruh steakholdernya. Selain itu, payung hukum yang menjadi landasan kegiatan belajar mengajar di madrasah juga akan hilang. Selengkapnya..."
"Bangkitkan UMKM Indonesia Timur, BPR dan Fintech Bersinergi Gelontorkan Kredit",02-4-2022,Liputan6.com,https://www.liputan6.com/bisnis/read/4927888/bangkitkan-umkm-indonesia-timur-bpr-dan-fintech-bersinergi-gelontorkan-kredit,biasa,liputan,"Liputan6.com, Jakarta PT BPR Kredit Mandiri Celebes Sejahtera menunjukkan komitmennya untuk mendukung perekonomian masyarakat khususnya melalui pinjaman produktif dengan menjalin kerja sama dengan salah satu penyelenggara peer to peer lending, Esta Kapital.Dengan kerja sama tersebut, BPR Kredit Mandiri Celebes Sejahtera menjadi BPR pertama di Sulawesi Utara yang menjalin kerja sama dengan fintech peer to peer lending.BPR Kredit Mandiri Celebes Sejahtera menilai Esta Kapital memiliki komitmen yang tinggi untuk mendukung sektor UMKM di Indonesia Timur.Sejak awal berdiri sampai dengan akhir Januari 2022, Esta Kapital telah menyalurkan lebih dari Rp 45 miliar kepada lebih dari 11 ribu Peminjam yang berada di Indonesia Timur.Melihat hal tersebut, BPR Kredit Mandiri Celebes Sejahtera menggandeng Esta Kapital untuk mendukung visi dan misinya dalam memberikan kemudahan dan mendukung perekonomian masyarakat Indonesia Timur.“Berdasarkan data BPS, Indonesia Timur menyumbang 12,16 persen atas pertumbuhan ekonomi Indonesia di triwulan IV tahun 2021; dengan Sulawesi yang mengalami pertumbuhan sebesar 5,67 persen; Maluku dan Papua mengalami pertumbuhan sebesar 10,09 persen; serta Bali dan Nusa Tenggara yang mengalami pertumbuhan sebesar 0,07 persen. Hal ini merupakan sebuah kondisi yang dapat dimaksimalkan, oleh karena itu kami menggandeng Esta Kapital untuk mendukung pelaku UMKM di Indonesia Timur,"" ungkap Direktur Utama BPR Kredit Mandiri Celebes Sejahtera, Yenny dalam keterangan tertulis di Jakarta, Sabtu (2/4/2022).Sejak awal berdiri pada tahun 2010, BPR Kredit Mandiri Celebes Sejahtera berkomitmen untuk memberikan layanan keuangan yang prima kepada masyarakat, di samping itu pemberian layanan kredit yang mudah ditujukan agar dapat meningkatkan taraf hidup masyarakat yang lebih baik. Sementara Esta Kapital sendiri merupakan penyelenggara peer to peer lending produktif, yang memberikan pinjaman kepada pelaku UMKM di seluruh wilayah Indonesia.Sejak awal beroperasi pada tahun 2018 sampai dengan Januari 2022, Esta Kapital telah menyalurkan pinjaman lebih dari 167,8 miliar rupiah kepada lebih dari 44 ribu peminjam.“Kami melihat Esta Kapital memiliki potensi yang besar untuk menjangkau masyarakat di Indonesia Timur, terkhususnya pelaku UMKM, yang tidak bisa kami jangkau sendiri. Kami berharap dengan kerja sama ini, semakin banyak pelaku UMKM di Indonesia Timur yang dapat terbantu dan meningkat perekonomiannya”, tutup Yenny."
"5 Artis yang Wakili Indonesia di Acara Internasional, Terbaru Maudy Ayunda di G20",02-4-2022,Loudia Mahartika,https://hot.liputan6.com/read/4927852/5-artis-yang-wakili-indonesia-di-acara-internasional-terbaru-maudy-ayunda-di-g20,biasa,liputan,"Liputan6.com, Jakarta Aktris sekaligus penyanyi, Maudy Ayunda, baru saja membuat penggemarnya bangga. Gadis lulusan Master of Business Administration dan Master of Arts in Education di Universitas Stanford ini ditunjuk sebagai Juru Bicara (Jubir) Pemerintah untuk Presidensi G20 Indonesia. ""Tugas sejarah ini harus disambut sukacita dan optimisme. Tidak butuh waktu lama untuk saya menyetujui sebagai bagian dari tim Juru Bicara untuk Presidensi G20,"" ungkap Maudy Ayunda dalam konferensi pers di Youtube Sekretariat Presiden, Kamis (31/3/2022).Pengumuman terpilihnya aktris kelahiran 1994 ini disampaikan langsung oleh Menkominfo Johnny G Plate. Maudy Ayunda selain memiliki paras cantik, ia juga dikenal sebagai publik figur milenial yang cerdas dan punya banyak prestasi.Rupanya Maudy Ayunda bukanlah artis pertama yang ditunjuk sebagai perwakilan Indonesia di acara internasional. beberapa artis berbakat lainnya juga diekthaui pernah dipilih untuk berbagai acara. Berikut ini 5 artis Tanah Air yang pernh wakili Indonesia di acara internasional, dirangkum dari berbagai sumber oleh Liputan6.com, Sabtu (2/4/2022)."
Jadwal Liga Italia: Duel Seru Juventus Vs Inter Milan,02-4-2022,Luthfie Febrianto,https://www.liputan6.com/bola/read/4927787/jadwal-liga-italia-duel-seru-juventus-vs-inter-milan,biasa,liputan,"Liputan6.com, Jakarta Liga Italia pekan ke-31 akan diwarnai duel seru antara Juventus vs Inter Milan, Senin (4/4/2022) dinihari WIB. Kedua tim sedang berada di papan atas klasemen saat ini.Bagi Inter Milan, duel ini sangat krusial. Pasalnya, mereka sedang bersaing memperebutkan gelar juara Liga Italia.Inter Milan sejatinya menempati peringkat pertama di awal-awal musim. Namun performa skuat polesan Simone Inzaghi mendadak inkonsisten memasuki pertengahan musim.Alhasil, mereka kini berada di peringkat ketiga dengan 60 poin. Nerazzurri tertinggal enam poin dari AC Milan yang berada di pucuk klasemen.Di sisi lain, Juventus juga berkepentingan di laga ini. Bianconeri ingin finis di peringkat empat agar masuk ke zona Liga Champions.Juventus baru mengemas 59 poin dari 30 pertandingan. Secara matematis, Juventus masih bisa berpeluang juara.Namun peluang itu tak sepenuhnya ada di tangan mereka. Berikut jadwal lengkap Liga Italia akhir pekan ini.   Sabtu 2 April 202220.00 WIB, Spezia vs Verona23.00 WIB, Lazio vs Sassuolo Minggu 3 April 202201.45 WIB, Salernitana vs Torino17.30 WIB, Fiorentina vs Empoli20.00 WIB, Atalanta vs Napoli20.00 WIB, Udinese vs Cagliari23.00 WIB, Sampdoria vs AS RomaSenin 4 April 202201.45 WIB, Juventus vs Inter Milan23.30 WIB, Hellas Verona vs Genoa"
"Gandeng Kaesang Pangarep, Raffi Ahmad Siap Kembangkan Bisnis Kuliner",02-4-2022,Sapto Purnomo,https://www.liputan6.com/showbiz/read/4927706/gandeng-kaesang-pangarep-raffi-ahmad-siap-kembangkan-bisnis-kuliner,biasa,liputan,"Liputan6.com, Jakarta Raffi Ahmad gandeng putra bungsu Presiden Joko Widodo (Jokowi), Kaesang Pangarep, untuk membangun bisnis kuliner. Proyek terbarunya itu akan diluncurkan oleh pria 35 tahun tersebut usai Ramadan 2022.Suami Nagita Slavina mengatakan, bisnis kulinernya kali ini akan berbeda dari yang lain. Dengan penuh keyakinan, Raffi Ahmad menyebut bisnis kulinernya akan diminati banyak orang.""Nanti habis Lebaran kita akan melakukan gebrakan di bidang F&B (food and beverage), gebrakan yang sangat luar biasa,"" kata Raffi Ahmad dalam konferensi pers di Hotel Midplaza, Jakarta Pusat, Jumat (1/4/2022). Untuk mengetahui kebenaran informasi yang beredar, silakan WhatsApp ke nomor 0811 9787 670 hanya dengan ketik kata kunci yang diinginkan.Sebagai komisaris Rans Entertainment, Kaesang Pangarep melihat bisnis kuliner sangat menjanjikan. Ia memastikan bisnis kulinernya nanti akan memiliki cabang di seluruh Indonesia.""Ke depannya kami pengin membuat F&B sendiri di mana kita akan membuka ratusan cabang di Indonesia yang insya Allah bisa dinikmati oleh seluruh masyarakat di Indonesia,"" ujar Kaesang. Terus berinovasi dan membuat gebrakan baru adalah tujuan Rans Entertainment. Apalagi, saat ini dirinya terus belajar dan berkolaborasi dengan banyak pihak untuk mewujudkan impiannya membangun kerajaan bisnis.""Kita akan berkolaborasi sebanyak-banyaknya, jangan mudah puas apalagi kalau kita berada di zona nyaman terus,"" kata Raffi Ahmad.Tak hanya dibidang kuliner, Raffi Ahmad akan terus mengepakan bisnisnya dibidang lain. Yang terbaru Rans Entertaimen  meluncurkan sebuah game bertajuk RansVerse.""Kita mencoba menggabungkan tim-tim yang spesialnya di bidang itu. Jadi kolaborasinya kita memberikan value masing-masing untuk menjadikan proyek ini lancar,"" kata Raffi Ahmad"
"Saham WOMF Melonjak 49,18 Persen pada 28 Maret-1 April 2022, Ada Apa?",02-4-2022,Agustina Melani,https://www.liputan6.com/saham/read/4927841/saham-womf-melonjak-4918-persen-pada-28-maret-1-april-2022-ada-apa,biasa,liputan,"Liputan6.com, Jakarta - Harga saham PT Wahana Ottomitra Multiartha Tbk (WOMF) melonjak signifikan pada 28 Maret-1 April 2022. Kenaikan harga saham Wahana Ottomitra Multiartha ini juga di tengah pekan ini mulai cum dividen atau periode perdagangan saham yang mengandung hak dividen tunai untuk perdagangan di pasar regular dan tunai pada 1 April 2022.Mengutip data RTI, saham WOMF melambung 49,18 persen pada 28 Maret-1 April 2022. Saham WOMF naik ke posisi Rp 364 per saham. Saham WOMF berada di level tertinggi Rp 460 per saham dan terendah Rp 242 per saham. Total volume perdagangan  saham 91.614.200 saham dengan frekuensi perdagangan 12.337. Nilai transaksi Rp 33,8 miliar.Pada pekan ini, saham WOMF alami kenaikan tiga hari berturut-turut. Saham WOMF naik 2,46 persen pada 29 Maret 2022 ke posisi Rp 250 per saham. Kemudian saham WOMF melonjak 24,80 persen ke posisi Rp 312 per saham. Selanjutnya saham WOMF naik 25 persen ke posisi Rp 390 per saham.Namun, saham WOMF melemah saat memasuki cum dividen pada 1 April 2022. Saham WOMF turun 6,67 persen ke posisi Rp 364 per saham.Sepanjang tahun berjalan 2022, saham WOMF menguat 47,97 persen ke posisi Rp 364 per saham. Total volume perdagangan 107.140.922 saham. Nilai transaksi harian Rp 37,5 miliar. Total frekuensi perdagangan 15.975 kali.Adapun PT Wahana Ottomitra Multiartha Tbk membagikan dividen tunai Rp 9,5 per saham. Dividen itu 30 persen dari laba bersih tahun buku 2021 sebesar Rp 33,18 miliar. Hal itu telah disetujui dalam Rapat Umum Pemegang Saham Tahunan (RUPST) WOMF pada 24 Maret 2022.  Berikut jadwal pembayaran dividen tunai:-Periode perdagangan saham yang mengandung hak dividen tunai (cum) untuk perdagangan pada pasar regular dan pasar negosiasi pada 1 April 2022-Periode perdagangan saham yang mengandung hak dividen tunai (cum) untuk perdagangan pada pasar tunai pada 5 April 2022-Periode perdagangan saham yang tidak mengandung dividen tunai (ex) untuk perdagangan pada pasar regular dan pasar negosiasi pada 4 April 2022-Periode perdagangan saham yang tidak mengandung dividen tunai (ex) untuk perdagangan tunai pada 6 April 2022-Tanggal daftar pemegang saham yang berhak menerima dividen tunai pada 5 April 2022-Tanggal pembayaran dividen tunai pada 27 April 2022"
"Pengguna Rugi Rp73 Miliar, Perusahaan Robot Trading DNA Pro Dilaporkan ke Bareskrim",02-4-2022,Muhammad Radityo Priyasmoro,https://www.liputan6.com/news/read/4927867/pengguna-rugi-rp73-miliar-perusahaan-robot-trading-dna-pro-dilaporkan-ke-bareskrim,biasa,liputan,"Liputan6.com, Jakarta - Sebanyak 242 orang pengguna robot trading dari perusahaan DNA Pro mengaku telah merugi hingga Rp73 miliar. Akibat hal tersebut, mereka melaporkan dugaan tersebut kepada Bareskrim Polri.""Kami di sini diberikan kuasa sebanyak 242 orang dengan kerugian 73 miliar lebih lah ya,"" kata kuasa hukum korban, Juda Sihotang dari LQ Indonesia Law Firm di Gedung Bareskrim Polri, Jakarta Selatan, Jumat (1/4/2022).Juda menjelaskan, laporannya digabungkan dengan laporan yang sebelumnya sudah terdaftar di Bareskrim Polri dengan nomor register B/185/IV/RES.2.1/2022/Dittipideksus. Dia mengatakan, pihaknya telah menyerahkan sejumlah barang bukti berupa nomor rekening pihak-pihak DNA Pro.""Kita langsung menyerahkan berkas beserta bukti-buktinya dan saya serahkan semua nomor rekening mulai dari founder, co-founder, leader dari PT nasabah DNA, saat itu juga langsung diblokir semua,"" jelas Juda.Juda mengungkap para korban telah bergabung DNA Pro sejak April 2021 hingga Januari 2022. Mereka diiming-imingi investasi yang bisa dicairkan kapan saja tanpa batas.Namun sejak Kantor DNA Pro disegel Polri pada 28 Januari 2022, para pengguna robot trading ini tidak dapat mengambil uang mereka. Akibat hal tersebut, sebanyak 56 orang dilaporkan. Mulai dari pendiri PT DNA, komisaris, direksi, founder, direksi utama, dan co founder, leader bahkan top leader.Pasal yang dipersangkakan dalam laporan adalah Pasal 3, 4, 5 UU RI Nomor 8 Tahun 2010 tentang tindak pidana pencucian uang (TPPU). Para korban tersebar di beberapa wilayah di Indonesia, seperti Papua, Ambon, Medan, Surabaya, Jember semua ada, Bali, dan Bandung.  Sebanyak 15 orang mendatangi Polda Metro Jaya. Mereka mengaku dirugikan platform robot Trading DNA Pro yang totalnya mencapai Rp 7 miliar.""Jadi hari ini melaporkan kasus dugaan investasi bodong dalam robot trading DNA Pro. Saya mendampingi kurang lebih 15 orang yang memberikan kuasa,"" kata pendamping korban, Charlie Wijaya kepada wartawan di Mapolda Metro Jaya, Jakarta, Selasa (29/3/2022).Charlie memastikan, laporan itu telah diterima pihak kepolisian dengan nomor LP/B/1603/III/2022/SPKT/Polda Metro Jaya tanggal 29 Maret 2022. Charlie juga menjelaskan, bertindak sebagai pelapor dalam LP tersebut beinisial RD dan nama terlapor tertulis dalam lidik.Terkait modus kejahatan, urai Charlie, para korban awalnya tertarik karena keuntungan yang menggiurkan jika menggunakan robot trading DNA Pro. Menurut pengakuan korban, selain akan mendapat keuntungan besar, DNA Pro mengklaim sudah legal beroperasi di Indonesia.""Dalam DNA Pro ini mereka digiurkan dengan withdraw yang tak terhingga dan uniknya DNA Pro di dalam aplikasinya masih utuh namun tidak bisa withdraw dan tidak bisa transfer ke rekening masing-masing,"" Charlie menutup.Terkait hal ini, pasal disangkakan dalam laporan adalah Pasal 28 ayat 1 junto Pasal 45A ayat 1 UU RI nomor 19 tahun 2016 tentang ITE dan atau Pasal 3, 4, 5 UU RI nomor 8 tahun 2010 tentang TPPU."
"Mazda CX-5 Baru Resmi Meluncur di Indonesia, Harga Mulai Rp 597,7 Juta",02-4-2022,Arief Aszhari,https://www.liputan6.com/otomotif/read/4927498/mazda-cx-5-baru-resmi-meluncur-di-indonesia-harga-mulai-rp-5977-juta,biasa,liputan,"Liputan6.com, Jakarta - PT Eurokars Motor Indonesia (EMI) resmi meluncurkan sport utility bvehicle (SUV) terbarunya, new Mazda CX-5. Model ini, hadir dengan tampilan yang lebih mewah, serta beragam fitur canggih.""Hari ini kami sangat senang memperkenalkan new Mazda CX-5, produk unggulan yang telah disempurnakan dan mengedepankan 7G concept dengan inovasi, kreativitas, dan teknologi terbaik yang menyempurnakan model ini sebagai Premium SUV terbaik di kelasnya,"" tegas Ricky Thio, Managing Director PT EMI, saat peluncuran secara virtual, ditulis Sabtu (2//4/2022).Sejak diluncurkan pertama kali pada 2017, Mazda CX-5 terus berkembang menjadi model utama yang memberikan kontribusi penjualan di Indonesia melalui keunggulan fitur, teknologi, dan desain.Tampilan CX-5 terbaru ini lebih agresif dan semakin mewah. Fascia depan, grafis lampu utama berubah dengan LED DRL (Daytime Running Lights) berbentuk L ganda. Kisi-kisi grille juga berubah, menonjolkan titik-titik horizontal tetap dengan kesan tiga dimensi dan mempertahankan frame berwarna krom tebal.Di bagian interior, mendapat peningkatan dari sisi kekedapan, yang membuat kenyamanan dalam perjalanan semakin mewah. Panel instrumen baru menampilkan display digital di bagian tengah, seperti Mazda3, CX-30 dan CX-9 versi baru.Display ini selain menjadi pusat MID (multi information display) yang interaktif, juga terintegrasi dengan fungsi fitur keselamatan di i-Activsense. Penumpang Mazda CX-5 kini bisa menikmati fitur wireless charger di konsol tengah. Fitur keselamatan meliputi rangkaian teknologi dari i-Activsense kini ditambah hadirnya Mazda Radar Cruise Control (MRCC), Lane Departure Warning System (LDWS), Lane Keep Assist (LKA), dan Cruising and Traffic Support. Tidak ketinggalan juga fitur Adaptive LED Headlamp Smart City Brake Support (SCBS) dan Blind Spot Monitor (BSM). Keamanan dan keselamatan berkendara bersama CX-5 semakin terjamin.Jantung penggeraknya, Mazda CX-5 ini dilengkapi dengan teknologi Cylinder Deactivation pada mesin Skyactiv-G 4 silinder 2.5 liternya. Mesin berbahan bakar bensin ini bisa sementara mematikan dua silindernya saat kondisi melaju konstan, untuk mengurangi konsumsi bahan bakar. Sementara output yang dihasilkan, yaitu 190 hp untuk tenaganya dan 252 Nm pada torsi yang disalurkan ke roda depan via transmisi Skyactiv-Drive 6-percepatan.Mazda sudah membuka pemesanan, dengan harga yang ditawarkan Rp 597,7 juta (OTR Jakarta) untuk New Mazda CX-5 Elite. Sementara untuk yang lebih eksklusif, ditawarkan varian CX-5 Kuro dengan banderol Rp 607,7 juta."
"Insiden Will Smith di Oscar 2022 Bawa Berkah untuk Karier Chris Rock, Benarkah?",02-4-2022,Fany Triany,https://www.liputan6.com/citizen6/read/4926581/insiden-will-smith-di-oscar-2022-bawa-berkah-untuk-karier-chris-rock-benarkah,biasa,liputan,"Liputan6.com, Jakarta - Serangan di atas panggung yang dilakukan Will Smith terhadap Chris Rock sangat mengejutkan publik. Aksi Will Smith pun membuat publik berdebat dan menganalisis situasi untuk melihat siapa yang benar dan salah.Insiden tersebut pun menjadi berita terpanas di dunia hiburan selama empat hari terakhir. Berawal dari sototan media dan respons penggemar, kejadian yang berlangsung cepat itu membawa dampak yang tak terduga.Hingga saat ini, video Will Smith menampar Chris Rock telah dilihat lebih dari 65 juta views. Insiden itu juga disebut-sebut telah menyelamatkan acara penghargaan Oscar dan keuntungan bagi Chris Rock, seperti mengutip dari Kbizoom, Jumat (1/4/2022). 0811 9787 670 hanya dengan ketik kata kunci yang diinginkan.Chris Rock tiba-tiba menjadi orang yang diuntungkan setelah tindakan kekerasan Will Smith kepada dirinya. Media dan penggemar langsung membedah sekaligus menganalisis insiden itu.Menurut NY Post, harga tiket dan permintaan untuk pertunjukan Chris Rock meningkat secara signifikan setelah tamparan yang dilayangkan oleh Will Smith.Ada banyak pendapat bahwa karir Will Smith akan menurun karena tindakannya tersebut. Namun, berbeda dengan situasi Smith, penggemar memuji atas perofesionalisme Rock dan pilihannya untuk tidak membalas pukulan aktor terkenal itu di panggung.Sikap yang diambil komedian Chris Rock, menuai pujian sangat besar. Hingga kini banyak dugaan bahwa karir Rock akan sangat melejit kedepannya.Tak hanya Rock yang diuntungkan dalam kejadian buruk itu. Menurut data analis Nielsen, acara Academy Awards ke-94 tersebut menduduki peringkat 2. Jika di bandingkan tahun lalu, acara penghargaan ini menunjukkan peningkatan hingga 56%.Kurang dari satu hari, video Rock yang kena tampar oleh Smith mencapai lebih dari 65 juta views. Jumlah tersebut bahkan mengalahkan video musik penyanyi atau grup band terkenal.Platform media seperti Facebook, Twitter, Weibo, Instagram dan lainnya pun berhasil menciptakan efek luar biasa dan membuat nama Chris Rock, Oscar, bahkan Will Smith tersebar luas di mana-mana."
"Telepon Uni Eropa, Presiden China Xi Jinping Janjikan Perdamaian di Ukraina",02-4-2022,Hariz Barak,https://www.liputan6.com/global/read/4927836/telepon-uni-eropa-presiden-china-xi-jinping-janjikan-perdamaian-di-ukraina,biasa,liputan,"Liputan6.com, Beijing - Presiden China Xi Jinping menelepon Presiden Dewan Eropa Charles Michel dan Presiden Komisi Eropa Ursula von der Layen, Jumat malam untuk membicarakan krisis Ukraina.""Krisis Ukraina terjadi di tengah pandemi COVID-19 yang berlarut-larut sehingga menggoyahkan upaya pemulihan global,"" kata Xi sebagaimana dikutip dari Antara, Sabtu (2/4/2022).Oleh sebab itu, dia mengajak Uni Eropa agar terus menjalin komunikasi dan berperan positif untuk menjaga stabilitas global.""China dan Uni Eropa itu merupakan kekuatan besar, pasar yang besar, dan memiliki peradaban yang besar pula,"" ujar Xi sebagaimana pernyataan tertulisnya yang diterima ANTARA Beijing dari Kementerian Luar Negeri China (MFA). Presiden Xi Jinping juga mempersilakan Uni Eropa membangun persepsinya sendiri tentang China, mengambil kebijakan tentang China secara independen dan meningkatkan kerja samanya dengan China.Pada sore harinya, Perdana Menteri China Li Keqiang juga menjalin komunikasi via telepon dengan kedua pemimpin Uni Eropa tersebut.Keduanya menyatakan kesiapan untuk mempererat kerja sama dengan China di berbagai bidang, di antaranya penanganan COVID-19, ekonomi dan perdagangan, dan investasi.Dalam dua tahun berturut-turut, nilai perdagangan Uni Eropa dengan China lebih rendah dibandingkan dengan ASEAN-China."
